,Post_ID,Comment,Created_Time,Comment_ID,Commenter_ID,Likes
1808,178524104062_10201214143348100,Congratulations SFC. Morris!,2014-03-19T05:37:36+0000,10201214143348100_56908193,930831180267067,1
1809,178524104062_10201214143348100,Awesome!!!!,2014-03-14T00:59:28+0000,10201214143348100_56892129,864361610248269,1
1810,178524104062_10201214143348100,"Outstanding, I salute you Warrior.",2014-03-13T17:36:58+0000,10201214143348100_56890899,10152325767014663,1
1811,178524104062_10201214143348100,HOOAH!!,2014-03-13T17:26:13+0000,10201214143348100_56890862,1096806550346640,1
1812,178524104062_10152311903709063,My deceased Aunt was in the Navy in North Africa in WWII - very proud of her - she met my Uncle there & they were blessed with many happy years together!,2014-03-13T14:45:20+0000,10152311903709063_13271077,10203519637905442,1
1813,178524104062_10201204120537536,"Me too, Joe!  USASMA Class # 36.",2014-03-11T20:38:29+0000,10201204120537536_56884508,652487758160707,1
1814,178524104062_10201204120537536,WOW!  How I miss those days at USASMA.   Fond Memories   JStory Class33,2014-03-11T18:58:10+0000,10201204120537536_56884269,874111895956782,1
1815,178524104062_10201204120537536,Hooah!,2014-03-11T16:11:36+0000,10201204120537536_56883870,93084902383,1
1816,178524104062_10152307411144063,"I Shall Return,and he did.",2014-03-12T21:04:15+0000,10152307411144063_30529881,597086500417651,0
1817,178524104062_10201200862096077,Start with the PFC hiding in car to keep from saluting,2014-03-11T01:16:45+0000,10201200862096077_56882130,720886547934744,0
1818,178524104062_10152305496694063,"Have to agree. ""Integrity first.""",2014-03-11T01:43:05+0000,10152305496694063_13253850,10203224213200611,1
1819,178524104062_10152305496694063,The quote isn't about leadership. He is talking about a general quality of all soldiers.,2014-03-11T10:35:21+0000,10152305496694063_13255556,10203224213200611,0
1820,178524104062_10152305496694063,... but integrity is a question of character and not leadership.,2014-03-11T06:51:07+0000,10152305496694063_13254896,10152321492923901,0
1821,178524104062_10152293043609063,Terbaek...visit malaysia 2014...,2014-03-06T07:45:23+0000,10152293043609063_13214955,878524672178301,1
1822,178524104062_10152293043609063,Great skot,2014-03-05T14:49:36+0000,10152293043609063_13207709,1259246924167187,1
1823,178524104062_10152293043609063,Good jobs!,2014-03-05T07:38:05+0000,10152293043609063_13205798,10152739741220789,1
1824,178524104062_10201149628935280,I was there,2014-02-28T15:35:07+0000,10201149628935280_56848469,10202970461396062,1
1825,178524104062_10201144901857106,Have loved the Stryker ever since I tested the very first onessent to Lewis back in '02. Exceptional asset and it only continues to improve.,2014-02-27T23:54:12+0000,10201144901857106_56846544,10204252398006590,1
1826,178524104062_10201128227400255,Interesting. Are they working on proposing an MOS-specific physical fitness test prior to initial enlistment?,2014-02-24T18:52:59+0000,10201128227400255_56836010,884641041564098,0
1827,178524104062_10152272372054063,he did lived to execute an excellent job to justified his merit,2014-04-10T19:25:00+0000,10152272372054063_13554407,764454133647732,0
1828,178524104062_10152272372054063,Shouldn't that be valid for everybody?,2014-02-24T17:34:44+0000,10152272372054063_13132827,888998154468014,1
1829,178524104062_10152272372054063,Norm should be president,2014-02-24T15:49:03+0000,10152272372054063_13131998,1468848460027059,1
1830,178524104062_10152272372054063,I agree and that has always been my belief!!!,2014-02-24T15:34:06+0000,10152272372054063_13131819,841199642573669,1
1831,178524104062_10201112369363814,"We need to start making a lot more stuff in America. Chinese product it's the result of slave labor, as an abolitionist I am not ok with that.",2014-02-21T20:27:57+0000,10201112369363814_56826878,642969262449683,0
1832,178524104062_10201112369363814,Why is this not just basic common sense?  I would NEVER buy a flag made anywhere outside the US.,2014-02-21T17:40:17+0000,10201112369363814_56826366,10201917401964412,2
1833,178524104062_10201112369363814,"First of all, it's a  matter of principle.  As for economics, in some cases the money that was perceived as misspent will come back in the form of jobs.",2014-02-26T01:00:53+0000,10201112369363814_56840396,10152695384229362,0
1834,178524104062_10152260812629063,"What about ""Jungles""?..Congrats.",2014-02-20T18:45:50+0000,10152260812629063_13097840,957156964318590,2
1835,178524104062_10152260812629063,"Jungles is no longer at the academy, but he was truly worthy of this award when he was here.",2014-02-23T20:44:06+0000,10152260812629063_13125341,881956611816525,1
1836,178524104062_10152260812629063,"That is my fianc?!!! Randy, I am so proud of you! Love you, Honey.",2014-02-23T20:43:32+0000,10152260812629063_13125332,881956611816525,1
1837,178524104062_10152260812629063,Very Well done!! And Very well deserved!!!,2014-02-20T03:12:06+0000,10152260812629063_13092681,906437639375850,1
1838,178524104062_10152260812629063,Well done!,2014-02-19T22:40:01+0000,10152260812629063_13091383,10203805635889503,1
1839,178524104062_10152260812629063,I say Hooah !!!,2014-02-19T16:10:25+0000,10152260812629063_13088900,1175002345850535,1
1840,178524104062_10152260812629063,Congrads SGM,2014-02-19T15:26:17+0000,10152260812629063_13088623,10203204175651789,1
1841,178524104062_10152260812629063,Hooah!!  ULTIMA!!,2014-02-19T15:22:23+0000,10152260812629063_13088582,10204875345791412,1
1842,178524104062_10201103118892558,Me and my Chaplain have tried to crack this nut (suicide prevention) for some time.  The best thing we can seemingly do is constant contact and communication. Even this hasn't been 100% successful.,2014-02-19T14:42:23+0000,10201103118892558_56818381,350773701745467,3
1843,178524104062_10201103118892558,"The key to mitigating this is leaders have to be engaged with their Soldiers and it starts at the team leader level. The number one suicide detterent is a Squad Leader who has compassion and empathy for his troopers while building a cohesive team and creating a family enviornment. We have all been touched in some way by suicide and it is time to charge these leaders with putting their troops above themselves. And it shouldn't stop there. You can be hard and compassionate all at the same time, no matter what level of stripes you have on your chest. Just a thought from a SNCO who has dealt with more death outside of combat than with in combat.",2014-02-19T15:25:11+0000,10201103118892558_56818523,783077878378258,1
1844,178524104062_10201098947108266,"After my first 8 of 36 years, I realized quality adult supervision usually occurred at the SFC level.  Where was the PLT SGT that oversees quality preparation to ensure our fallen are given maximum respect honored by our nation?  Senior NCO business -- period!
Epic failure can go viral overnight and does in this instance.",2014-02-19T01:33:30+0000,10201098947108266_56816672,10201840587401747,3
1845,178524104062_10201098947108266,This is a big embarrassment to the military.,2014-02-18T21:59:45+0000,10201098947108266_56815985,10203975285762634,3
1846,178524104062_10201098947108266,14 Soldiers in that photo...any attempt to simply state that it was in front of a training mock up casket is ridiculous...I truly hope that these idiots see what they did was an embarrassment,2014-02-18T21:28:25+0000,10201098947108266_56815857,824780634233993,3
1847,178524104062_10201098947108266,"The real problem is a lack of leadership. These Soldiers are a by-product of poor leadership. That need to be processed out, and their immediate supervisors investigated.",2014-02-18T22:49:41+0000,10201098947108266_56816137,10206144837364304,4
1848,178524104062_10201098947108266,One soldier from the WI National Guard has been suspended pending the outcome of an investigation.   It is my personal opinion that they should ALL be given article 15s and reduced in rank.,2014-02-18T21:46:56+0000,10201098947108266_56815931,874111895956782,10
1849,178524104062_10201098947108266,"Regardless of what any individual or command says, the military relaxed some standards in order to fill slots.  Basic training relaxed some standards of discipline and Esprit de Corp while transforming basic training soldiers into War Fighters.  My personal opinion is that we fail to inculcate the Army Values in our Soldiers during basic training and we fail to reinforce Army Values effectively during permanent party.  The Automatic promotions has given us many substandard Soldiers and junior NCOs who lack professional development.  I am babbling right now because this really ticks me off.  Nothing about this was professional.  I think being designated a Professional Soldier should only happen after a Soldier has demonstrated a thorough understanding and acceptance of the Army Values and the Army way of Life.",2014-02-19T00:39:42+0000,10201098947108266_56816489,10204328822994130,4
1850,178524104062_10201098947108266,"Leadership fail is not providing purpose. We need to teach our soldiers the profession of arms and the importance of ceremony, especially military funerals. I'm guessing theses soldiers we ""tasked"" to provide funeral detail, but not selected based on their performance. We are quick to tell subordinates hat to do, and take for granted the ""why.""  If the Soldiers understood their purpose, perhaps they wouldn't have done this.",2014-02-18T23:53:52+0000,10201098947108266_56816351,10152504911501188,3
1851,178524104062_10201098947108266,"Very disrespectful, mock/training or not...some things are not a joking matter",2014-02-18T22:18:34+0000,10201098947108266_56816044,910423512304227,2
1852,178524104062_10201098947108266,"This is a complete breakdown/lack of leadership. They learned that this behavior is acceptable from somewhere. The NCO of the female that posted the pictures defended her, stating she is a good Soldier and that is was lack of judgment. No, it was your lack of leadership.  NCO'S need to stop being friends with Soldiers, because then they view you as their peer. We are growing self entitled trophy generation for the Leadership of tomorrow.....we are not creating better leaders by not enforcing standards.",2014-02-19T03:55:31+0000,10201098947108266_56817093,10202798479506274,2
1853,178524104062_10201098947108266,"Rick Alfaro We got ahold of this few days ago on Spiritof TheBayonet. They should UCMJ all of them.
",2014-02-18T23:51:23+0000,10201098947108266_56816338,10203681637262330,2
1854,178524104062_10201098947108266,"I think you'll be hard pressed to get any of them to honestly say they assessed this was ok by virtue of their command climate. So, the leadership failure here is highly personal. Each Soldier is accountable for their actions, and each should never forget they are accountable to police each other.",2014-02-18T22:04:50+0000,10201098947108266_56816008,10203924089037264,5
1855,178524104062_10201098947108266,14 Soldiers and 1 Photographer!,2014-02-19T00:40:38+0000,10201098947108266_56816493,10204328822994130,1
1856,178524104062_10201098947108266,I hope that is a rehearsal casket and no honored remains  are present. People stupid enough to behave this way are stupid enough to Post it on social media and far to stupid to be in uniform. Makes me sick.,2014-02-19T00:11:40+0000,10201098947108266_56816402,10207346932812422,1
1857,178524104062_10201098947108266,"Shameful. This is happening in all the Armed Forces because the "" guy"" at the top doesn't care about our men and women serving as volunteers and neither do their leaders. LEE Weber, USAF, 1964-1970.",2014-02-18T23:44:00+0000,10201098947108266_56816306,10204478459304812,1
1858,178524104062_10201098947108266,"what I see is a complete breakdown of NCO leadership and engagement.  I see at least one Sergeant in the picture and have to wonder where the NCOs are.  NCOs set the tone in the unit.  If they insist on standards based behavior the unit will have it.  If they participate in childish games with the Soldiers the unit will be like this.  NCOs are the Army and as we go, the Army goes.  vr  SGM B",2014-02-18T23:07:57+0000,10201098947108266_56816204,10205908280762883,1
1859,178524104062_10201098947108266,"All at fault, all should pay!Where were the leaders? Truly an embarrassment and disgrace!",2014-02-18T22:57:33+0000,10201098947108266_56816171,10152505889518997,1
1860,178524104062_10201098947108266,I sure hope no one does this for any of their friends or family!!,2014-02-22T20:17:28+0000,10201098947108266_56830133,10202931747549173,0
1861,178524104062_10201098947108266,They knew better! The comments are beyond disrespectful! Army of One? Then punish them all!!!! So blatantly disrespectful and the photographer is equally a part of it!,2014-02-19T06:50:35+0000,10201098947108266_56817454,10204389771768372,0
1862,178524104062_10201098947108266,You guys keep doing this you are getting upset at the lower enlisted Soldiers and they are not the problem until you start holding the General Officers accountable for what they do and stop rewarding them for being toxic leaders then it will stop no there's no excuse for what they did but I'm sure they read the Army Times and a  letter of concern or a article 15 to a General is not being pushed for something when you are a leader !!!!,2014-02-19T03:47:00+0000,10201098947108266_56817067,10152502630957543,0
1863,178524104062_10201098947108266,Just give them a yellow card!  Wow times have changed!,2014-02-19T01:55:38+0000,10201098947108266_56816738,1191914240860297,0
1864,178524104062_10201098947108266,"This appears as the same Command Climate that led to the Abu Ghraib photos, looks like it is time to bring discipline back in the ranks and leadership within this unit.",2014-02-18T23:23:30+0000,10201098947108266_56816246,10152306229480516,0
1865,178524104062_10152259075384063,"Some book for read, abaut leadership?",2014-02-19T01:34:55+0000,10152259075384063_13084964,10152215440428456,0
1866,178524104062_10152240907244063,Congrats CSM! Well deserved and all the best for the move!,2014-02-11T03:17:56+0000,10152240907244063_13007004,307045469445217,1
1867,178524104062_10152240829614063,"felicitaciones a la delegacion colombiana y a la academia por su acogida, recibo con beneplacito la noticia de nuestros suboficiales lideres en su entrenamiento, su diaro sera resolver problemas, conocer la mision, ser amble, dar ejemplo, el poder es para servir el amor para compartir, acerca del poder lei, ""nunca uses el poder para humillar a tus semejantes, el poder se acaba el recuerdo perdura"", cultivar en los subalternos los estado fisico, social, mental, espiritual.. muchos exitos profesionales a la delegacion colombiana. para ser un buen lider primero hay que ser buen seguidor..desde cali a su sevicio. tecnico subjefe alexander arteaga.",2014-02-11T21:54:39+0000,10152240829614063_13014017,10152215440428456,0
1868,178524104062_10152239905244063,"great promise, if you find the solution found, if you do not find the problem .... not like.",2014-06-02T13:31:15+0000,10152239905244063_10152497902744063,10152351011507996,0
1869,178524104062_10201030357273563,Been doing this my whole career.,2014-02-06T19:09:42+0000,10201030357273563_56772890,10152325767014663,1
1870,178524104062_10152223623204063,"So agree..Leadership, a compassionate and transparent one...be an advocate..is important, more so that it is what pushes Soldiers whether to make this life long career or not.",2014-02-03T17:51:49+0000,10152223623204063_12937409,876949782330657,1
1871,178524104062_10200975469061392,"Tracy Osborne, we can ckeck to see if we have an follow-on contact information for him.",2014-01-27T19:30:08+0000,10200975469061392_56735277,178524104062,0
1872,178524104062_10200975469061392,"Please do...would love to get this back to him.  Let me know, please.   Thanks.",2014-01-27T19:31:40+0000,10200975469061392_56735287,10205669773892205,0
1873,178524104062_10200975469061392,"Does anyone know of Sergeant Major Alonzo Jacobs Class of 1996 (class #46).   Found his SM Academy ring and would like to get it back to him.  Please let me know if you know of him, and/or how to contact him.   Thank you!",2014-01-27T19:25:56+0000,10200975469061392_56735264,10205669773892205,1
1874,178524104062_10200975465501303,"There's some good info here. Thanks for the link. However, I would argue the point mentioned in there about drill sergeant duty not being a technically broadening experience. Few duty assignments up to that point in an NCOs career are more developmentally challenging than being a drill sergeant. Especially for combat arms Soldiers who have not worked extensively in a garrison environment, or even never before with female Soldiers! I understand the article is mostly for those who are beyond that point in their careers, I just think it's important to recognize that duty assignment for what it is.",2014-01-28T14:23:13+0000,10200975465501303_56737903,884641041564098,1
1875,178524104062_10200975465501303,U have to be a SGM to teach there so where do u go from there? If an e7 or 8 go teach 1SG course or any other course taught there. That is definitely good for promotion.,2014-01-28T02:59:40+0000,10200975465501303_56736613,10203664173069715,0
1876,178524104062_10200975465501303,I am not sure the article does an adequate job of tilting the table of perception. Seems more like a nomenclature change than  anything else.,2014-01-28T13:04:21+0000,10200975465501303_56737659,10202666233845618,0
1877,178524104062_10152206938874063,Jack Tilley was a great soldier.,2014-01-28T04:33:19+0000,10152206938874063_12873037,10202854069461725,2
1878,178524104062_10152206938874063,"First quote I have seen here from an NCO. Happy it was one of his. Assumed that when I perused the USASMA page, I would see more NCOs motivating and mentoring NCOs type of quotes. But I guess we don't necessarily like being the voice box for our elements, just the silent professionals that drive them.",2014-02-19T01:57:49+0000,10152206938874063_13085081,10204252398006590,0
1879,178524104062_10152183980974063,Good to see another. Profound truth in this.,2014-02-19T02:07:43+0000,10152183980974063_13085125,10204252398006590,0
1880,178524104062_10152183980974063,"WOW!  SMA used to visit my classroom at USASMA often and he touched every Soldier he came in contact with.  So humble, and grasp their hands like he knew them forever.  Miss ya SMA!",2014-01-22T17:36:37+0000,10152183980974063_12811648,10203805635889503,0
1881,178524104062_10152183980974063,We have to care the people because the people care the mision,2014-01-20T21:18:31+0000,10152183980974063_12790070,10152215440428456,0
1882,178524104062_10152180746449063,And 13 days later I went to basic training! Wow that brought back some memories!,2014-01-16T21:54:23+0000,10152180746449063_29856434,10152638682619121,1
1883,178524104062_10152158761764063,So true! Information to the Enlisted in the late '60s was minimal (my experience). I always gave my soldiers an informal SITREP. It develops a team cohesion!,2014-01-06T15:56:02+0000,10152158761764063_12625367,496350613824340,1
1884,178524104062_10152158761764063,"He was the Commandant of 1st AD NCO Academy @ Katterbach , Germany! later on, I met him at a SNCO conference when I was a 1SG at FLW,MO.",2014-01-06T18:57:07+0000,10152158761764063_12626714,445366295599605,2
1885,178524104062_10152158761764063,I had the honor of meeting this excellent nco late in 1995 in Washington DC.,2014-01-06T20:00:45+0000,10152158761764063_12627207,864934263585704,1
1886,178524104062_10152158761764063,SMA Kidd was a great SMA. Be nice if DC understood these worlds,2014-01-06T17:27:57+0000,10152158761764063_12626056,720886547934744,1
1887,178524104062_10152126247309063,Would love to see it brought back into classrooms everywhere.,2013-12-28T15:46:56+0000,10152126247309063_29595214,804520022912105,8
1888,178524104062_10152126247309063,What a GREAT trivia question!,2013-12-29T19:22:42+0000,10152126247309063_29608076,989956451022463,0
1889,178524104062_10152126237884063,My dad was there with a few thousand of his closest friends...the 5th Infantry Division Red Devils attacking the German southern flank...,2013-12-26T19:21:22+0000,10152126237884063_29568556,989407087753057,2
1890,178524104062_10152119858744063,merry Christmas to all my military brothers and sisters  and god bless you class 44,2013-12-25T16:24:31+0000,10152119858744063_12502151,1001191079915113,0
1891,178524104062_10152119547314063,"On this day... paratroopers were ordered to make a combat jump into Panama, first time since WWII - this mission was handled swiftly and successfully. 325 men injured. We lost 23 men, Army Rangers, Navy Seals, Paratroopers from the 82nd Airborne, 7th Infantry Division, 5th Infantry Division, 89th Military Police, 160th Aviation, and the 2nd Marine Division.  Each year during this time I sit and remember this day, I recall hearing about the first casualties... The information traveled pretty fast considering no cell phones, news was transmitted via the news, families, and land lines! Little did I know at the time would I find myself in a combat zone and in the middle of it, and the biggest challenge was getting out of Panama, as I was being confused as a Panamanian, and at the same time an advantage as it provided personal safety to me as I was able to travel walk in the street to get a ride out if the zones.  This Operation and Military history is important for Military Leaders to know and to learn from, History tells us so and so do military historians.",2013-12-20T18:18:06+0000,10152119547314063_29486860,10203454437272802,1
1892,178524104062_10152104463819063,Backbone of the military.  The NCOs.,2013-12-16T18:26:29+0000,10152104463819063_12412217,10202153384899531,3
1893,178524104062_10152104463819063,He was the first and only air defense sma. He came to Bragg and talked to us a couple months back. For ncopd,2013-12-18T18:48:28+0000,10152104463819063_12432832,10153441525774569,1
1894,178524104062_10152104463819063,Good,2013-12-16T15:17:09+0000,10152104463819063_12410670,694110487313778,0
1895,178524104062_10152104463819063,My division CSM in Korea.,2013-12-17T19:32:44+0000,10152104463819063_12422382,10203866004756477,1
1896,178524104062_10152104463819063,"I see a Sun Dragons crest , Hats off to 5/3 ADA Bn, Wackernheim , Germanay.",2013-12-17T03:56:35+0000,10152104463819063_12417041,10152661204515868,1
1897,178524104062_10152104463819063,..VERY true !,2013-12-16T18:53:54+0000,10152104463819063_12412448,173865659318250,1
1898,178524104062_10152104194569063,It's nice to see a few familiar faces :) Happy Holidays and Merry Christmas USASMA :),2013-12-13T22:13:16+0000,10152104194569063_12384195,10203431556772847,1
1899,178524104062_10152104194569063,I miss it very much!!!!,2013-12-13T22:14:37+0000,10152104194569063_12384211,4771959195060,1
1900,178524104062_10152098604774063,Good,2013-12-13T16:12:58+0000,10152098604774063_12380345,694110487313778,0
1901,178524104062_10152098604774063,Onit--- Dawg-Gonnit!,2013-12-13T13:48:17+0000,10152098604774063_12379227,988248287857832,0
1902,178524104062_10152098604774063,Woohoo!!,2013-12-11T17:32:51+0000,10152098604774063_12361350,971365332879553,0
1903,178524104062_10152098604774063,"With onions and mustard,oh-yeah!",2013-12-11T16:54:42+0000,10152098604774063_12360926,302363609974846,0
1904,178524104062_10152076599824063,I thoroughly agree with the quote. The issue now is that these new CP patrols foe uniform violations speaks highly of the degraded NCO Corps.,2013-12-02T19:52:20+0000,10152076599824063_12270954,10152485015136147,3
1905,178524104062_10152076599824063,good,2013-12-13T16:18:21+0000,10152076599824063_12380391,694110487313778,0
1906,178524104062_10152076599824063,Incredible.,2013-12-03T16:51:10+0000,10152076599824063_12278536,10154942457635454,0
1907,178524104062_10152076599824063,"A wonderful man. I have many happy memories listening to him speak of serious topics, and as the storyteller he was!",2013-12-03T01:12:07+0000,10152076599824063_12273396,766449543446130,2
1908,178524104062_10152076599824063,Read his book great insight and leadership,2013-12-02T15:12:27+0000,10152076599824063_12268477,960807947282256,2
1909,178524104062_10152076599824063,What a great man. I am privileged to have known him and heard his wisdom first hand.,2013-12-02T15:10:00+0000,10152076599824063_12268467,1358369804190834,2
1910,178524104062_10152076599824063,NCO's need to always keep this tradition and keep the officers out of the enlisted business.,2013-12-02T22:33:46+0000,10152076599824063_12272414,968451729835007,2
1911,178524104062_10152076599824063,Great book on leadership! Should be required reading at WLC/ALC/SLC,2014-02-11T03:07:57+0000,10152076599824063_13006957,976471209053518,0
1912,178524104062_10152060356139063,Huge amount of truth! A few new LT's didn't return home from Vietnam....lessons learned!,2013-11-25T16:22:57+0000,10152060356139063_12211296,496350613824340,1
1913,178524104062_10152053535629063,happy Thanksgiving and have a safe and MERRY CHRISTMAS,2013-11-27T00:59:04+0000,10152053535629063_12224521,720886547934744,1
1914,178524104062_10152053535629063,Jen's helping decorate the halls this weekend,2013-11-23T00:17:04+0000,10152053535629063_12185701,1122617341161607,2
1915,178524104062_10152053535629063,"Wishing all students, staffs and their families a Merry &Joyous Christmas, happy holidays, be safe and God bless",2013-11-26T02:59:47+0000,10152053535629063_12216357,10210773236316829,1
1916,178524104062_10152048652984063,"I too was a Science Teacher (31 yrs) and a CSM (now Retired) in the Army Reserves. I concur with CSM Conley. Education civilian and military, Training, having viable materiel, using your Veterans to teach new soldiers 'Lessons learned', all while downsizing takes place will be a huge challenge.",2013-11-20T19:59:43+0000,10152048652984063_12161720,496350613824340,1
