,Post_ID,Comment,Created_Time,Comment_ID,Commenter_ID,Likes
2633,178524104062_10151173510219063,My husband and I took our boys. They thought it was a really amazing experience.-,2012-09-20T15:26:09+0000,10151173510219063_8027592,10203838141928910,1
2634,178524104062_10151173510219063,Wish we were there....,2012-09-20T17:07:06+0000,10151173510219063_8028308,840090862732944,0
2635,178524104062_10151173510219063,Awesome! I saw it this morning :),2012-09-20T21:56:44+0000,10151173510219063_8030864,1017477238283076,0
2636,178524104062_10151173510219063,I saw it yesterday n felt like a lil kid again,2012-09-21T14:41:36+0000,10151173510219063_8037236,10203553312295785,0
2637,178524104062_10151173510219063,I wish i was there again to witness this. . .,2012-09-23T01:08:06+0000,10151173510219063_8050211,10207737037005272,0
2638,178524104062_10151172718244063,We saw it several yrs ago.....at Biggs.  It's an AWESOME sight.,2012-09-20T01:29:34+0000,10151172718244063_23977306,10204579351827680,0
2639,178524104062_10151172718244063,Hope y'all will post some photos for us that will miss it.,2012-09-20T01:37:01+0000,10151172718244063_23977367,10207295383646659,0
2640,178524104062_10151172718244063,"Where exactly is ""there"" ? Where is the best place to be for viewing and talking photos? ",2012-09-20T04:17:25+0000,10151172718244063_23978518,10154147388654488,1
2641,178524104062_10151172718244063,"Spectators should go to the main terminal of Biggs Army Airfield, but even at 0715 this morning, no definitive direction has been given to USASMA Public Affairs from airfield personnel about where spectators are allowed to be for the best view. We apologize for not being able to provide more information.",2012-09-20T13:18:31+0000,10151172718244063_23981426,178524104062,0
2642,178524104062_10151172718244063,Thanks,2012-09-20T13:30:55+0000,10151172718244063_23981516,10154147388654488,0
2643,178524104062_10151172718244063,Where is the main terminal?,2012-09-20T14:01:17+0000,10151172718244063_23981739,10202435892565823,0
2644,178524104062_10151172718244063,If you park anywhere along CSM E Slawitzke Ave you will be able to view the shuttle. ,2012-09-20T15:26:25+0000,10151172718244063_23982510,178524104062,1
2645,178524104062_10151172718244063,That was Awesome!  Thanks for keeping us updated on this event.  My kids enjoyed seeing this part of History!,2012-09-20T15:31:34+0000,10151172718244063_23982563,10154147388654488,1
2646,178524104062_10151172060364063,I would love to see photos in the repository but the website always gets blocked when I try to open it. I was specifically looking for Appointment photos that were taken after Class 62 graduation. Thanks,2012-09-19T16:32:19+0000,10151172060364063_23973021,10202112604086222,0
2647,178524104062_10151171239404063,Wish I could see it!!,2012-09-19T00:37:15+0000,10151171239404063_23966843,10152728591044930,0
2648,178524104062_10151171239404063,A new post was just made on the page confirming that Space Shuttle Endeavour will be at Biggs Army Airfield on Thursday morning September 20th at 8:20 a.m. See you there!,2012-09-20T01:25:50+0000,10151171239404063_23977269,178524104062,1
2649,178524104062_10151169791089063,I wish I could be there! A once -in- a- lifetime opportunity!,2012-09-17T21:12:12+0000,10151169791089063_8006472,10152855598907927,3
2650,178524104062_10151169791089063,Awwww enjoy Class 63 you are very lucky!!!!,2012-09-17T21:12:38+0000,10151169791089063_8006478,10152106139748030,1
2651,178524104062_10151169791089063,this says it all,2012-09-17T23:41:42+0000,10151169791089063_8007314,10203925086915512,0
2652,178524104062_10151169791089063,"Neverovatno ljudsko oko ,snimano sa meseca !",2012-09-18T12:15:50+0000,10151169791089063_8010392,393585914126560,0
2653,178524104062_345432208879683,Looking forward to sharing!,2012-09-20T00:23:53+0000,345432208879683_2089360,121865201203199,0
2654,178524104062_10151153907179063,"USASMA is ""The Ultimate""! The positive effect on the students and families are immeasurable...I carry my $7 PX USASMA coin daily (16 years) to remind myself to be professional and to live up to the standards of being a CSM to everyone I come in contact with, soldiers and civilian.",2012-09-06T20:39:16+0000,10151153907179063_23842744,496350613824340,2
2655,178524104062_10151153907179063,"Bill Davis, I do the same thing, I carry my Class 41 (1993) coin to work on all special days.  It reminds me of a time in my life when I was at the top of my profession. It grounds me and I am reminded I can do just about anything.",2012-09-06T22:02:15+0000,10151153907179063_23843669,829033100451070,0
2656,178524104062_10151153907179063,Hooah! Big thanks to what USASMA has done to IMS!,2012-09-07T01:32:44+0000,10151153907179063_23845421,840250585996571,0
2657,178524104062_10151153907179063,It was school and home for class 59 at least 9 month. ULTIMA.,2012-09-07T15:15:22+0000,10151153907179063_23851243,922248881119503,0
2658,178524104062_10151153907179063,Class 55 - Double Nickel,2012-09-08T09:01:25+0000,10151153907179063_23859244,10203805635889503,0
2659,178524104062_10151153907179063,"Ron Powell class 6 Wow I must be getting really old, would like to see the USASMA reach out to members of the early classes. ULTIMA",2012-09-08T22:52:50+0000,10151153907179063_23865123,10204166984049129,0
2660,178524104062_10151152463444063,Congratulations,2012-09-06T02:25:01+0000,10151152463444063_7916052,10207375648851714,0
2661,178524104062_10151143715924063,Congratulations cousin!!!!,2013-06-04T12:34:04+0000,10151143715924063_10405418,888217464564056,0
2662,178524104062_10151143715924063,I AM VERY PROUD TO HAVE YOU AS MY BROTHER GOD BLESS YOU,2013-06-04T11:22:36+0000,10151143715924063_10404792,1130578667055277,0
2663,178524104062_10151142612439063,Awesome!  Can't wait to attend in January.. Psst..Hi Pamela A. Wilson,2012-08-29T21:53:06+0000,10151142612439063_7853698,10209968424955671,0
2664,178524104062_10151142612439063,Salute from the wife of a 1987 course graduate.,2012-08-29T22:13:13+0000,10151142612439063_7853804,10203207765096087,0
2665,178524104062_10151142612439063,"Congratulations ladies!  CSM (Ret) Al Gray, Sr, Class 26...",2012-08-29T22:13:50+0000,10151142612439063_7853810,841199642573669,0
2666,178524104062_10151142612439063,Congrats from Class #57,2012-08-29T22:39:57+0000,10151142612439063_7854578,10152318652042829,0
2667,178524104062_10151142612439063,This was such a great experience! I hope all of the spouses will attend this rewarding course in the coming weeks!,2012-08-29T22:52:35+0000,10151142612439063_7854757,10152496797833027,2
2668,178524104062_10151142612439063,Congrats from class 62!!',2012-08-29T22:55:32+0000,10151142612439063_7854786,10203620425334644,0
2669,178524104062_10151142612439063,Congratulations....,2012-08-30T00:32:23+0000,10151142612439063_7855579,10207375648851714,0
2670,178524104062_10151142612439063,The ball is rollin now! Congrats another Class 62 grad!!!! ,2012-08-30T01:11:45+0000,10151142612439063_7855811,10152106139748030,1
2671,178524104062_10151142612439063,awesome job as always!!,2012-08-30T01:36:03+0000,10151142612439063_7855932,831446343535846,1
2672,178524104062_10151142612439063,This was the best class I have ever taken through the Army.  Congrats gals!,2012-08-30T01:37:50+0000,10151142612439063_7855951,10203838141928910,0
2673,178524104062_10151142612439063,Congrats!!!!!!!!! Now you have too mentor the young wives!,2012-08-30T02:18:08+0000,10151142612439063_7856144,10204449458728832,0
2674,178524104062_10151142612439063,Where there any husbands in attendance?,2012-08-30T02:33:23+0000,10151142612439063_7856252,10201847711832855,0
2675,178524104062_10151142612439063,Ladies you should be proud of yourselves..,2012-08-30T03:20:45+0000,10151142612439063_7856523,919390728072278,0
2676,178524104062_10151142612439063,Congratulations Ladies and thanks for all that you do.,2012-08-30T11:56:12+0000,10151142612439063_7860216,10207295383646659,0
2677,178524104062_10151142612439063,Awesome pic and proud,2012-08-30T15:35:54+0000,10151142612439063_7862718,10204992079985770,0
2678,178524104062_10151142612439063,"Jane, yes, the spouses were in attendance to see us graduate. There were no male spouses in the course for this iteration. Maybe in the next one.",2012-09-02T03:08:54+0000,10151142612439063_7884958,10153727247913051,0
2679,178524104062_10151142612439063,Congratulations to the Spouse Leadership Development Course of Class 63-001.!!! Good Job!!!   From  your Class 34 Spouse..  :-),2012-09-03T12:55:00+0000,10151142612439063_7894534,10205283114626525,0
2680,178524104062_10151141983534063,This is good stuff!!!!,2012-08-29T14:52:08+0000,10151141983534063_7850772,10203680365558402,0
2681,178524104062_10151141983534063,"Nice, very nice.  Long overdue, but that's okay.  Students need to enjoy their time and take advantage of what El Paso has to offer.  Then,  when they see it in their rear view mirror next June, hopefully they can say positive things.",2012-08-29T16:39:50+0000,10151141983534063_7851522,10203995111104909,0
2682,178524104062_498513363510397,"and in that training, make sure they KNOW that kidnapping is NOT a smart thing to do...............",2012-08-28T18:56:36+0000,498513363510397_6071058,10201720476922976,0
2683,178524104062_268174883282199,WONDERFUL!!! Congratulations to all who were honored and recognized..!!!,2012-08-23T14:21:36+0000,268174883282199_1201679,10205283114626525,0
2684,178524104062_268174883282199,My congratulations to all honorees,2012-08-24T04:13:36+0000,268174883282199_1203207,10207375648851714,0
2685,178524104062_10151126025659063,Hooah~,2012-08-23T00:07:49+0000,10151126025659063_7787322,10202727774416729,0
2686,178524104062_10151126025659063,this is my small group classmate,2012-08-23T00:51:49+0000,10151126025659063_7787532,10202707364717870,2
2687,178524104062_10151126025659063,"Having been raised in Taiwan (father was USAF) and being around so many service members from Taiwan, I am thrilled to see one of their Sr NCOs attending the course.  Im sure she's a welcomed addition to the small group!  Mike, if she has a FB page, please share my info with her.",2012-08-23T01:09:02+0000,10151126025659063_7787598,1173269289358942,2
2688,178524104062_10151126025659063,"<<<< CSM (Ret) O. C. Barclay, Class #33 USASMA: ""Good luck guys, it will actually be over before you know it.""",2012-08-23T01:54:10+0000,10151126025659063_7787845,10203228221250562,2
2689,178524104062_10151126025659063,Good luck! You can do it!,2012-08-23T02:01:15+0000,10151126025659063_7787884,10205366548629370,2
2690,178524104062_10151126025659063,I know Soldiers from Taiwan are hard workers. Keep up a good work!,2012-08-23T05:21:38+0000,10151126025659063_7788903,840250585996571,2
2691,178524104062_10151126025659063,?????~??????~,2012-08-23T08:39:32+0000,10151126025659063_7789555,10202727774416729,3
2692,178524104062_10151126025659063,"Dear comrades of Class 63, do you have a long way ahead, but don't forget it, the true legacy of class 63 will not be determined by it's achievement while at USASMA  or by the legacy left behind after graduation. It will  be defined by how well each of you  will use what have learned in order to make your Army better for your Soldiers. Class 57",2012-08-23T14:46:57+0000,10151126025659063_7791801,10152754552673708,2
2693,178524104062_10151126025659063,"Be open and learn! SGM Sung, Class # 56",2012-08-23T14:47:02+0000,10151126025659063_7791803,10204457248608259,3
2694,178524104062_10151126025659063,"Do your very best and have a positive attitude, you can be an example for others. Maybe see you in Taiwan sometime. I teach at CCK.",2012-08-23T18:00:23+0000,10151126025659063_7793179,1121889664491746,2
2695,178524104062_10151126025659063,Keep smiling!  you enlighten my day when I see you,2012-08-24T02:00:10+0000,10151126025659063_7796247,10203685885569293,2
2696,178524104062_10151126025659063,"Work hard, play hard! Way to go. Class 62",2012-09-01T00:57:49+0000,10151126025659063_7876271,10152939422123615,1
2697,178524104062_10151123822524063,Not in El Paso.  You can recycle... but not your glass containers.,2012-08-21T21:37:28+0000,10151123822524063_7778269,10202608514706600,1
2698,178524104062_10151123822524063,Even the ones that get in the correct bins usually end up in a landfill.,2012-08-21T21:52:10+0000,10151123822524063_7778384,637886686301588,0
2699,178524104062_10151123822524063,"Charge a $20 one time fee for filters on cigarettes... Give $1 per used filter turned in ... Zero-sum cost but clean side walks, bus stops, waiting areas outside movies, etc. ... People will clean up if paid for it.",2012-08-21T21:54:36+0000,10151123822524063_7778408,10152728591044930,0
2700,178524104062_10151123822524063,"Leah you wrote that wrong. You should write it: ""Not in El Paso, yet, but they will when we citizens order them to"" we are citizens not subjects. We ARE the people referred to as ""... By the people"" in the pledge, constitution, and Declaration of independence. Grow up and act as an owner not a lemming.",2012-08-21T22:02:12+0000,10151123822524063_7778501,10152728591044930,1
2701,178524104062_10151123822524063,WOW!,2012-08-22T02:55:59+0000,10151123822524063_7780273,804520022912105,0
2702,178524104062_10151123822524063,"Thanks everyone for your comments! Please know that any information posted on behalf of the USASMA Green Committee is not just pertinent to the local El Paso community. Our Facebook followers are global! So even though we have no local glass recycling facility in El Paso (yet), the post is for awareness. If you are living in an area where recycling everything is the norm and you're doing your part then great! (And thank you!)",2012-08-22T13:31:19+0000,10151123822524063_7783176,178524104062,1
2703,178524104062_10151123822524063,Ask the German students how to recycle!,2012-08-22T14:29:24+0000,10151123822524063_7783615,10152855598907927,0
2704,178524104062_10151123822524063,"Omaha won't pick up glass, so we save it and haul it to the private firm recyclers and give it to them.",2012-08-22T18:23:44+0000,10151123822524063_7785300,10153020901714928,0
2705,178524104062_10151123194699063,NOTE TO SHANE!!!!!,2012-08-21T18:37:58+0000,10151123194699063_7776641,10201720476922976,0
2706,178524104062_10151123194699063,"worked with him at 2BCT, 1CD",2012-09-22T06:39:59+0000,10151123194699063_8043943,778791988800534,0
2707,178524104062_10151121130094063,thanks for the info!!! I will go and get ours!!,2012-08-20T18:19:26+0000,10151121130094063_23654228,831446343535846,0
2708,178524104062_10151121130094063,https://usasma.bliss.army.mil,2012-08-20T18:30:56+0000,10151121130094063_23654340,178524104062,0
2709,178524104062_10151121130094063,Click the link to get to the page!,2012-08-20T18:31:13+0000,10151121130094063_23654344,178524104062,0
2710,178524104062_10151121130094063,Thank you for sharing--,2012-08-20T18:55:12+0000,10151121130094063_23654652,10203838141928910,0
2711,178524104062_10151121130094063,Congrats all. I hope you all will bridge the gap!,2012-08-20T22:03:23+0000,10151121130094063_23656719,840250585996571,0
2712,178524104062_262527430530884,A pity Gilbert is not one of them.,2012-08-17T14:14:50+0000,262527430530884_1055110,657902130943618,0
2713,178524104062_345925335489276,Awesome job! Thanks Class 59!,2012-08-17T02:59:18+0000,345925335489276_2141240,855661364445249,0
2714,178524104062_345925335489276,Clas 59 grads can finally see the fruits of thier labor.  It looks great,2012-08-17T08:51:33+0000,345925335489276_2141932,10203013789413726,0
2715,178524104062_10151107893864063,Very nice way to acclimate families. Well done! ULTIMA! ,2012-08-14T17:04:37+0000,10151107893864063_7723524,10201965884493412,0
2716,178524104062_10151107893864063,"His dawgs are the wrong way, lol. What ARE they teaching at the academy nowadays? Enjoy families!",2012-08-14T17:30:54+0000,10151107893864063_7723719,869053846438699,1
2717,178524104062_10151107662909063,"Take advantage of the time!!  Some of you have been on the go for the past 10 yrs, and might be again when its over.",2012-08-14T14:53:14+0000,10151107662909063_7722695,845695025480693,2
2718,178524104062_10151107662909063,Enjoy you time there.,2012-08-14T14:57:51+0000,10151107662909063_7722721,10152688329454389,0
2719,178524104062_10151107662909063,Never went and won't have to but we are enjoying our time now - what a great assignment this has been for us so far and we r finished when it is done ,2012-08-14T15:16:55+0000,10151107662909063_7722847,10204179590545589,0
2720,178524104062_10151107662909063,Absolutely take advantage of SLDC and creating friendships like no others in your life. Had an amazing time last year!!,2012-08-14T17:22:56+0000,10151107662909063_7723660,941885859162671,0
2721,178524104062_10151107662909063,Take full advantage of the SLDC also when they offer the aPFRI do that as well!!! Enjoy your year spouses!!!,2012-08-14T18:44:26+0000,10151107662909063_7724163,10205966054324324,0
2722,178524104062_10151107662909063,"Welcome to Class 63 and their Families!  We hope you will take full advantage of the wonderful things Fort Bliss has to offer, including the great programs at Army Community Service!  And if you feel like volunteering while you're here, stop in and see us:  there are many opportunities!",2012-08-14T19:54:20+0000,10151107662909063_7724595,169086846439033,1
2723,178524104062_10151107662909063,"Best wishes, Class 63!",2012-08-15T01:15:09+0000,10151107662909063_7726408,1176827669001552,0
2724,178524104062_10151107662909063,"CSM Malloy, kindly remember his time with us here in the 1st Team! Hooah!",2012-08-15T17:34:13+0000,10151107662909063_7730807,10152532498592475,0
2725,178524104062_10151105965669063,This is an excellent book and I recommend reading it.  Excellent choice for a speaker CSM Malloy.  AIR CAV  CSM Ankrum Class 61,2012-08-13T19:50:07+0000,10151105965669063_7716273,731715156921543,0
2726,178524104062_10151097247939063,"CSM (Ret)  Albert L. Gray, Sr., Class 26",2012-08-09T23:09:33+0000,10151097247939063_23542545,841199642573669,1
2727,178524104062_10151097247939063,CSM (Ret) Gray thanks for your service and paving the way for future SGM's,2012-08-09T23:49:40+0000,10151097247939063_23542854,10204934356335760,1
2728,178524104062_10151097247939063,David represent us well!  SGM Blanco (Class 35)...,2012-08-09T23:59:07+0000,10151097247939063_23542925,10205611479590113,0
2729,178524104062_10151097247939063,"CSM (R) Vincent F. Camacho, Class 52",2012-08-09T23:59:32+0000,10151097247939063_23542928,10152466331689470,1
2730,178524104062_10151097247939063,SGM(R) CLASS 43,2012-08-13T01:02:17+0000,10151097247939063_23574023,10205207775064959,0
2731,178524104062_10151096461739063,Dopotutto ? o no il suo clone? ,2012-08-11T14:41:24+0000,10151096461739063_7697126,10210755467070033,0
2732,178524104062_10151096461739063,"Yes, and it seems to have happened ages ago!",2013-07-03T17:49:44+0000,10151096461739063_10740560,811577315587239,0
2733,178524104062_10151094138804063,CLASS 63 WELCOME!!!!!,2012-08-08T14:42:08+0000,10151094138804063_7672429,10205283114626525,1
2734,178524104062_10151094138804063,Hooah to all my fellow SGM's.,2012-08-08T14:44:57+0000,10151094138804063_7672445,10152100503763315,1
2735,178524104062_10151094138804063,That brings back memories!,2012-08-08T14:47:46+0000,10151094138804063_7672463,10205161970988546,3
2736,178524104062_10151094138804063,Welcome and continued success Sergeants Majors!,2012-08-08T14:53:46+0000,10151094138804063_7672504,10202073659345062,0
2737,178524104062_10151094138804063,HOOAH!,2012-08-08T14:57:34+0000,10151094138804063_7672531,10202727774416729,0
2738,178524104062_10151094138804063,Ultima...Hooah!,2012-08-08T14:59:43+0000,10151094138804063_7672543,10201652751909270,0
2739,178524104062_10151094138804063,Class 58 was 665.,2012-08-08T15:27:19+0000,10151094138804063_7672748,991608294189499,1
2740,178524104062_10151094138804063,Best wishes to all of you !!!,2012-08-08T15:31:37+0000,10151094138804063_7672781,10152150356947857,0
2741,178524104062_10151094138804063,Welcome Class 63 to USASMA....HOOA. Class 59.,2012-08-08T15:50:42+0000,10151094138804063_7672922,895307120510023,0
2742,178524104062_10151094138804063,"Good luck all!!!  You might not realize it, but you will truly enjoy the next 11 months.  Take advantage and dont think you are too cool for school!!!  Class 61!!!",2012-08-08T15:59:27+0000,10151094138804063_7672985,845695025480693,0
2743,178524104062_10151094138804063,Good luck and enjoy this next year. For many of you...it is an overdue time to take a knee from your constant deployments. ASSLT!  Class 55!!,2012-08-08T16:02:20+0000,10151094138804063_7673011,10204182114406498,0
2744,178524104062_10151094138804063,Study hard and have fun...Class 30.,2012-08-08T16:09:56+0000,10151094138804063_7673080,10206578069714725,0
2745,178524104062_10151094138804063,1988 I was setting where you are for Class 30.,2012-08-08T16:24:09+0000,10151094138804063_7673195,10206578069714725,0
2746,178524104062_10151094138804063,Good luck...  Class 26.,2012-08-08T16:24:40+0000,10151094138804063_7673201,841199642573669,0
2747,178524104062_10151094138804063,"Awwwwhhh, The Master Bedroom!!",2012-08-08T16:34:46+0000,10151094138804063_7673284,10152644267942332,1
2748,178524104062_10151094138804063,The years since Jan 79 have not diminished my fond memories of attending the USASMA!  Wish I could sit where you are and do it all over again.  Best of luck to all of you during this significant phase of your careers.,2012-08-08T17:10:49+0000,10151094138804063_7673544,10205363965437750,1
2749,178524104062_10151094138804063,From a mbr of the class of 47 good luck.,2012-08-08T17:18:46+0000,10151094138804063_7673581,530405913728082,2
2750,178524104062_10151094138804063,Got a family member inprocessing today.  Good luck!,2012-08-08T17:32:33+0000,10151094138804063_7673690,10202486000846158,1
2751,178524104062_10151094138804063,Remember those days! Godspeed!,2012-08-08T17:53:51+0000,10151094138804063_7673862,876949782330657,2
2752,178524104062_10151094138804063,Best wishes to all of the 42Rs!!!,2012-08-08T18:16:59+0000,10151094138804063_7674155,10203582586024252,1
2753,178524104062_10151094138804063,"From a recent graduate... Class 62. Manage your time.  You're in the classroom from 0800-1500.  After class you'll be preparing for briefings, research/ write papers and studying for challenging tests.  Meet and develop strong bonds with your classmates.  It'll be the #1 takeaway from USASMA!  Ultima Strong! ",2012-08-08T18:17:30+0000,10151094138804063_7674158,10203860134480309,1
2754,178524104062_10151094138804063,Thanks for your service,2012-08-08T18:37:55+0000,10151094138804063_7674384,494365037330939,0
2755,178524104062_10151094138804063,ULTIMA SRONG!!!!!! Good luck class 63!!!!!!,2012-08-08T18:43:45+0000,10151094138804063_7674449,10153422772748637,0
2756,178524104062_10151094138804063,Gosh...Class 26 seems like a long time ago.  Good Luck Class.  Thanks for your service.,2012-08-08T19:04:31+0000,10151094138804063_7674615,874542192557152,0
2757,178524104062_10151094138804063,wow,2012-08-08T19:26:53+0000,10151094138804063_7674773,779015282164852,0
2758,178524104062_10151092248954063,congrats!!!  and 'at ease'!!!!,2012-08-07T20:23:01+0000,10151092248954063_7666668,10201720476922976,0
2759,178524104062_10151092248954063,Congratulations!!  About time.,2012-08-07T20:44:25+0000,10151092248954063_7666822,10206887175879222,0
2760,178524104062_10151092248954063,Congratulations,2012-08-11T16:01:18+0000,10151092248954063_7697712,10205284149332729,0
2761,178524104062_10151092248954063,Nice!!!  Congratulations!!,2012-08-11T20:19:44+0000,10151092248954063_7699469,10208319860868402,0
2762,178524104062_10151092214984063,Great job ladies!! Well deserved. :),2012-08-07T18:39:32+0000,10151092214984063_7665962,10153046620877076,1
2763,178524104062_10151092214984063,CONGRATS Ladies!!! Job well done,2012-08-07T18:54:34+0000,10151092214984063_7666077,10203991757608487,1
2764,178524104062_10151092214984063,"Congratulations, ladies!!  Deborah Malloy is one of my biggest heroes and I'm honored to call her my friend.  She is an example that all Army spouses would do well to emulate.  Concerned, caring, and doesn't wear her huband's rank or position.  She simply does the right thing for the Soldier or Family every tme.",2012-08-07T19:29:12+0000,10151092214984063_7666329,10152102080861571,2
2765,178524104062_10151092214984063,I salute them! :),2012-08-07T19:32:37+0000,10151092214984063_7666350,10203846051943771,1
2766,178524104062_10151092214984063,HOOAH!!,2012-08-07T19:45:33+0000,10151092214984063_7666436,10205838220703478,1
2767,178524104062_10151092214984063,Great job ladies! Congrats!,2012-08-07T20:20:26+0000,10151092214984063_7666653,10153410146778635,0
2768,178524104062_10151092214984063,awesome!!!,2012-08-07T20:35:02+0000,10151092214984063_7666752,724786494272992,0
2769,178524104062_10151092214984063,"Well deserved, Congratulations.",2012-08-07T22:42:40+0000,10151092214984063_7667777,4800413624415,0
2770,178524104062_10151092214984063,Congratulations Ladies!!  Agree with Karen Moten's remark totally!,2012-08-07T23:06:20+0000,10151092214984063_7667983,10203502957199281,0
2771,178524104062_10151092214984063,Congratulations!,2012-08-07T23:40:09+0000,10151092214984063_7668263,10203861622595636,0
2772,178524104062_10151092214984063,Thank you everyone. ,2012-08-07T23:54:12+0000,10151092214984063_7668333,10152663191989952,0
2773,178524104062_10151092214984063,Way to go sister!!  Proud of you!,2012-08-08T00:18:14+0000,10151092214984063_7668438,818862158141162,0
2774,178524104062_10151092214984063,Thank you ladies.  We could not have done it without you all.  Pat Berry...,2012-08-08T01:21:53+0000,10151092214984063_7668802,10153921448769057,0
2775,178524104062_10151092214984063,Congratulations ladies!!!!,2012-08-08T01:43:55+0000,10151092214984063_7668890,10205360252865585,0
