,Post_ID,Comment,Created_Time,Comment_ID,Commenter_ID,Likes
888,178524104062_10153668601014063,YES!,2015-08-29T04:44:20+0000,10153668601014063_10153669690939063,1021963841150982,0
889,178524104062_10153665233464063,"Looking forward to applying next year, as soon as I finish my Bachelor's degree. Amazing opportunity!",2015-08-27T22:00:04+0000,10153665233464063_10153666055839063,10202658191793970,2
890,178524104062_10153665233464063,Class 63 all throughout this article!!  All in!,2015-08-28T10:58:56+0000,10153665233464063_10153667495004063,10152432653739903,0
891,178524104062_10153658953674063,So exciting ! I remember when the list came out and my husband's name was there!!!!!,2015-08-26T17:26:40+0000,10153658953674063_10153662513844063,10203521454027825,0
892,178524104062_10153656234724063,"Fix BLC Curriculum before making BLC a requirement for promotion. It's only fair and your POI is WAY, WAY behind..",2015-11-19T05:19:20+0000,10153656234724063_10153840676304063,325316301165710,0
893,178524104062_10153656234724063,Adam Drews,2015-08-24T13:32:54+0000,10153656234724063_10153656275509063,10201290359180425,0
894,178524104062_10153647547629063,This Sergeant Major is extremely pleased these two Soldiers and Leaders will be able to wear the hard earned Ranger Tab. This is what makes the US Army great.,2015-08-20T23:40:27+0000,10153647547629063_10153647736979063,993246154022189,2
895,178524104062_10153647547629063,Very Awesome.  Congratulations ... well done!,2015-08-21T02:11:15+0000,10153647547629063_10153647991589063,680212925358595,1
896,178524104062_10153647547629063,Hooah,2015-08-21T01:46:58+0000,10153647547629063_10153647963259063,10204986058948567,1
897,178524104062_10153647547629063,"Congrats ladies,you are part of a elite group.",2015-08-21T01:14:25+0000,10153647547629063_10153647918264063,841268035889371,1
898,178524104062_10153647547629063,"Wow, excellent work and congratulations on all who can achieve this status.",2015-08-21T01:56:08+0000,10153647547629063_10153647972794063,4418829484573,1
899,178524104062_10153647547629063,Congratulations!,2015-08-20T23:09:26+0000,10153647547629063_10153647677274063,10202839706176915,1
900,178524104062_10153647547629063,"Outstanding achievements, and demonstrations of toughness!!  Congratulations!!",2015-08-20T23:35:20+0000,10153647547629063_10153647731834063,10202957296406696,1
901,178524104062_10153647547629063,My son was here....taught for 2.5 years,2015-08-21T04:40:28+0000,10153647547629063_10153648184179063,798164893573962,0
902,178524104062_10153647547629063,Outstanding SFC FRANKLIN Retired us army,2015-08-21T03:42:37+0000,10153647547629063_10153648124854063,145062419167437,0
903,178524104062_10153647547629063,"You go, gals!",2015-08-24T17:37:02+0000,10153647547629063_10153656806269063,10203228659231580,0
904,178524104062_10153647547629063,"Hooray,  sammiches for all !!!",2015-08-21T03:15:18+0000,10153647547629063_10153648082804063,445366295599605,1
905,178524104062_10153644048929063,Good.,2015-08-19T13:48:28+0000,10153644048929063_10153644100114063,884641041564098,0
906,178524104062_10153644048929063,'bout time.,2015-08-19T17:05:08+0000,10153644048929063_10153644436334063,1597245233883720,0
907,178524104062_10153641860989063,Hi Brit!,2015-08-18T18:50:33+0000,10153641860989063_10153642425839063,10204065720102115,0
908,178524104062_10153641860989063,Congrats!!! Hope you guys are doing well... Cant wait to leave Korea lol take care,2015-08-19T10:01:12+0000,10153641860989063_10153643739189063,786691681387436,0
909,178524104062_10153641860989063,Congratulations!,2015-08-19T02:08:44+0000,10153641860989063_10153643159384063,215688608641482,0
910,178524104062_10153641015179063,Earned,2015-08-18T03:54:55+0000,10153641015179063_10153641021019063,10201004615196706,1
911,178524104062_10153641015179063,Thanks to LOWER standards...the new ARMY way!! social experiment complete!!,2015-08-18T12:34:20+0000,10153641015179063_10153641687104063,620361004717772,0
912,178524104062_10153641015179063,,2015-08-18T11:30:58+0000,10153641015179063_10153641587554063,10204299655312119,0
913,178524104062_10153641015179063,Earned and I think it is about time...From a Retired Sergeant Major.,2015-08-18T11:47:06+0000,10153641015179063_10153641615374063,993246154022189,0
914,178524104062_10153641015179063,Outstanding. Proud of u. Ed helpers comment sucks. He must be jealous.,2015-08-18T17:28:46+0000,10153641015179063_10153642255429063,1701942280122411,0
915,178524104062_10153641015179063,Not a good thing,2015-08-18T09:36:53+0000,10153641015179063_10153641429939063,10203074711455028,0
916,178524104062_10153640093174063,Great Job CSM Stanley!!! Sappers Lead the Way!,2015-08-17T23:15:43+0000,10153640093174063_10153640708409063,10152504911501188,2
917,178524104062_10153640093174063,Nicole I saw normans name but what does it mean???,2015-08-17T22:35:52+0000,10153640093174063_10153640655489063,858465250859387,0
918,178524104062_10153640093174063,Norman!!!!!!!!,2015-08-17T23:34:54+0000,10153640093174063_10153640733684063,893703120649207,0
919,178524104062_10153639761834063,"For 1971 this was so very true! The transition from the old enlisted culture was beginning to transition to today's Army. Our younger enlisted today are far more athletic, educated, and are capable of embracing the enhanced responsibility.",2015-08-17T15:07:22+0000,10153639761834063_10153639793769063,496350613824340,3
920,178524104062_10153634151714063,Great Man and Great Leader! You will be missed Sir.,2015-08-15T06:41:43+0000,10153634151714063_10153634333079063,850870314932222,0
921,178524104062_10153634151714063,Hooah!,2015-08-15T04:14:35+0000,10153634151714063_10153634162959063,10202501554555388,0
922,178524104062_10153634151714063,Thank you for your service sir.,2015-08-15T20:53:40+0000,10153634151714063_10153635925874063,696003433770935,0
923,178524104062_10153634151714063,He is a good man!,2015-08-15T16:05:03+0000,10153634151714063_10153635331059063,845577162123929,1
924,178524104062_10153634143144063,"Please Gen Milley, don't be an Obama puppet. Stand up for what you know is right.",2015-08-16T00:37:30+0000,10153634143144063_10153636253734063,727433520612986,0
925,178524104062_10153634143144063,I hope he tells obummer where to stick it!!! Take a stand!!,2015-08-16T02:10:05+0000,10153634143144063_10153636405014063,845577162123929,0
926,178524104062_10153634143144063,??,2015-08-15T12:45:18+0000,10153634143144063_10153634943824063,1383387895307249,0
927,178524104062_10153621500199063,So true General Sir,2015-08-10T18:45:49+0000,10153621500199063_10153622419524063,1383387895307249,0
928,178524104062_10153618178374063,That's the way we do it death from above all the way!,2015-08-09T16:04:03+0000,10153618178374063_10153618236354063,671134163005428,1
929,178524104062_10153618178374063,Airborne!,2015-08-09T17:30:53+0000,10153618178374063_10153618488949063,10152791895194333,0
930,178524104062_10153618178374063,Airborne!!!,2015-08-09T21:09:05+0000,10153618178374063_10153619238349063,872844222778521,0
931,178524104062_10153618178374063,Airborne!,2015-08-09T15:43:56+0000,10153618178374063_10153618199694063,10206144689429806,1
932,178524104062_10153618178374063,"Memories, a Maroon Beret & wings with a White Maple Leaf. From your neighbours to the North, congrats and thanks!! AIRBORNE!",2015-08-09T23:41:30+0000,10153618178374063_10153619659529063,10154429691280581,0
933,178524104062_10153612769369063,Happy Birthday Sergeant Major.,2015-08-08T01:45:03+0000,10153612769369063_10153613602484063,10154592867830562,0
934,178524104062_10153607241979063,Good Luck Class 66,2015-08-05T19:43:05+0000,10153607241979063_10153607479769063,884101694963708,1
935,178524104062_10153607241979063,"Congrats CSM,(Dennis) you have made L03 from Class 53 proud!",2015-08-06T01:04:12+0000,10153607241979063_10153608110194063,10152286661162793,1
936,178524104062_10153607241979063,Go get em!!!,2015-08-06T22:19:51+0000,10153607241979063_10153610690629063,10202827397360782,0
937,178524104062_10153607241979063,"Class 63 ""ALL IN""",2015-08-06T03:36:24+0000,10153607241979063_10153608416364063,653300804785947,0
938,178524104062_10153607241979063,"Good luck Class 66!   (SGM Ret  Hardy, Class 44)",2015-08-06T02:02:24+0000,10153607241979063_10153608216409063,10202823440740708,0
939,178524104062_10153607241979063,Work hard and have fun SGM (R) Reyes CLASS 54,2015-08-06T00:48:11+0000,10153607241979063_10153608076544063,733175986733250,0
940,178524104062_10153607241979063,,2015-08-07T08:14:12+0000,10153607241979063_10153611437149063,1383387895307249,0
941,178524104062_10153607241979063,"Godspeed class 66, class 52 international, Croatia",2015-08-06T10:28:12+0000,10153607241979063_10153609244754063,1494644074157676,0
942,178524104062_10153601934669063,Bill Davis from Orland?,2015-08-04T14:51:49+0000,10153601934669063_10153604521409063,1434655520183867,0
943,178524104062_10153601934669063,Moral courage is the mark of a leader!,2015-08-04T01:47:46+0000,10153601934669063_10153603358714063,496350613824340,0
944,178524104062_10153601934669063,Nunca habia visto la insinia  l con dos estrella,2015-08-03T15:37:13+0000,10153601934669063_10153602241339063,352135191633680,0
945,178524104062_10153595979874063,Congrats and thank you for ALL your years of service. I have a friend still fighting that has 34 years in. Think his turn is coming soon. God Bless each one of you!!,2015-07-31T22:10:54+0000,10153595979874063_10153595985504063,10203004247128381,1
946,178524104062_10153595979874063,anyone   adore this  as much as me ?,2015-08-03T01:30:39+0000,10153595979874063_10153600932299063,1420570558236677,0
947,178524104062_10153585371249063,"The biggest life lesson I took from the military is self-sacrifice for unit cohesion and mission accomplishment. The United States Military is unique because it rewards unit accomplishment while recognizing, fostering, and promoting individual leadership. This cannot happen without Leaders that put their men and women first. If more military leaders carried that ideal into the civilian world, we would be a better Nation for it.",2015-07-27T15:07:18+0000,10153585371249063_10153585532299063,10205982751522718,1
948,178524104062_10153585371249063,Hope it is still true!,2015-07-28T00:27:08+0000,10153585371249063_10153586621149063,292509487575118,0
949,178524104062_10153577848824063,Frank Purnell thats you,2015-07-24T17:24:34+0000,10153577848824063_10153578263969063,1375385872781294,0
950,178524104062_10153575865104063,Charles Dees,2015-07-23T16:59:52+0000,10153575865104063_10153575919864063,10152693643259727,2
951,178524104062_10153575706584063,"Ok I will not disparage PRT because I have only seen PRT in the infant/crawl stages due to my assignment since the program started. I do know your program should grow as your soldiers get more physically fit. 

I do however completely agree that the sacred hour is gone and we need to get it back. Whether that hour is 0630-0900 or 1500-1700 is no matter. PT should be uninterrupted. 1SGs should not be letting anything happen during that time that doesn't have to do with breaking a sweat. I would tell you that those needing extra PT should be having formations on Saturday. 

Lastly I will say that you gotta respect SMA's hustle. Even when you may not initially agree with what he is saying, you always see his point. True leadership right there.",2015-07-23T16:00:03+0000,10153575706584063_10153575777609063,10152784026508206,4
952,178524104062_10153575706584063,I think this SMA might be trying to go in the right direction!,2015-07-23T22:12:28+0000,10153575706584063_10153576535774063,10202189549458749,0
953,178524104062_10153575706584063,Hooah!,2015-07-23T15:34:02+0000,10153575706584063_10153575731549063,10202811307436492,0
954,178524104062_10153575706584063,Or catch up on paperwork.,2015-07-24T23:42:59+0000,10153575706584063_10153578915429063,627442794002200,0
955,178524104062_10153575706584063,You should not use your PT time to work on NCOERs or caught of on paperwork.,2015-07-24T23:40:03+0000,10153575706584063_10153578912689063,627442794002200,0
956,178524104062_10153573143684063,When is it going to open up to TPU Reserve and National Guard?,2015-07-22T21:19:20+0000,10153573143684063_10153574131354063,10201847711832855,0
957,178524104062_10153573143684063,Tim J. Durr,2015-07-22T16:13:19+0000,10153573143684063_10153573443904063,10202532822619070,1
958,178524104062_10153567963859063,12B...Essayons!,2015-07-20T14:19:22+0000,10153567963859063_10153568004369063,496350613824340,0
959,178524104062_10153559392204063,We have come full circle! My original issued uniform was the brown Ike Jacket and it was so much more comfortable and appealing to me then the green uniform we had to purchase to replaced it!,2015-07-16T18:19:51+0000,10153559392204063_10153559414024063,870104619668145,2
960,178524104062_10153559392204063,"Here we go!   New SMA, New Uniforms ...$$$$",2015-07-16T21:11:42+0000,10153559392204063_10153559732249063,10202501554555388,5
961,178524104062_10153559392204063,"What a concept, cut the force by 40,000 and then spend money on uniform changes.....what a waste of $$$",2015-07-16T21:26:27+0000,10153559392204063_10153559763959063,10152858790179764,7
962,178524104062_10153559392204063,"The Army, and specifically Enlisted Soldiers, have far greater issues which require analysis and resolution than uniforms. Let's fire the Uniform Rehash Brigade in lieu of better training; weapons; and benefits.",2015-07-17T13:26:00+0000,10153559392204063_10153561248849063,10152485015136147,1
963,178524104062_10153559392204063,"Black leather boots, BDUs, and a little bit of care with starch and kiwi at night. Get rid of all that velcro.",2015-07-17T12:16:09+0000,10153559392204063_10153561081259063,746782898679122,1
964,178524104062_10153559392204063,Will I still be able to send my kids to college after I buy all of these uniforms?$?$?$,2015-07-17T02:00:46+0000,10153559392204063_10153560269599063,10204629724197060,1
965,178524104062_10153559392204063,This would be epic...,2015-07-16T19:31:39+0000,10153559392204063_10153559551819063,10152784026508206,0
966,178524104062_10153559392204063,Mixed feelings on that Ike jacket. I think the other changes are all good though.,2015-07-16T18:48:27+0000,10153559392204063_10153559471094063,884641041564098,0
967,178524104062_10153559392204063,Is there a side arm that goes with it??,2015-07-17T16:13:29+0000,10153559392204063_10153561562534063,544248852385140,0
968,178524104062_10153559392204063,"Turbans for all <> high heel boots for all , etc . Y'all get the point .",2015-07-17T16:02:50+0000,10153559392204063_10153561540429063,10201004615196706,0
969,178524104062_10153554859169063,Stay safe prayers to all God bless yall,2015-07-14T17:31:16+0000,10153554859169063_10153554867944063,1090116054347114,0
970,178524104062_10153552394174063,"Does this mean an investigation for the revocation of the MOH for Audie Murphy will get started? After all he was suspected child molester, and alcoholic was he not? Just saying.",2015-07-13T19:37:50+0000,10153552394174063_10153552997034063,10205922330870733,0
971,178524104062_10153552394174063,It would be really nice if they spoke about how awards are NOT rank based.  It drives me nuts that a bunch of commanders seem to stock to this rule that doesn't exist.,2015-07-13T15:11:47+0000,10153552394174063_10153552514329063,702065593165380,0
972,178524104062_10153519809689063,"""I LIKE IKE""!!",2015-07-10T15:41:02+0000,10153519809689063_10153546267379063,1448384638809152,0
973,178524104062_10153540341039063,"Just wish they would check history, every time we cut troops we regret it. cut the civilian force and let the soldiers do the jobs they were trained for. SGM Powell ( retired)",2015-07-08T00:30:47+0000,10153540341039063_10153540778509063,10204166984049129,1
974,178524104062_10153540341039063,"bad move, our leaders have read history or understood it.  They are planning for failure at the cost of military lives.",2015-07-08T21:37:41+0000,10153540341039063_10153542833544063,10202854069461725,0
975,178524104062_10153540341039063,I'd rather they cut the civilian-military government contracts on future weaponry that isn't wanted nor needed.,2015-07-07T23:39:47+0000,10153540341039063_10153540558189063,496350613824340,1
976,178524104062_10153540341039063,Need to make room so illegal immigrants can enlist,2015-07-07T23:25:57+0000,10153540341039063_10153540542274063,10204299655312119,1
977,178524104062_10153540341039063,"The Army has used so many Americans to fight these past 2 wars and now that the fighting is basically done they are throwing Soldiers away like trash. They way things are going America will be fighting another war in the next 5 years, then the Army will be giving out big bonuses to get the same Soldiers back in that they put out.  Wanting them to fight another one of there wars.",2015-07-09T09:10:36+0000,10153540341039063_10153543621414063,415972635233007,0
978,178524104062_10153540341039063,"Lets see, divide the country  by race, if that don't work separate the north and south. Oh and cut the military,  over and over. Anyone else smell a Rat.",2015-07-09T08:02:43+0000,10153540341039063_10153543555139063,757182524294097,0
979,178524104062_10153540341039063,Maybe get rid of some officers. That would save us some money,2015-07-07T22:44:13+0000,10153540341039063_10153540492669063,10204309985405228,0
980,178524104062_10153540341039063,Bad idea,2015-07-08T22:40:46+0000,10153540341039063_10153542942069063,10204168776392274,0
981,178524104062_10153540341039063,"The american army as been used for corporate needs for to long,  a Army (Digne de son nom) is not to be used for that, it's made it loose its credibility and it's meaning, war up on poeple is not a game specialy not to get a few richer. IT""S SUPOSE TO GET PEOPLE MORE RIGHTS, AT LEASE THE RIGHT TO LIVE FREE. L'arm?e Am?ricaine a ?t? utilis?e a des fins corporatives depuis trops longtemp, sa lui a fait perdre sa cr?dibilit? et sa raison d'?tre, d?clar? la guerre sur un peuple nes pas un jeux surtout pas quand il s'agit d'enrichir qu'elle que individus verreux.",2015-07-08T23:31:51+0000,10153540341039063_10153543009939063,1421501131500829,0
982,178524104062_10153540341039063,There goes our national security!,2015-07-08T01:44:53+0000,10153540341039063_10153540888459063,680212925358595,0
983,178524104062_10153540341039063,Here it goes again! Don't worry you will be recalled when the decision is made yo go back to the flea infested desert! Ugh!,2015-07-07T22:08:04+0000,10153540341039063_10153540407379063,10203521454027825,0
984,178524104062_10153540341039063,Stay safe prayers to all God bless yall,2015-07-07T22:02:08+0000,10153540341039063_10153540376839063,1090116054347114,0
985,178524104062_10153519803539063,Stay safe prayers to all God bless yall,2015-07-07T14:12:55+0000,10153519803539063_10153539317504063,1090116054347114,0
986,178524104062_10153519782714063,"A Patriots oath for his countrymen defense n safety, so, what they are in our lives? They are our heroes...we love you , and Merry Christmas.",2015-12-25T23:17:12+0000,10153519782714063_10153922938189063,1474259782865096,0
987,178524104062_10153519782714063,Best SMA. A true soldier!,2015-07-06T15:12:56+0000,10153519782714063_10153536906839063,10204986058948567,1
988,178524104062_10153519782714063,"Once a Soldier, a Soldier for Life!",2015-07-06T14:05:22+0000,10153519782714063_10153536732814063,620824601267813,2
989,178524104062_10153525921449063,Stay safe prayers to all God bless yall,2015-07-02T16:33:56+0000,10153525921449063_10153525929279063,1090116054347114,0
990,178524104062_10153522719034063,So when will they do something with the career E4's and E5's and stop going after the SN NCO's that have went to school and done everything required,2015-07-01T19:37:28+0000,10153522719034063_10153523423144063,885380691509582,1
991,178524104062_10153516983264063,"Such a Statesman and great man.  Unfortunately, we have very few Statesmen these days.",2015-06-29T17:47:51+0000,10153516983264063_10153517235014063,1448384638809152,1
992,178524104062_10153516983264063,amen,2015-06-29T18:19:01+0000,10153516983264063_10153517322744063,10202854069461725,0
993,178524104062_10153508886504063,"I hope it works. It was possible to use the old form as a performance improvement and promotion evaluation tool, but raters and senior raters rarely chose to do the work required for correct use. Past attempts to change rater behavior by changing the form haven't been successful.",2015-06-26T17:18:01+0000,10153508886504063_10153509326944063,322391767939235,0
994,178524104062_10153508886504063,No sure if the backbone...will weaken. A lot of relating to officers .,2015-06-28T14:10:41+0000,10153508886504063_10153514046379063,10205909017717305,0
995,178524104062_10153503681969063,Felipe Arellano,2015-06-24T19:40:05+0000,10153503681969063_10153503824109063,874946319206433,0
996,178524104062_10153496676374063,Exactly////,2015-06-22T15:28:54+0000,10153496676374063_10153496918639063,4511775368610,2
997,178524104062_10153496676374063,That is the NCO way................,2015-06-23T01:00:09+0000,10153496676374063_10153498590404063,733175986733250,1
998,178524104062_10153496676374063,"Be, Know, Do! Great quote.",2015-06-23T10:47:40+0000,10153496676374063_10153499522819063,205128109531204,1
999,178524104062_10153496676374063,Absolutely!,2015-06-23T11:02:24+0000,10153496676374063_10153499547189063,355897387951135,1
1000,178524104062_10153496676374063,"Nice job, SMG Pat Cotrell!",2015-06-23T05:29:01+0000,10153496676374063_10153498960474063,10203553424011447,1
1001,178524104062_10153496676374063,That's also a full time mind set to  keep and to live by on a 24/7 basis!,2015-06-22T23:49:28+0000,10153496676374063_10153498478989063,496350613824340,0
1002,178524104062_10153496676374063,"When we did the Meg SA junior leaders course the aim was to produce ""technically and tactically competent"" junior leaders. Which is the higher standard, competent or proficient?",2015-06-23T14:25:42+0000,10153496676374063_10153500137614063,1622770907995268,0
1003,178524104062_10153484560509063,Congratulations to all these outstanding Soldiers! SGM Machado - USASMA Class 60,2015-06-18T19:12:30+0000,10153484560509063_10153485364464063,1176827669001552,2
1004,178524104062_10153484560509063,"Congratulations!  CSM (Ret) Albert L. Gray, Sr., Class 26, USASMA... :)",2015-06-18T15:36:35+0000,10153484560509063_10153484911349063,841199642573669,3
1005,178524104062_10153484560509063,"Congratulations SGM (Ret) James David Keith, Class 28, USASMA",2015-06-18T16:30:46+0000,10153484560509063_10153485036174063,734648126567021,3
1006,178524104062_10153484560509063,Congrats!  SGM (Ret) Bill Henson Class 59,2015-06-18T16:50:55+0000,10153484560509063_10153485077444063,869053846438699,3
1007,178524104062_10153484560509063,Congrats!  CSM (Ret) Jimmy D. Jones. Class 26 USASMA!,2015-06-18T15:43:23+0000,10153484560509063_10153484930029063,874542192557152,3
1008,178524104062_10153484560509063,"Congratulations SGM (Ret) Jim Ahrens, Class 43, USASMA.",2015-06-18T19:31:02+0000,10153484560509063_10153485408979063,10202717686456712,1
1009,178524104062_10153484560509063,"Congratulations ! SGM (Ret) Ronald D. Powell ,Class six (yes class 6)",2015-06-18T23:08:35+0000,10153484560509063_10153485962869063,10204166984049129,2
1010,178524104062_10153484560509063,"Congratulations, SGM (Ret) James Burch, Class #38",2015-06-18T19:17:29+0000,10153484560509063_10153485374154063,10205632331594712,2
1011,178524104062_10153484560509063,"Congratulations! SGM (ret) Jeffrey M. Hall, Class 56, USASMA.",2015-06-19T10:07:11+0000,10153484560509063_10153487108984063,10153033758649307,1
1012,178524104062_10153484560509063,"Congratulations SGM (Ret) Powell, Class 6, USASMA - WOW!  :)",2015-06-19T00:16:40+0000,10153484560509063_10153486166484063,841199642573669,2
1013,178524104062_10153477599664063,"So true!
Wie wahr!",2015-06-16T10:24:09+0000,10153477599664063_10153478920374063,565888293551584,0
1014,178524104062_10153477599664063,I'll use this statement in my international NCO Leadership courses.,2015-06-16T19:19:10+0000,10153477599664063_10153479926179063,10204797023598772,0
1015,178524104062_10153470560834063,Can't find the graduation pictures among the many albums posted.  What title should I look for?,2015-06-14T13:04:24+0000,10153470560834063_10153474448759063,372273002969522,0
1016,178524104062_10153466725294063,Liked and shared!,2015-06-11T19:56:29+0000,10153466725294063_10153467681289063,10152663498899055,0
1017,178524104062_10153466725294063,HOOAH !,2015-06-11T15:01:23+0000,10153466725294063_10153466930684063,445366295599605,0
1018,178524104062_10153465532789063,Sad day for the US MILITARY!,2015-06-11T02:58:00+0000,10153465532789063_10153465936064063,10202501554555388,0
1019,178524104062_10153465532789063,They need to shrink in pensions of everyone in the Executive and Legislative Branches (just to make it fair).,2015-06-10T22:00:22+0000,10153465532789063_10153465577279063,10203412414886964,6
1020,178524104062_10153465532789063,Wall Street is salivating over this.  They'll make $ no matter what happens. It's the investors that will assume all the risk as the market fluctuates. I hope that the legislators of this gamble enjoy their campaign contributions.,2015-06-11T00:50:32+0000,10153465532789063_10153465788654063,10203608695167026,2
1021,178524104062_10153465532789063,"I hope DFAS creates a calculator to help service members decide which plan is better, with total transparency of benefits.",2015-06-11T11:18:16+0000,10153465532789063_10153466534274063,10202500510127921,2
1022,178524104062_10153465532789063,"Meanwhile, thing are going to get rough. As for me, I have to make cuts, so my internet has to go- a temporary setback I hope - whenever I get back online, if I get back online I'll say hello. Till then",2015-06-10T21:35:14+0000,10153465532789063_10153465545459063,10152062925118806,2
