,Post_ID,Comment,Created_Time,Comment_ID,Commenter_ID,Likes
2315,148755278523144_736129236452409,My husband was in that building. I'm glad he's ok!,2014-08-25T13:43:56+0000,736129236452409_736139996451333,659465957433892,66
2316,148755278523144_736129236452409,We're all okay lockdown over,2014-08-25T13:58:00+0000,736129236452409_736148049783861,949911031688993,48
2317,148755278523144_736129236452409,They just announced an all clear,2014-08-25T13:48:55+0000,736129236452409_736141689784497,10154646352810173,38
2318,148755278523144_736129236452409,Everyone please be careful. Praying no one is injured in this mess...,2014-08-25T13:30:04+0000,736129236452409_736134983118501,332022843643032,37
2319,148755278523144_736129236452409,Praying for my husband and all soldiers/civilians and families on post.,2014-08-25T13:36:31+0000,736129236452409_736137736451559,10154823625145157,31
2320,148755278523144_736129236452409,This crap is getting out of hand. What the hell?,2014-08-25T13:36:56+0000,736129236452409_736137869784879,488999314559757,27
2321,148755278523144_736129236452409,There is an all clear right now. The sirens just announced it.,2014-08-25T13:48:25+0000,736129236452409_736141466451186,10154646352810173,23
2322,148755278523144_736129236452409,Everyone at the cascom building was accounted for.,2014-08-25T13:55:44+0000,736129236452409_736147039783962,737097489645298,17
2323,148755278523144_736129236452409,All clear.,2014-08-25T13:49:44+0000,736129236452409_736141973117802,10201952418631934,16
2324,148755278523144_736129236452409,"When the Fort Hood incident happened, my daughter was graduating at Fort Jackson! There were snipers in the woods surrounding those of us who were watching our children graduate!  She then came to Fort Lee for AIT. Now she's in texas at Fort Hood. Parents, please know that there are armed and qualified soldiers there to take care of your AIT's.",2014-08-25T14:18:23+0000,736129236452409_736165036448829,10203829082672959,13
2325,148755278523144_736129236452409,All clear from my son that is at AIT in barracks,2014-08-25T13:52:16+0000,736129236452409_736143123117687,10152511487094228,13
2326,148755278523144_736129236452409,I pray dear God you watch over are soldiers and there families keep them safe from harm. I will continue to pray for are brave soldiers and there families.. God Bless,2014-08-25T13:44:14+0000,736129236452409_736140076451325,10203452855462584,13
2327,148755278523144_736129236452409,Sirens just said all clear. God willing there are no injuries,2014-08-25T13:50:50+0000,736129236452409_736142473117752,449239065217671,12
2328,148755278523144_736129236452409,"nobody seems to know yet, my husband just called to tell me not to come on post.",2014-08-25T13:30:34+0000,736129236452409_736135223118477,10153297432894359,12
2329,148755278523144_736129236452409,My son just text me he is ok!,2014-08-25T14:06:57+0000,736129236452409_736159983116001,10203003008826907,11
2330,148755278523144_736129236452409,Can we get an update please?! My soldier is on that base and I have no way to contact him.,2014-08-25T13:59:49+0000,736129236452409_736148643117135,10152590027654038,11
2331,148755278523144_736129236452409,"Got a text from my son on  base, ALL CLEAR.",2014-08-25T13:59:12+0000,736129236452409_736148429783823,792498687473300,11
2332,148755278523144_736129236452409,Praying from Korea,2014-08-25T13:38:25+0000,736129236452409_736138259784840,10202858172348462,11
2333,148755278523144_736129236452409,Another situation that could have been resolved had Soldiers been able to conceal carry on base.,2014-08-25T13:44:43+0000,736129236452409_736140209784645,973186426040264,18
2334,148755278523144_736129236452409,Please have kids call home that are in AIT so family can know there okay,2014-08-25T14:10:17+0000,736129236452409_736161649782501,751654634883541,9
2335,148755278523144_736129236452409,If we could carry on post we would have a bunch of privates shooting themselves and eachother.,2014-08-25T14:09:42+0000,736129236452409_736161409782525,611499932294541,9
2336,148755278523144_736129236452409,I pray for everyone on Fort Lee to be able to go home tonight to their families,2014-08-25T13:42:33+0000,736129236452409_736139523118047,10152582442283237,9
2337,148755278523144_734544589944207,Read it again Peter Hackett. It doesn't say you can't support at all. Just can't do it in uniform. Stop trying to make something out of nothing. You sound like CNN!,2014-08-21T20:09:31+0000,734544589944207_734549276610405,10152588171324247,28
2338,148755278523144_734544589944207,ALS is one of the charity's that you can support under the Combined Federal Campaign.  Just don't do the Ice Bucket Challenge while in uniform and don't call people out by their rank and Everything will be ok,2014-08-21T22:33:52+0000,734544589944207_734590016606331,895336313812553,8
2339,148755278523144_734544589944207,They can do it on own time. Civilian clothing!,2014-08-22T11:08:48+0000,734544589944207_734790556586277,285662718261693,1
2340,148755278523144_734544589944207,"if my husband can not donate to this cause, then please do not ask him to donate to combined federal campaign due to that is also a charity fundraiser.",2014-08-21T21:41:54+0000,734544589944207_734575993274400,10152543915084226,1
2341,148755278523144_734544589944207,Peter get your facts straight. If you are sending in money you are only making the rich richer!!! Only part of the money actually goes towards the research. The rest goes to the millionaires that run the organization. Most people are dumping ice water on their heads so they don't have to support it financially anyway!!!,2014-08-21T21:13:13+0000,734544589944207_734567756608557,10206205317316142,3
2342,148755278523144_734544589944207,Nick Robertson,2014-08-22T17:51:49+0000,734544589944207_734933233238676,10203003639547456,0
2343,148755278523144_734544589944207,Brandon Simpkins,2014-08-22T12:11:51+0000,734544589944207_734808119917854,608468422606850,0
2344,148755278523144_734544589944207,"SO TRUE PETE, COULDNT HAVE SAID IT BETTER MYSELF!!!",2014-08-21T20:05:45+0000,734544589944207_734548333277166,4112459386501,0
2345,148755278523144_734544589944207,Tracie Lynn Vaughan  Dynetha Childs Sonya Adkins,2014-08-21T20:05:02+0000,734544589944207_734548203277179,10203165850529600,0
2346,148755278523144_734544589944207,And the sad part is that Veterans are twice as likely to be diagnosed with this disease. It is service connected...,2014-08-22T03:10:10+0000,734544589944207_734673989931267,737569996293773,1
2347,148755278523144_734544589944207,"Thanks Kate Beatrice, I put this out too",2014-08-22T12:14:09+0000,734544589944207_734808876584445,10100498278228628,0
2348,148755278523144_734544589944207,Kenneth Chris Bannister,2014-08-21T23:38:31+0000,734544589944207_734606413271358,10152590027654038,0
2349,148755278523144_732876230111043,I think they are doing great. ,2014-08-22T00:33:55+0000,732876230111043_734622133269786,1495777547375747,0
2350,148755278523144_732876230111043,esta re buena la foto,2014-08-20T15:02:44+0000,732876230111043_734040033327996,1798316010438878,0
2351,148755278523144_733336320065034,Chad Combs,2014-08-20T04:08:17+0000,733336320065034_733870116678321,10154887179830553,0
2352,148755278523144_733336320065034,Go figure while I am sitting in the er as we speak.,2014-08-20T02:13:17+0000,733336320065034_733840330014633,10152898870714704,0
2353,148755278523144_733336320065034,Great,2014-08-19T16:11:16+0000,733336320065034_733370596728273,10204406294864997,0
2354,148755278523144_730674746997858,Kenneth Chris Bannister,2014-08-14T14:27:35+0000,730674746997858_730793346985998,10152590027654038,0
2355,148755278523144_730674746997858,Jeffrey D Jamaleldine,2014-08-14T13:05:33+0000,730674746997858_730714423660557,10100104125748680,0
2356,148755278523144_730674610331205,Jim,2014-08-14T19:23:44+0000,730674610331205_730904223641577,10152880992592421,1
2357,148755278523144_730674610331205,I see a few familiar faces in the crowd. Glad everyone is having fun.,2014-08-14T16:54:42+0000,730674610331205_730858506979482,10152440215350095,0
2358,148755278523144_730674610331205,Makes my day! With all that our soldiers go through it's nice to see them happy! Being away from family and friends is the hardest thing a soldier can go through!,2014-08-14T15:03:05+0000,730674610331205_730821916983141,752310641531634,0
2359,148755278523144_730138927051440,"How time goes by, so much transition with the military uniforms.",2014-08-14T13:15:06+0000,730138927051440_730717190326947,419599401525612,0
2360,148755278523144_730138927051440,Bumblebee uniform again like back in the 80's,2014-08-13T13:40:21+0000,730138927051440_730214590377207,10152662650470991,0
2361,148755278523144_730132387052094,"If only he could have seen and known how much he meant to so many, especially to God.",2014-08-13T14:15:29+0000,730132387052094_730227870375879,10203566463468054,3
2362,148755278523144_730132387052094,If only the president n the government gave our military a little support. RIP genie,2014-08-13T23:29:35+0000,730132387052094_730431583688841,10152508486192593,0
2363,148755278523144_730132387052094,Great tribute to a fantastic man. May God bless his love ones.,2014-08-13T22:34:39+0000,730132387052094_730399860358680,492525520889283,0
2364,148755278523144_730132387052094,love it  ty so much,2014-08-13T22:16:03+0000,730132387052094_730393640359302,10152410233722994,0
2365,148755278523144_730132387052094,Thank you for posting this!,2014-08-13T18:47:34+0000,730132387052094_730325713699428,4804513407507,0
2366,148755278523144_730132387052094,RIP ROBIN WILLIAMS,2014-08-13T16:21:42+0000,730132387052094_730275963704403,818995338133687,0
2367,148755278523144_730132387052094,"Jennifer Collins, Nic Larocca, Emily Offer -- great video of a great man.  May he rest in peace now!",2014-08-13T12:18:16+0000,730132387052094_730143327051000,10203823408444801,0
2368,148755278523144_730132387052094,"Thank you Robin Williams for all you've done!  You put smiles on many peoples faces, especially our Men and Women fighting for our Freedom!!",2014-08-13T12:09:53+0000,730132387052094_730140773717922,460524604079632,1
2369,148755278523144_726824257382907,Was there on Tuesday looks great in there.,2014-08-07T23:12:16+0000,726824257382907_726977517367581,449239065217671,0
2370,148755278523144_726906694041330,Done!,2014-08-07T22:47:06+0000,726906694041330_726967810701885,783077878378258,0
2371,148755278523144_725141827551150,Two of the active duty Coast Guard members work at the Military Entrance Processing Station (MEPS).  There is also a Coast Guard instructor at one of the schools ? last hint!,2014-08-04T15:52:25+0000,725141827551150_725229404209059,148755278523144,0
2372,148755278523144_725141827551150,The lake by cardinal golf course!,2014-08-04T14:21:35+0000,725141827551150_725193147546018,1004364719590621,3
2373,148755278523144_725141827551150,"Mikie Bramblett and Judith Bramblett, we appreciate your service too!!!!",2014-08-04T20:30:54+0000,725141827551150_725337584198241,10205278861508434,0
2374,148755278523144_725141827551150,Pwd,2014-08-04T16:37:19+0000,725141827551150_725245640874102,10152242842915938,0
2375,148755278523144_725141827551150,MITD,2014-08-04T13:35:03+0000,725141827551150_725174047547928,10203626390493047,0
2376,148755278523144_725141827551150,At the CDC.,2014-08-04T12:18:22+0000,725141827551150_725142684217731,10152331022785516,0
2377,148755278523144_723641294367870,Thank you Sgt Townsend nice meeting you,2014-08-01T22:11:49+0000,723641294367870_723769651021701,10205209391453541,0
2378,148755278523144_721839534548046,hooah!,2014-07-29T13:16:37+0000,721839534548046_721845911214075,10153179550419640,0
2379,148755278523144_718989474833052,Jimmy Lux,2014-07-24T18:52:52+0000,718989474833052_718992094832790,869545956429467,0
2380,148755278523144_718874008177932,"Craig, where is Ricky?  Can't find him on FB and haven't heard a peep out of him in over a year now.",2014-07-26T20:26:48+0000,718874008177932_720184231380243,771059532974005,0
2381,148755278523144_718357691562897,"Christine, the Newcomers' Dinners are typically held quarterly.  For more information, contact FMWR at 804-734-7821.",2014-07-24T13:12:09+0000,718357691562897_718860814845918,148755278523144,0
2382,148755278523144_718357691562897,How often do you have these? We will be arriving late August and will miss this event.,2014-07-23T16:00:05+0000,718357691562897_718392148226118,10100808900010153,0
2383,148755278523144_718357691562897,"Also a community page helping families find the necessary phone numbers, and information on Fort Lee as well as activities, things to do around the area. The NOTES section is a MUST SEE for lots of information that can be easily accessed! ;)  Just click the flower to take you to the page ;)  I try to help as well by finding answers to questions posted or sent pm. ;)",2014-07-23T15:29:56+0000,718357691562897_718380068227326,315600881952698,0
2384,148755278523144_717759254956074,"Crystal Gochenouer, in case my kids drive you crazy. Lol",2014-07-22T12:29:07+0000,717759254956074_717766918288641,10152165144447003,1
2385,148755278523144_717759254956074,Nachelle Ilnicki,2014-07-22T12:25:20+0000,717759254956074_717765551622111,990929057591221,1
2386,148755278523144_717759254956074,Mobile Playground rocks!,2014-07-22T12:44:45+0000,717759254956074_717772011621465,578703718894721,0
2387,148755278523144_717747908290542,"Amber Smith-Pierce, something for the kids to do",2014-07-23T12:21:34+0000,717747908290542_718308491567817,402687699889289,0
2388,148755278523144_717747908290542,Stephen Carver maybe if you can get a Monday night off. This would be fun,2014-07-22T19:14:47+0000,717747908290542_717945598270773,10203857905873419,0
2389,148755278523144_717747908290542,Rebekah Lynn,2014-07-22T15:20:45+0000,717747908290542_717835621615104,838870839466171,0
2390,148755278523144_717747908290542,"Added to Community page Notes section, thank you for the heads up! ;)",2014-07-22T14:16:56+0000,717747908290542_717807344951265,315600881952698,0
2391,148755278523144_715083401890326,A post-wide email was just sent out moving the event to July 31.,2014-07-24T13:44:13+0000,715083401890326_718873531511313,148755278523144,0
2392,148755278523144_715083401890326,Is this still happening due to the rain?,2014-07-24T13:26:14+0000,715083401890326_718866358178697,862044063836359,0
2393,148755278523144_714078248657508,That's soo sweet. Hope my army will take a page out of your book. Jamaica defence force. Is miss beckey still working at forth lee I was there @ school in 2001.i love forth lee.,2014-08-11T02:36:16+0000,714078248657508_728558447209488,10153011792086346,0
2394,148755278523144_714078248657508,Thank you for the heads up added this to my community page in the notes section! ;),2014-07-17T14:42:03+0000,714078248657508_715098385222161,315600881952698,0
2395,148755278523144_714078248657508,What a fantastic program.  Bases around the world should join in this program!,2014-07-17T14:01:39+0000,714078248657508_715074655224534,10203823408444801,0
2396,148755278523144_714316838633649,"Kristin Jenkins Gatti, Cory Mcconico, Jamie Zunic, heather is famous!",2014-07-16T00:06:59+0000,714316838633649_714329885299011,10152909970693137,3
2397,148755278523144_714316838633649,"Tnks FORT LEE my son jst got here in denver last night from u base,tnks for everythyng,tnks a bunch from fam,CAN CRUZ,",2014-07-16T12:34:46+0000,714316838633649_714545828610750,779137725508800,0
2398,148755278523144_714316838633649,Go Heather!,2014-07-16T01:07:13+0000,714316838633649_714350865296913,10209397116190537,0
2399,148755278523144_714316838633649,So very true.....I'm a former teacher and that is what is happening in our class rooms throughout America.  Sad....the students can not write.....only use their keys to type on their tech equipment. Too much over-reliant on technology....starting in pre-school......and all through their school years.,2014-07-15T23:40:10+0000,714316838633649_714318378633495,1432677250322801,1
2400,148755278523144_714316838633649,"Good job, CPT Schmitt!  You've made a difference!",2014-07-16T00:04:35+0000,714316838633649_714329065299093,894454450589498,0
2401,148755278523144_714067491991917,Added to my Notes page to share the info!  Thanks for the info!,2014-07-15T13:40:28+0000,714067491991917_714077185324281,315600881952698,0
2402,148755278523144_711772535554746,Congrats sgt ausdall,2014-08-11T02:29:34+0000,711772535554746_728556603876339,10153011792086346,0
2403,148755278523144_711772535554746,Congrats Sgt Stephanie Van Ausdall in your quest to become a naturalized U.S. Citizen!!! Very Happy for YOU!!,2014-07-11T18:51:18+0000,711772535554746_711781922220474,315600881952698,0
2404,148755278523144_711046592294007,Congratulations Susan. Well deserved award.,2014-07-10T16:58:13+0000,711046592294007_711162835615716,1234401906586076,0
2405,148755278523144_711046592294007,"Congratulations, Susan!",2014-07-10T13:58:13+0000,711046592294007_711073938957939,894454450589498,0
2406,148755278523144_711046592294007,Congrats!!,2014-07-10T13:32:55+0000,711046592294007_711065142292152,813348225352270,0
2407,148755278523144_710000435731956,This is a great story and tribute for an exceptional leader and family man!,2014-07-08T17:21:18+0000,710000435731956_710059545726045,10152537482182116,0
2408,148755278523144_707588115973188,,2014-07-04T13:10:27+0000,707588115973188_707592602639406,464461513690404,3
2409,148755278523144_707588115973188,,2014-07-05T19:59:39+0000,707588115973188_708458435886156,786985044647680,2
2410,148755278523144_707588115973188,,2014-07-05T19:59:04+0000,707588115973188_708458262552840,786985044647680,2
2411,148755278523144_707588115973188,just a few from last night,2014-07-05T19:58:41+0000,707588115973188_708458145886185,786985044647680,1
2412,148755278523144_707588115973188,,2014-07-05T19:57:55+0000,707588115973188_708457775886222,786985044647680,1
2413,148755278523144_707588115973188,My husband was stationed there in 1978-80. The fireworks are a great memory. We lived in the old housing on Longstreet Drive.,2014-07-05T14:53:46+0000,707588115973188_708294092569257,961789313848758,0
2414,148755278523144_703405559724777,Its was a nice show.I wished they would have had bigger screen on the side so we could see the performers better.,2014-06-27T22:13:29+0000,703405559724777_703612583037408,10203509792122393,0
2415,148755278523144_703405559724777,"We had the good fortune to be at FT Lee for our granddaughter's graduation from AIT, so got to see this amazing show. Wow!! Those Army soldiers are so talented.",2014-06-27T17:02:26+0000,703405559724777_703478053050861,1416358018633269,0
2416,148755278523144_702193199846013,I will be there Charlie!  We went last year in the gym and it was awesome!,2014-06-25T15:30:04+0000,702193199846013_702213343177332,907558489255647,2
2417,148755278523144_702193199846013,Wenonah,2014-06-25T17:45:20+0000,702193199846013_702282643170402,1137867282906438,0
2418,148755278523144_702193199846013,Sindy Loo,2014-06-25T15:50:40+0000,702193199846013_702224453176221,10152417422304274,0
2419,148755278523144_702193199846013,"Jennifer Collins and Nic Larocca or Nic Larocca -- seriously dude, delete one of your FB accounts.  Hope y'all get to go!",2014-06-25T15:33:20+0000,702193199846013_702216423177024,10203823408444801,0
2420,148755278523144_702193199846013,Andrea Carman Krese,2014-06-25T15:21:36+0000,702193199846013_702209616511038,10152786221361745,0
2421,148755278523144_701765976555402,Mariah Clark I think they knew I was coming!!!,2014-06-25T00:22:55+0000,701765976555402_701872019878131,907090539335073,1
2422,148755278523144_701765976555402,Now you can move right?,2014-06-24T23:22:12+0000,701765976555402_701849373213729,10153064030016663,1
2423,148755278523144_701765976555402,Check out me in the picture omari west,2014-06-26T04:27:54+0000,701765976555402_702543429810990,862782077092357,0
2424,148755278523144_701765976555402,So glad to see it,2014-06-25T03:59:31+0000,701765976555402_701948929870440,801213336570501,0
2425,148755278523144_701765976555402,Starbucks should give some discount for military,2014-06-25T00:39:46+0000,701765976555402_701878529877480,698004413593208,0
2426,148755278523144_701765976555402,Brytton Gimli Williams you better go get your coffee!!!!,2014-06-25T00:05:26+0000,701765976555402_701865986545401,10209497874229677,0
2427,148755278523144_701765976555402,Not as good as GreenBean :(,2014-06-24T22:27:19+0000,701765976555402_701828586549141,10152932611674610,0
2428,148755278523144_701765976555402,Lynn Clark,2014-06-24T22:19:11+0000,701765976555402_701824916549508,10204741648880840,0
2429,148755278523144_701765976555402,"Omg, my son will be there all the time!  lol",2014-06-24T21:15:56+0000,701765976555402_701796099885723,10201870947400697,0
2430,148755278523144_701765976555402,Why did they put this place at the entrance I drive into every day?!  #willworkforstarbucks,2014-06-24T21:14:00+0000,701765976555402_701795409885792,10205336282236273,0
2431,148755278523144_701765976555402,That's what id do put a non military supporting franchise I'm an army base,2014-06-24T21:12:52+0000,701765976555402_701795006552499,809733242398860,0
2432,148755278523144_701765976555402,Michael Hasbun,2014-06-24T20:59:34+0000,701765976555402_701788093219857,10152786221361745,0
2433,148755278523144_701765976555402,Drink a cup of joe for me my son.,2014-06-24T20:30:48+0000,701765976555402_701773936554606,686882031419513,0
2434,148755278523144_699388306793169,Congrats!!,2014-06-20T19:26:10+0000,699388306793169_699395663459100,393902237353565,0
2435,148755278523144_698142256917774,Awesome,2014-06-18T12:57:28+0000,698142256917774_698149676917032,10152588837426475,0
2436,148755278523144_698142256917774,Awesome!,2014-06-18T16:06:44+0000,698142256917774_698223396909660,1346545888694609,0
2437,148755278523144_697630230302310,Where's Jason.,2014-06-17T19:30:03+0000,697630230302310_697760560289277,300192066804279,0
2438,148755278523144_697630230302310,Virginia Blackburn,2014-06-17T19:09:15+0000,697630230302310_697752883623378,760778287325458,0
2439,148755278523144_697630230302310,WE got spirit Yes we do!!  GO ARMY!!,2014-06-17T19:04:54+0000,697630230302310_697751626956837,817256798287594,0
2440,148755278523144_697630230302310,Awesome!!,2014-06-17T18:54:22+0000,697630230302310_697747330290600,813348225352270,0
2441,148755278523144_697610203637646,Our Army Birthday Celebration and Cake-Cutting Ceremony starts at 2:30 p.m. at the Lee Theater and is open to the public.  Please join us for the ceremony and the premiere of our highly anticipated Virtual Choir video!,2014-06-17T14:12:00+0000,697610203637646_697612090304124,148755278523144,8
2442,148755278523144_697610203637646,Hey I was there,2014-06-17T23:29:56+0000,697610203637646_697889186943081,10202101260972312,3
2443,148755278523144_697610203637646,Hi I was honored to be there,2015-12-13T19:08:22+0000,697610203637646_1123799637685365,578611222323703,0
2444,148755278523144_697610203637646,"Shirts off you back, boots off your feet, last gallon of fuel.  PACKHORSE SUPPORT!",2014-06-19T03:59:25+0000,697610203637646_698495846882415,659358827507578,0
2445,148755278523144_697610203637646,That is great for the USA army ....HOOH!!!,2014-06-18T12:16:49+0000,697610203637646_698130290252304,1610870435853236,1
2446,148755278523144_697610203637646,My son is doing AIT there now!!!!  HOOAH!!!,2014-06-18T00:03:58+0000,697610203637646_697900100275323,10201870947400697,1
2447,148755278523144_697610203637646,"Hey, I went to AIT there.....HOORAH!!!!!!",2014-06-17T17:29:25+0000,697610203637646_697707530294580,959504860743761,1
2448,148755278523144_697610203637646,"Kenneth Chris Bannister, this is really what you guys were doing this morning!",2014-06-17T15:56:13+0000,697610203637646_697656870299646,10152590027654038,0
2449,148755278523144_697610203637646,"Jennifer Collins, Nic Larocca - were y'all out in this this morning?",2014-06-17T15:31:59+0000,697610203637646_697647770300556,10203823408444801,0
2450,148755278523144_695604860504847,I would love to participate but my work schedule will not allow participation.  Maybe we could do this one weekend?  That may get more people involved.,2014-06-14T20:24:12+0000,695604860504847_696199540445379,10207405610924855,0
2451,148755278523144_695439510521382,And they will be missed!,2014-06-13T13:19:37+0000,695439510521382_695508697181130,10152943868518274,1
2452,148755278523144_695439510521382,Congratulations to you and Laurie. May you truly spend many hours relaxing at the beach now.,2014-06-13T11:37:28+0000,695439510521382_695465380518795,10152223444815819,1
2453,148755278523144_695439510521382,Laurie Cherry Steve Cherry,2014-06-13T11:07:57+0000,695439510521382_695443273854339,10152909970693137,1
2454,148755278523144_695439510521382,Great leader!! Resolute!!!!!,2014-06-13T11:26:47+0000,695439510521382_695462673852399,10204445931324975,0
2455,148755278523144_694809077251092,Quartermaster School in the 60s,2014-06-17T19:14:50+0000,694809077251092_697754766956523,10202362586986597,1
2456,148755278523144_694809077251092,Matt u get cake!!! Or do u have to bake it???,2014-06-13T00:49:45+0000,694809077251092_695206913877975,712155028822848,1
2457,148755278523144_693549997377000,Yeah!! We will be there to see it.   So excited!!,2014-06-10T14:52:04+0000,693549997377000_693609590704374,1416358018633269,1
2458,148755278523144_693113394087327,Welcome to Fort Lee and the Quartermaster School.,2014-06-09T18:49:44+0000,693113394087327_693114224087244,10203237560842016,1
2459,148755278523144_693113394087327,Congratulations Col Kirklin!  Allons!,2014-09-03T19:15:44+0000,693113394087327_740537666011566,10206190654033550,0
2460,148755278523144_693113394087327,Congratulations,2014-06-10T00:09:48+0000,693113394087327_693248450740488,10205465102212049,0
