,Post_ID,Comment,Created_Time,Comment_ID,Commenter_ID,Likes
3466,148755278523144_508123449252990,Mira Michelle Santiago que dises bamos ?,2013-06-03T16:55:45+0000,508123449252990_78034075,533065446808678,0
3467,148755278523144_506570566074945,"Text are not worth your lives people, drive smart and drive safe!",2013-06-04T16:19:25+0000,506570566074945_78036029,10157618817430114,2
3468,148755278523144_506570566074945,"Good, that's how it should be!",2013-05-31T20:46:19+0000,506570566074945_78029031,10152670550683324,1
3469,148755278523144_506570566074945,we have had than Australia solider for a long time,2013-05-31T12:30:42+0000,506570566074945_78028243,773798466001669,0
3470,148755278523144_506287159436619,"Love how some other commisarys are open 7 days a week when we are already closed one day a week and now have to close another day?  And yes Laura, they are alway in the isles.",2013-05-30T20:11:16+0000,506287159436619_4597849,10205735517764575,2
3471,148755278523144_506287159436619,It's funny they say they use Monday for cleaning and restocking.  Every time I go to the commissary they are in the isle making it hard to get through for shoppers.,2013-05-30T19:30:30+0000,506287159436619_4597744,10204009323366233,2
3472,148755278523144_506287159436619,I can't believe this. It's going to make it where if we get paid we will have to go somewhere else. Already not having the commissary open to me is strange. This is the first duty station I've been to where they close on Mondays. I also agree every time I go shopping they seem to be stoking. Might just start looking into a different store to shop at.,2013-05-30T23:34:43+0000,506287159436619_4598235,10204973987010264,0
3473,148755278523144_506287159436619,F' furloughs!,2013-05-30T18:58:32+0000,506287159436619_4597647,10203773751443616,0
3474,148755278523144_505850386146963,Praying for the families  and our American soldiers . God bless them and bring them home safe .,2013-05-30T13:12:25+0000,505850386146963_4596605,624922167637585,3
3475,148755278523144_505850386146963,prayers,2013-06-15T03:40:17+0000,505850386146963_4647812,10203567656222798,0
3476,148755278523144_505850386146963,My thoughts and prayers go with them--may they stay safe so that each and every one of them return.,2013-05-30T10:00:48+0000,505850386146963_4596147,10152670550683324,2
3477,148755278523144_505850386146963,Saying prayers for their safety and God Bless Them All.,2013-05-29T22:08:03+0000,505850386146963_4594638,10203493852971361,1
3478,148755278523144_505850386146963,My son is one of the Soldiers Leaving Fort Lee Next Week going also to Afghanistan! He was held over and did not get to come home first before he has to leave?  God Bless them ALL!!! Thank You! I love you Son !Be safe!,2013-05-29T20:07:28+0000,505850386146963_4594421,715285861842295,1
3479,148755278523144_505850386146963,Prayin for the families and soldiers! thank you for all y'all sacrifice!,2013-05-29T17:56:16+0000,505850386146963_4594070,885817008109564,1
3480,148755278523144_505850386146963,"May God Bless,& Keep Them Safe!!",2013-05-29T17:28:58+0000,505850386146963_4594018,549245841860929,1
3481,148755278523144_505850386146963,"Special prayers for all safety, peace and wisdom. Carmela I am so sorry your son didn't get home. I will lift him up daily. God Bless",2013-05-29T20:16:37+0000,505850386146963_4594441,10205323453911416,0
3482,148755278523144_505850386146963,Gold less each and every one of you and your families!,2013-05-29T18:26:45+0000,505850386146963_4594138,10202130182762545,0
3483,148755278523144_503249896407012,"King of Battle's finest, Loyalty!",2013-05-26T21:30:02+0000,503249896407012_4583972,210748175608631,2
3484,148755278523144_503245963074072,"Sir, PFC Patruck A. Lewis joined the ranks there at Ft. LEE on Monday, after completion of BCT at Ft. Jackson. Please teach him well, because it could save his life one day. Thank you for your servuce Sir. I am a daughter of a WW1 veteran, been a Military spouse, & having my only two sons serving -oldest 23yrs Air Force & youngest at your base, Sir serving in the Army. GOD BLESS???????",2013-05-24T12:53:34+0000,503245963074072_4575711,689923177735071,5
3485,148755278523144_503245963074072,"THANK YOU, SIR..HOOAY???????",2013-05-24T15:46:28+0000,503245963074072_4576222,689923177735071,0
3486,148755278523144_503245963074072,"Hi all, my one and only son has arrived there yesterday!  Look out for him and work him hard ! lol
Happy Memorial Day! Thanks  in advance for all you do! ",2013-05-25T23:43:17+0000,503245963074072_4580880,10207751485643197,0
3487,148755278523144_502727946459207,Amen,2013-05-23T10:27:38+0000,502727946459207_78014910,337081206464485,1
3488,148755278523144_500712199994115,yes ray,2013-05-17T16:54:11+0000,500712199994115_4552282,785637778194194,1
3489,148755278523144_500024003396268,"""After required notifications, we will begin the furlough period on July 8 at the rate of one furlough day per week for most personnel. We plan to continue these furloughs through the end of the current fiscal year. If our budgetary situation permits us to end furloughs early, I would strongly prefer to do so. That is a decision I will make later in the year."" ? Defense Secretary Chuck Hagel",2013-05-15T11:08:34+0000,500024003396268_4544905,148755278523144,1
3490,148755278523144_498192520246083,"GOD BLESS My Son N Law.. And My Daughter And Grandsons... As Well As ALL Those Who Are Serving In EVERY CAPACITY...

KNOW YOU ARE LOVED.. APPRECIATED And Prayers Are Sent DAILY  ....",2013-05-10T16:16:05+0000,498192520246083_4529434,10152343045648376,3
3491,148755278523144_496799997052002,"Do you PMCS Fluid oil, check brakes, lights, horn, water fluids,a good driver is one who plan their trip get the best insurance to cover all rider better safe than sorry. don't allow yourself to get distracted. Accident Avoidance work.",2014-04-23T14:24:22+0000,496799997052002_78587526,1583971278513759,0
3492,148755278523144_494974983901170,A complete list of exempt items is available at www.tax.virginia.gov/salestaxholiday.,2013-05-02T19:19:07+0000,494974983901170_4504005,148755278523144,0
3493,148755278523144_494515307280471,Dashing look cool ...,2013-06-30T23:48:55+0000,494515307280471_78080345,548008515407290,0
3494,148755278523144_588503531169594,"So proud of you, John T Cherry!",2013-04-30T23:37:27+0000,588503531169594_6451394,10201784936183331,1
3495,148755278523144_493544594044209,Hooah!,2013-04-29T12:14:54+0000,493544594044209_77975023,738206006224109,3
3496,148755278523144_493544594044209,That guy with the red hat...Don't push back!!!  :O),2013-04-30T22:24:56+0000,493544594044209_77977694,763513377055940,0
3497,148755278523144_493544594044209,Hooah!,2013-04-30T03:38:43+0000,493544594044209_77976166,10205566280663083,1
3498,148755278523144_493544594044209,Awesome!,2013-04-29T22:09:39+0000,493544594044209_77975810,10202009276453709,1
3499,148755278523144_493544594044209,took my training there...hooah!!!,2013-04-29T17:42:20+0000,493544594044209_77975554,732881790102619,1
3500,148755278523144_493544594044209,Wow,2013-04-29T15:50:36+0000,493544594044209_77975364,10204194760482827,1
3501,148755278523144_491901057541896,Exercise every days is cool...,2013-06-30T23:44:35+0000,491901057541896_78080340,548008515407290,0
3502,148755278523144_491604310904904,"To the battlefield, then.",2013-04-24T15:37:29+0000,491604310904904_4477204,966984236668831,0
3503,148755278523144_491302050935130,"Glad to hear upgrades are coming. With Fort Lee being the headquarters to DeCA, this facility should be the flagship within the military, where new ideas are tried and tested, with the administration nearby to see how those ideas truly work! For years Ukrops Supermarkets was the pinnacle of success to the Richmond area. I would love to see DeCA reach out to former Ukrops family members and executives to pick their brain for innovative ideas to bring to commissaries military-wide!",2013-04-23T16:12:46+0000,491302050935130_4473670,10204881263819160,4
3504,148755278523144_491302050935130,Whoop!  Whoop!,2013-04-23T21:55:54+0000,491302050935130_4474463,10202853584773312,0
3505,148755278523144_491302050935130,Yes - so glad!,2013-04-23T19:35:06+0000,491302050935130_4474123,10202224417912125,0
3506,148755278523144_491302050935130,upgrades are good!,2013-04-23T19:00:35+0000,491302050935130_4474059,359773340858127,0
3507,148755278523144_491302050935130,So now I know why I'll be losing my job! Awesome!,2013-04-23T15:59:30+0000,491302050935130_4473634,997231173623676,0
3508,148755278523144_491302050935130,"Julie,  excellent comments.  I hope DECA is listening",2013-04-23T21:56:43+0000,491302050935130_4474465,10202853584773312,0
3509,148755278523144_489699864428682,My son too,2013-04-19T21:34:44+0000,489699864428682_4461290,3968734992179,1
3510,148755278523144_489699864428682,My hubby is there!,2013-04-19T21:22:56+0000,489699864428682_4461260,738975552820550,1
3511,148755278523144_489699864428682,My daughter is there sending prayers for all,2013-04-19T23:23:35+0000,489699864428682_4461480,635754866552298,0
3512,148755278523144_489699864428682,my son as well seems like us here on thr east coast are just getting hammered with a lot of hatd rain,2013-04-19T22:24:07+0000,489699864428682_4461402,734001929993415,1
3513,148755278523144_573003286066780,Ok Thank You. Its now done at our house.,2013-04-16T20:03:47+0000,573003286066780_6376485,10205099008696994,0
3514,148755278523144_573003286066780,As they should be,2013-04-16T23:02:25+0000,573003286066780_6376891,10152670550683324,0
3515,148755278523144_486772318054770,Stay safe!,2013-04-12T12:04:23+0000,486772318054770_4436229,10202836880032879,0
3516,148755278523144_486770864721582,Here is an excellent article that explains more about the ACU-A http://www.military.com/daily-news/2012/09/28/army-uniform-designed-for-women-now-for-all.html,2013-04-12T14:36:46+0000,486770864721582_77946218,198269443517314,2
3517,148755278523144_486770864721582,Where was this uniform when i was in. Looks good!,2013-04-16T20:05:33+0000,486770864721582_77953715,10205099008696994,0
3518,148755278523144_486770864721582,What is different about this uniform? I don't see anything special about it.,2013-04-12T12:20:13+0000,486770864721582_77945997,819217228105959,1
3519,148755278523144_486770864721582,"I understand the fit in the shoulders, waist, and crotch, but why the hell do I need an elastic waistband!?",2013-04-12T16:54:59+0000,486770864721582_77946398,10154217101125072,2
3520,148755278523144_486770864721582,"That same logic should then be used on all ACU pants. ""In case u get fat"" You're in the military, hold a standard for yourself and do some damn PT! Elastic waistband can kiss my ass",2013-04-14T05:05:14+0000,486770864721582_77949213,10154217101125072,1
3521,148755278523144_486770864721582,"Nicole Eisman, well said!",2013-05-10T12:10:13+0000,486770864721582_77993567,10152645400871690,0
3522,148755278523144_486770864721582,And because not every woman has the same waist size which is why when taped on the smallest portion.,2013-04-12T21:24:20+0000,486770864721582_77946724,10152014752371244,0
3523,148755278523144_486770864721582,Very cool!  It's about time!,2013-04-12T20:39:12+0000,486770864721582_77946638,10204407569363933,0
3524,148755278523144_486770864721582,adjustability incase u get fat,2013-04-12T17:10:09+0000,486770864721582_77946403,359773340858127,0
3525,148755278523144_486770864721582,from the the Solider Protection and Individual,2013-04-12T14:51:09+0000,486770864721582_77946242,607967162643797,0
3526,148755278523144_486770864721582,Does it stop bullets and IED fragmentation?,2013-04-12T12:43:42+0000,486770864721582_77946019,10152528858078054,0
3527,148755278523144_486770864721582,WoW that is exciting news! Keep up the good work US Army Women's Museum!!!,2013-04-12T11:50:45+0000,486770864721582_77945963,730497843639344,0
3528,148755278523144_486162151449120,"Additional information regarding TA released:  The only limitation to TA usage is that no enrollments with start dates between 8 March and 9 April are authorized. Enrollments with false start dates will be rejected by HQ ACES and if they appear on a school's invoice, the invoice will be rejected. 

As the TA program restarts Soldiers and other military members are encouraged to utilize the academic testing program, CLEP and DSST exams, in fulfilling degree requirements. Soldiers and other military members are also asked to use available resources to prepare for the exams as f ree retests are no longer authorized. 

Barbara A. Threatt
Education Services Officer
Army Education Center, Fort Lee 
(804)765-3570
barbara.a.threatt.civ@mail.mil",2013-04-10T20:48:35+0000,486162151449120_4430929,148755278523144,1
3529,148755278523144_486162151449120,So grateful that this has occurred. My son signed on to get tuition assistance and we were discouraged when we heard it was withdrawn.,2013-04-10T22:21:20+0000,486162151449120_4431150,10204407928190831,1
3530,148755278523144_486162151449120,Thumbs up on the assistance help. Our soldiers deserve this,2013-04-10T22:51:19+0000,486162151449120_4431201,285662718261693,0
3531,148755278523144_486162151449120,Thanks for the update,2013-04-10T20:21:23+0000,486162151449120_4430902,10204263443364053,1
3532,148755278523144_486162151449120,"PVT Stoeber, William A. will surely need this assistance once he finishes his AIT Training.... Thank you for the information.",2013-04-10T20:16:05+0000,486162151449120_4430885,10204870185490344,1
3533,148755278523144_486134141451921,"MY SON PRVT.MORALES MARQUEZ VINCENT, WAS THERE..HE WAS LOOKING FOR THE WOMAN.....",2013-04-27T01:31:30+0000,486134141451921_77971265,338987376285480,0
3534,148755278523144_486134141451921,Does anyone know the 9 year old that sang the National Anthem? It was stunning!! And the game was awesome as well!!!!,2013-04-10T23:19:44+0000,486134141451921_77943660,10152839497649683,0
3535,148755278523144_486134141451921,My husband was at that game :),2013-04-10T19:13:17+0000,486134141451921_77943457,1269450136410914,0
3536,148755278523144_483779881687347,Oh my word!!!  I am so excited for her and proud of her!  this is way awesome!!!,2013-04-11T01:01:53+0000,483779881687347_77943772,931391550244239,1
3537,148755278523144_483779881687347,Love you Stacey,2013-04-05T01:12:00+0000,483779881687347_77934519,10208864768408652,1
3538,148755278523144_483779881687347,Congrats! That's awesome=],2013-04-04T22:54:51+0000,483779881687347_77934389,1110672705613119,1
3539,148755278523144_483779881687347,Good for her!,2013-04-04T21:50:27+0000,483779881687347_77934293,10154025970620156,1
3540,148755278523144_483779881687347,Congrats Stacey!,2013-04-04T21:11:12+0000,483779881687347_77934232,1026695560680744,1
3541,148755278523144_483779881687347,Conrats !!,2013-04-04T20:41:50+0000,483779881687347_77934210,854171241260938,1
3542,148755278523144_483779881687347,Way to go !,2013-04-13T08:51:32+0000,483779881687347_77947727,236734183189971,0
3543,148755278523144_483779881687347,We are proud of you in every aspect of the word. Love,2013-04-05T10:32:48+0000,483779881687347_77935066,10208864768408652,0
3544,148755278523144_483779881687347,Congrats!!!,2013-04-05T01:40:41+0000,483779881687347_77934556,10203567656222798,0
3545,148755278523144_483779881687347,So proud of my daughter! She is awesome!,2013-04-04T21:07:27+0000,483779881687347_77934230,10205420315051165,0
3546,148755278523144_483779881687347,Love to shoot guns!??,2016-04-09T22:33:47+0000,483779881687347_1201678216564173,148189945566705,0
3547,148755278523144_483779881687347,Congrats!,2013-04-04T20:36:27+0000,483779881687347_77934207,10203921211099951,0
3548,148755278523144_331848466937527,"The secretaries of the U.S. Army, Air Force and Navy will each give up a portion of their salary to show solidarity with hundreds of thousands of Defense Department civilian workers facing mandatory furloughs this year.   http://www.armytimes.com/article/20130404/NEWS05/304040013/U-S-service-secretaries-take-voluntary-pay-cut",2013-04-04T16:55:50+0000,331848466937527_1471159,148755278523144,1
3549,148755278523144_331848466937527,This guy is from my hometown and have met him a few times. He's a pretty good guy if you know him!!,2013-04-03T19:51:29+0000,331848466937527_1468733,10204287711285265,3
3550,148755278523144_331848466937527,Meanwhile my organization hasnt even given us notice that it was even reduced from 22 to 14. Unbelievable.,2013-04-03T19:50:22+0000,331848466937527_1468731,10152331022785516,0
3551,148755278523144_331848466937527,"""?We are obliged to give adequate notice to our civilian employees. ? This is not something [in which] you get a notice one day and are furloughed the next,? he said. ?We understand that we need to take great care with our civilian workforce.?",2013-04-03T19:49:30+0000,331848466937527_1468726,10152331022785516,0
3552,148755278523144_331848466937527,Finally...  Both men are doing the right thing... What about the Congressmen and Senators follow suit!  We all have to make sacrifices!!!,2013-04-03T22:57:38+0000,331848466937527_1469078,10204031285728813,0
3553,148755278523144_331848466937527,"Also, Obama is taking a 5% cut http://politicalticker.blogs.cnn.com/2013/04/03/obama-will-give-up-portion-of-his-salary/?hpt=hp_t2",2013-04-03T21:01:27+0000,331848466937527_1468837,10153259421574580,0
3554,148755278523144_483295688402433,Good job T...as always!  (like the hat!),2013-04-03T13:37:32+0000,483295688402433_77931958,10203728016870766,0
3555,148755278523144_482966638435338,HOOAH!!!,2013-04-05T01:47:43+0000,482966638435338_77934560,10203567656222798,0
3556,148755278523144_100921183437568,"Libby, for TA assistance or questions at Fort Lee, or help with GI Bills and other sources of funding, please contact a Fort Lee Army Education Center counselor at (804) 765-3570 or 3571.",2013-04-01T13:52:15+0000,100921183437568_5759,148755278523144,0
3557,148755278523144_100921183437568,Wonderful news! Our soldiers deserve it!!,2013-03-29T16:00:30+0000,100921183437568_1931,549245841860929,2
3558,148755278523144_100921183437568,Thank u! Everyone deserve chance for education,2013-03-29T14:20:17+0000,100921183437568_1829,359773340858127,1
3559,148755278523144_100921183437568,This great news! It only seems fitting that those who fight for our country deserve this opportunity!,2013-04-02T20:40:28+0000,100921183437568_8530,609374405823632,0
3560,148755278523144_100921183437568,Awesome News... Long time Goverment done something right,2013-03-30T00:42:40+0000,100921183437568_2352,1233664053316954,0
3561,148755278523144_100921183437568,being is they took it from my husband who is finishing AIT dose he have to reapply foer it or is it an automatic readded?,2013-03-29T16:49:41+0000,100921183437568_1973,996167357077157,0
3562,148755278523144_100921183437568,That is great news.,2013-03-29T16:17:42+0000,100921183437568_1942,10203583684781203,0
3563,148755278523144_100921183437568,Thank you so much!  Our soldiers deserve this!,2013-03-29T14:58:52+0000,100921183437568_1854,671441056255796,0
3564,148755278523144_100921183437568,thanks you very much!!!!!,2013-03-29T14:08:28+0000,100921183437568_1812,10203696112189245,0
3565,148755278523144_100921183437568,Amanda - check it out!!!  YES!!!!!,2013-03-29T14:06:10+0000,100921183437568_1810,4205037020437,0
3566,148755278523144_480973775301291,Get out of the military.,2013-03-28T13:29:49+0000,480973775301291_77921434,732884166754542,3
3567,148755278523144_480973775301291,I wouldnt even take a picture to be shown dont want people bugging me,2013-03-28T16:57:17+0000,480973775301291_77921780,862567737105290,1
3568,148755278523144_480973775301291,Congrats Jenkins I'm so happy for u. I guess u don't need a second job any more.,2013-04-18T15:33:33+0000,480973775301291_77956546,875671735790931,1
3569,148755278523144_480973775301291,WTG David!,2013-03-28T16:51:41+0000,480973775301291_77921768,413925945450744,0
3570,148755278523144_480973775301291,"Bank it!!!  Buy a home.  Go to college or trade school. 
 Keep your job, this is not snout money to live on or raise a family for the rest of your natural life.",2013-03-28T15:36:51+0000,480973775301291_77921633,10152345885285560,2
3571,148755278523144_480973775301291,congrats...,2013-04-18T21:19:50+0000,480973775301291_77957088,10152496376423401,0
3572,148755278523144_480973775301291,Congrats.,2013-03-29T11:39:11+0000,480973775301291_77923070,1029003783785056,0
3573,148755278523144_480973775301291,Awesome!,2013-03-28T20:12:50+0000,480973775301291_77922108,10203391450854653,0
3574,148755278523144_480973775301291,Congrats!!!,2013-03-28T19:24:07+0000,480973775301291_77922045,10205474471406443,0
3575,148755278523144_480973775301291,"Congratulations! ! I would keep my job, give to a charity, go to school  ,get a nice house and car and share with my family and friends. Oh and hv my kids ready for collage. ..ifffff i had it made like  that.",2013-03-28T18:13:25+0000,480973775301291_77921916,812664155458589,0
3576,148755278523144_480973775301291,Congrats.,2013-03-28T17:15:25+0000,480973775301291_77921813,10203500199693406,0
3577,148755278523144_480973775301291,Nice,2013-03-28T15:19:53+0000,480973775301291_77921596,359773340858127,0
3578,148755278523144_480973775301291,Congrats!! I would pay my daughters medical bills off.,2013-03-28T14:17:35+0000,480973775301291_77921523,10204470308457978,0
3579,148755278523144_480973775301291,Congratulations!!!!,2013-03-28T14:04:22+0000,480973775301291_77921506,10200809795007288,0
3580,148755278523144_480973775301291,Go Army... Loved FT. Lee when I was there....But Stay in till ya retire...&....Then ya will have 2 Cks....a  mth to live on...Just like me...Don't take a lump some.. take the payments...I did !!!!,2013-03-28T13:59:56+0000,480973775301291_77921499,10202361108182210,0
3581,148755278523144_480973775301291,HOOAH and congratulations!!!!,2013-03-28T13:45:43+0000,480973775301291_77921468,10205779703320239,0
3582,148755278523144_480973775301291,Congradulations guys,2013-03-28T13:38:15+0000,480973775301291_77921450,10204777867345480,0
3583,148755278523144_480973775301291,"Pray, then spend it own my dreams, they deserve it! #Salute to y'all, thank you for your service",2013-03-28T13:37:31+0000,480973775301291_77921448,10102170081815567,0
3584,148755278523144_480182945380374,Nicole...OH is proud to honor you for your achievements.  I'm looking forward to meeting you in DC as your escort for the events/activities.  Operation Homefront of the Virginias Salutes you!,2013-03-26T13:46:52+0000,480182945380374_77918411,10204272494064836,2
3585,148755278523144_480182945380374,Congratulations!,2013-03-26T23:44:35+0000,480182945380374_77919133,487036861422174,0
3586,148755278523144_480182945380374,"Congratulations, thank you for all u do",2013-03-26T22:51:42+0000,480182945380374_77919076,359773340858127,0
3587,148755278523144_480182945380374,Congratulations Nicole and Team Daly!,2013-03-26T16:46:55+0000,480182945380374_77918673,10205664165949986,1
3588,148755278523144_480182945380374,Amazing!  Congrats!!,2013-03-26T16:40:34+0000,480182945380374_77918661,855651630284,1
3589,148755278523144_480182945380374,Congratulations to Nicole and the Daly family!,2013-03-26T14:40:58+0000,480182945380374_77918503,10206925462919899,1
3590,148755278523144_480182945380374,Congrates sweetie.,2013-03-26T14:15:56+0000,480182945380374_77918462,854171241260938,1
3591,148755278523144_552074561491115,"Also ? the U.S. Army Quartermaster Museum here on Fort Lee has on display the Medal of Honor of Private George Watson, a WWII Quartermaster laundry and bath specialist who selflessly saved his comrades. Check it out for yourself sometime to learn more.",2013-03-25T16:56:21+0000,552074561491115_5935945,148755278523144,1
3592,148755278523144_479628175435851,Yeah.  I was hoping for this to happen but the weather hotline isn't updated which is funny cuz it's the number shown above.,2013-03-25T01:46:18+0000,479628175435851_4373370,807550315923272,0
3593,148755278523144_479628175435851,Thanks for the info!,2013-03-25T01:49:55+0000,479628175435851_4373378,10203676973068586,0
3594,148755278523144_479628175435851,It should be up there soon; it's most likely a technical delay.,2013-03-25T01:51:00+0000,479628175435851_4373383,148755278523144,2
3595,148755278523144_479628175435851,do we know if the fort lee youth services will be open tomorrow?,2013-03-25T02:00:26+0000,479628175435851_4373401,10206739454073631,0
3596,148755278523144_479628175435851,From my experience Beth a Soldiers 2 hour delay is from their first formation time unless it specifically states a time that post will be closed until.,2013-03-25T02:02:11+0000,479628175435851_4373404,807550315923272,0
3597,148755278523144_479628175435851,CYSS facilities will also open on a 2-hour delay.  More info here:  http://www.leemwr.com/CYS/cys_cys.html,2013-03-25T02:03:59+0000,479628175435851_4373410,148755278523144,0
3598,148755278523144_479628175435851,"Beth, yes, however personnel should contact their supervisors for procedural details within their organization.",2013-03-25T02:06:12+0000,479628175435851_4373417,148755278523144,0
3599,148755278523144_479628175435851,Thks fa tha info.....,2013-03-25T02:29:35+0000,479628175435851_4373465,925060624187333,0
3600,148755278523144_479628175435851,Will CIF still open at 730,2013-03-25T02:38:34+0000,479628175435851_4373482,751231891636752,0
3601,148755278523144_479628175435851,"What about the school house?(ALC,SLC)",2013-03-25T02:44:09+0000,479628175435851_4373490,10152032001075684,0
3602,148755278523144_479628175435851,"Daniel, Phillip ? two hour delay.",2013-03-25T03:09:03+0000,479628175435851_4373537,148755278523144,0
3603,148755278523144_479628175435851,Any word on when centers will open?,2013-03-25T10:00:57+0000,479628175435851_4374355,10203826528056118,0
