,Post_ID,Comment,Created_Time,Comment_ID,Commenter_ID,Likes
0,148755278523144_1427668370631822,"I would volunteer my time BUT I feel that all parents should have the same certifications as any of us who have worked at the child care centers . Such as first aid/CPR, medication class and so on.",2016-11-29T14:25:03+0000,1427668370631822_1427715737293752,970491106305121,0
1,148755278523144_1423632737702052,The serving line now isn't anything like it use to be. Glad to see the improvements for our soldiers,2016-11-25T19:30:24+0000,1423632737702052_1423683401030319,10202703459487009,1
2,148755278523144_1423632737702052,such a great  post,2016-11-27T09:30:15+0000,1423632737702052_1425308637534462,1796091130611270,0
3,148755278523144_1422741357791190,My Soldier said it was awesome!  His first holiday away from home. Thank you for making it special. Thank you everyone for your service and sacrifice. God bless you all!!! ????????????,2016-11-25T02:47:54+0000,1422741357791190_1422861477779178,10203558416665111,6
4,148755278523144_1422741357791190,I was stationed at fort lee right after I had done my ait training there as well. They have always did great things for the new coming soldiers on holidays away from family and I am glad they keep doing it. Always makes me happy knowing are troops. Even if they are in training are being taken care of!,2016-11-25T04:24:32+0000,1422741357791190_1422961521102507,10202389684458111,5
5,148755278523144_1422741357791190,It's so beautiful to see the higher ranking soldiers serving the others. They need to know they are really there for them off the battlefield too. And with that being said thank you for everything  you do in the service for us to keep us safe :),2016-11-25T12:02:32+0000,1422741357791190_1423320484399944,10202029766065501,1
6,148755278523144_1422741357791190,"Oh wow,That is absolutely wonderful!! This is my daughters first Thanksgiving away from home, I'm so elated to see this awesome thing that was done for them!! God bless to all that was a part of putting it all together!!??",2016-11-25T22:43:32+0000,1422741357791190_1423853221013337,1561016304148160,0
7,148755278523144_1422741357791190,"I too ate turkey there, many moons ago! My graduation was around those days so my parents had joined , along with all other parents and family members, for Thanksgiving dinner!",2016-11-25T06:32:56+0000,1422741357791190_1423027047762621,983110595036129,1
8,148755278523144_1422741357791190,I had Thanksgiving there in the late 90's. It was awesome. It really softened the blow of being away from home during the holidays.,2016-11-25T11:53:53+0000,1422741357791190_1423316577733668,10201913937159613,1
9,148755278523144_1422741357791190,"After 5.5 years, this still brings tears to my eyes to think of all the mamas that are so happy that their kids had a real Thanksgiving!  Thank you.",2016-11-25T03:27:22+0000,1422741357791190_1422927761105883,10152329227193021,4
10,148755278523144_1422741357791190,"This is so cool:) What a great thing to do for these  soldiers ,who like my grandson are spending their first Thanksgiving away from home!",2016-11-25T01:06:40+0000,1422741357791190_1422746974457295,10203846581819645,6
11,148755278523144_1422741357791190,"This is my son's first Thanksgiving away from home, very nice thing they did for the soldiers...?",2016-11-25T01:45:15+0000,1422741357791190_1422769207788405,1570273376541513,3
12,148755278523144_1422741357791190,My grandson sent a photo of his meal and said it was almost as good as my cooking. Smart boy.,2016-11-25T01:25:15+0000,1422741357791190_1422759434456049,10204104927417054,2
13,148755278523144_1422741357791190,Thank you for all you do for our families ! It hits home .????????,2016-11-25T02:05:39+0000,1422741357791190_1422778304454162,164025017404422,2
14,148755278523144_1422741357791190,Great solider guys!!! Just remember when your nco there's a private away from home same place you where years prior,2016-11-25T01:37:50+0000,1422741357791190_1422766354455357,10152479093286537,2
15,148755278523144_1422741357791190,We did the same thing here at fort campbell at the 101 sustainment dining facility and the enjoyment i saw on the soldiers faces was heart warming for me,2016-11-25T01:46:04+0000,1422741357791190_1422769481121711,293272877526462,1
16,148755278523144_1422741357791190,Thank you so much for making my son's first Thanksgiving dinner away from home so nice.,2016-11-25T05:51:29+0000,1422741357791190_1423007637764562,10203188455256663,3
17,148755278523144_1422741357791190,Time honored tradition of serving the troops during these times!!  So glad to see that it continues!,2016-11-25T02:29:46+0000,1422741357791190_1422821561116503,10152420952396205,1
18,148755278523144_1422741357791190,I've been there many of times for my daughter. Thank you all!,2016-11-25T18:19:11+0000,1422741357791190_1423643494367643,10203323927006699,0
19,148755278523144_1422741357791190,"Don't thank your Drill Sergeant, thank your Recruiter! lol",2016-11-25T06:58:20+0000,1422741357791190_1423038487761477,10205455822851338,1
20,148755278523144_1422741357791190,Thank you all for your serving our babies..(SOLDIERS),2016-11-25T01:36:07+0000,1422741357791190_1422765474455445,756202494474236,2
21,148755278523144_1422741357791190,I remember Thanksgiving there in 1989....,2016-11-25T17:57:04+0000,1422741357791190_1423629384369054,10203566381474722,0
22,148755278523144_1422741357791190,I love this,2016-11-25T20:26:40+0000,1422741357791190_1423721891026470,10205517572487078,0
23,148755278523144_1422741357791190,Bless you all! ??,2016-11-25T10:27:39+0000,1422741357791190_1423231631075496,838526476224136,0
24,148755278523144_1422741357791190,such a great  post,2016-11-25T06:30:26+0000,1422741357791190_1423026271096032,1796091130611270,0
25,148755278523144_1422741357791190,??,2016-11-25T07:52:38+0000,1422741357791190_1423104931088166,964745673541149,0
26,148755278523144_1422741357791190,This is awesome!! My soldier is there! This is his first Thanksgiving away from home in 18years.. I spoke with him today and he was.. He was very happy and full!! ????????????,2016-11-25T05:08:17+0000,1422741357791190_1422982501100409,10207230217303740,1
27,148755278523144_1422741357791190,"I was in Basic Training back in 2012 when I experienced by first Army Thanksgiving. It was the most food we had during that time and the longest we were allowed to it.

....and then we were smoked for nearly and hour afterwards.",2016-11-25T01:44:46+0000,1422741357791190_1422769061121753,10152347065944719,2
28,148755278523144_1422400951158564,it warms my heart to see such a wonderful day prepared for all of these young people away from home.  thank all of you so very much for making such a great day for my grandson.,2016-11-24T19:54:32+0000,1422400614491931_1422429874489005,1132042816844775,4
29,148755278523144_1422400951158564,"It would be nice if the left over food was donated to a homeless shelter instead of thrown away, that would be the true meaning of the holiday. Giving to those who are less fortunate.",2016-11-24T23:04:24+0000,1422400614491931_1422627177802608,10200848982906166,0
30,148755278523144_1422400951158564,"Happy Thanksgiving ?
God bless you all ?
And thank you  for such a Awesome meal for all the Soldiers my son said it was really Good!!",2016-11-24T22:52:34+0000,1422400614491931_1422620451136614,10203423700287722,0
31,148755278523144_1422400951158564,Happy Thanksgiving to everyone and a very big thank you for feeding my boy a wonderful meal ??,2016-11-24T19:27:57+0000,1422400614491931_1422412881157371,10204835769993840,4
32,148755278523144_1422400951158564,"Thank you for giving our son a thanksgiving meal, that we couldn't this year.",2016-11-24T20:31:40+0000,1422400614491931_1422454727819853,10205558709957892,1
33,148755278523144_1422400951158564,Army knows how to do Thanksgiving. My son is there and was just amazed and very grateful! God bless!,2016-11-24T22:07:02+0000,1422400614491931_1422556601142999,965604240119476,0
34,148755278523144_1422400951158564,Happy Thanksgiving. Thank you to you all who are serving and thank you for feeding my son who is in school a wonderful dinner God bless all of you,2016-11-24T19:47:32+0000,1422400614491931_1422423914489601,10153349473432938,0
35,148755278523144_1422400951158564,Happy Thanksgiving! Thank you for your service & for taking good care of my son today.,2016-11-24T21:19:05+0000,1422400614491931_1422485451150114,10204871746300008,0
36,148755278523144_1422400951158564,Thank you! Looks like a wonderful meal for our soldiers!!,2016-11-24T19:47:17+0000,1422400614491931_1422423274489665,10153274817542269,0
37,148755278523144_1422400951158564,"That isn't my defac. But it look looked good, I just didn't want to dress up or go to formation.",2016-11-24T20:13:15+0000,1422400614491931_1422445911154068,840390816025488,0
38,148755278523144_1422400951158564,Thank you for taking such great care of my son & all others!,2016-11-24T20:06:40+0000,1422400614491931_1422441861154473,10208324312441874,0
39,148755278523144_1422400951158564,"Thank you Officers, NCOs & SGTs at Fort Lee for taking great care of my Soldier, PV2 Supple.",2016-11-25T02:42:13+0000,1422400614491931_1422853991113260,10208923684826902,0
40,148755278523144_1422400951158564,"I am so happy our troops have good food, they certainly deserve it, thanks for the pics.",2016-11-24T22:49:27+0000,1422400614491931_1422618077803518,832414376773226,0
41,148755278523144_1422400951158564,Happy Thanksgiving ?? ?? ??,2016-11-24T22:28:03+0000,1422400614491931_1422601304471862,143969279275005,1
42,148755278523144_1422400951158564,Wow very very nice,2016-11-24T22:28:49+0000,1422400614491931_1422601817805144,204194479971940,0
43,148755278523144_1422400951158564,What a feast!! Looks incredible!,2016-11-24T20:05:13+0000,1422400614491931_1422441151154544,1582898891939376,0
44,148755278523144_1422400951158564,Happy Thanksgiving & thanks for feeding our grandson!,2016-11-24T22:08:01+0000,1422400614491931_1422557297809596,10203737747072929,0
45,148755278523144_1422400951158564,Happy Thanksgiving to you all!,2016-11-24T19:37:09+0000,1422400614491931_1422417427823583,10152251828641863,0
46,148755278523144_1422400951158564,Wow.  Looks fabulous :),2016-11-24T19:52:57+0000,1422400614491931_1422428954489097,10204577593380164,0
47,148755278523144_1422400951158564,Happy Thanksgiving to all,2016-11-25T00:45:01+0000,1422400614491931_1422733894458603,1017208118309522,0
48,148755278523144_1422400951158564,S?rb?tori fericite!!!!,2016-11-24T19:38:14+0000,1422400614491931_1422417984490194,143544936126263,0
49,148755278523144_1422400951158564,Happy Thanksgiving to all!!!,2016-11-24T19:25:14+0000,1422400614491931_1422411541157505,10202703459487009,0
50,148755278523144_1422400951158564,Thank you all for your service and sacrifice.   Missing my son who is there so much today.  So glad to see all we're treated to such a wonderful meal,2016-11-24T21:07:44+0000,1422400614491931_1422478014484191,10203338918223006,1
51,148755278523144_1422400951158564,Happy Thanksgiving Ethan Brewer,2016-11-25T00:51:26+0000,1422400614491931_1422737134458279,823818484346305,0
52,148755278523144_1422400951158564,Happy Thanksgiving!  Thankful that you served a wonderful meal to my son today!,2016-11-24T19:44:37+0000,1422400614491931_1422421594489833,10204122426839249,0
53,148755278523144_1422296274502365,"My daughter is there being served her dinner... I hate that she couldn't come home but am thankful she is with ""family"" enjoying her meal... I love you Private Brittany Maxwell",2016-11-24T17:54:15+0000,1422296274502365_1422349597830366,1012909802069062,6
54,148755278523144_1422296274502365,Happy thanksgiving from here at fort lee. To everyone back home thank you for your support. They certainly gave us a good meal and good laughs. PVT Chamberlain.,2016-11-24T20:59:37+0000,1422296274502365_1422470064484986,10153054202463670,3
55,148755278523144_1422296274502365,Fort Lee this makes me happy. Thank you for making those away from home remember home  <3 Kinda miss 92G AIT and what it taught me. take care!,2016-11-25T02:39:25+0000,1422296274502365_1422846214447371,10152467292078600,3
56,148755278523144_1422296274502365,"that looks wonderful, we had an early thanksgiving meal where im at here a fort campbell ky. i work at 101 sustainment dining facility.",2016-11-24T16:52:08+0000,1422296274502365_1422309511167708,293272877526462,1
57,148755278523144_1422296274502365,I remember that chow hall like it was just yesterday!! Welcome to a life long brotherhood! A bond you can't find anywhere else! Happy thanksgiving you guys and enjoy spending it with a new family!,2016-11-25T01:41:28+0000,1422296274502365_1422768064455186,1430902066921219,1
58,148755278523144_1422296274502365,Thank you for your service and may God bless you all...,2016-11-24T16:38:26+0000,1422296274502365_1422299474502045,702852846425327,3
59,148755278523144_1422296274502365,"First year celebrating Thanksgiving without our son, we did hear from him and it sounds like they feed him well. Thank you all for your service and God bless each one of you.",2016-11-24T23:27:32+0000,1422296274502365_1422642487801077,10205393770192797,1
60,148755278523144_1422296274502365,Thank you all for feeding our soldiers and all you all sacrifice for the rest of us. God bless you all and we sending prayers from Cali,2016-11-24T17:32:07+0000,1422296274502365_1422334054498587,1416354235354165,2
61,148755278523144_1422296274502365,Thank you for giving my son a wonderful meal while he is there Happy Thanksgiving to you all,2016-11-24T16:38:20+0000,1422296274502365_1422299374502055,10204835769993840,3
62,148755278523144_1422296274502365,Happy Thanksgiving to all and especially my son Pvt. Matt Brown!!! Thank you all for your service to our great nation!!! God Bless!!!!,2016-11-24T17:18:18+0000,1422296274502365_1422326324499360,10203395038341543,1
63,148755278523144_1422296274502365,"To all servicemen and servicewomen at Fort Lee, ""Happy Thanksgiving!""",2016-11-24T16:49:55+0000,1422296274502365_1422308051167854,10205408628124619,0
64,148755278523144_1422296274502365,"Happy Thanksgiving to you all.

Thank You All for your Service and Sacrifice to Our Country.

God Bless You All and Your Families.
#HOOAH",2016-11-24T19:18:06+0000,1422296274502365_1422408011157858,823114887804982,1
65,148755278523144_1422296274502365,Fort Lee Civilian here wish all a very Happy Thanksgiving,2016-11-24T16:41:46+0000,1422296274502365_1422302717835054,10152690014282079,1
66,148755278523144_1422296274502365,Thank you for your service and sacrifice!! Blessings to you all ??????????????,2016-11-24T16:40:32+0000,1422296274502365_1422301041168555,10152431862397223,2
67,148755278523144_1422296274502365,Happy Thanksgiving to the greatest military in the Free world!,2016-11-24T16:59:16+0000,1422296274502365_1422314724500520,789241497779341,0
68,148755278523144_1422296274502365,"Happy Thanksgiving ?????? to all but especially to my soldier PFC Brito, Lillian!! God bless all and thanks for all you do!!!",2016-11-24T16:58:20+0000,1422296274502365_1422314034500589,10152322522067364,0
69,148755278523144_1422296274502365,"Happy Holidays! Thank u for making my son first Holiday away special xo Private Perry, NASIR mom ?",2016-11-25T11:12:18+0000,1422296274502365_1423294064402586,854160977944209,0
70,148755278523144_1422296274502365,Thanks for your service. May god continue to bless you and guide you.,2016-11-24T16:59:01+0000,1422296274502365_1422314584500534,10152791720570255,0
71,148755278523144_1422296274502365,Thank you for giving my son his favorite meal of the year. Happy Thanksgiving,2016-11-24T16:39:07+0000,1422296274502365_1422300054501987,10202426079629752,0
72,148755278523144_1422296274502365,Thank you for giving our troops a wonderful meal. I hope my son gets lots of pumpkin pie ??,2016-11-24T16:40:36+0000,1422296274502365_1422301271168532,10153349473432938,1
73,148755278523144_1422296274502365,Thank God for our service members and their leaders! ??,2016-11-24T16:40:12+0000,1422296274502365_1422300797835246,768626096506327,0
74,148755278523144_1422296274502365,What a wonderful thing for our soldiers to still be able to eat with the people that have become new family and celebrate life's blessings!,2016-11-24T16:39:29+0000,1422296274502365_1422300344501958,10205423293249850,0
75,148755278523144_1422296274502365,Happy Thanksgiving to all. My granddaughter Shae Sill is there.  ?????????,2016-11-24T16:43:01+0000,1422296274502365_1422303357834990,10152387277366735,0
76,148755278523144_1422296274502365,My soldier is there! I'm so thankful he has his new brothers & sisters to share today with.,2016-11-24T16:56:20+0000,1422296274502365_1422312687834057,10204871746300008,0
77,148755278523144_1422296274502365,Happy Thanksgiving to my daughter and her fellow soldiers. Thank you for all your sacrifices!,2016-11-24T16:43:32+0000,1422296274502365_1422303834501609,942828115743270,0
78,148755278523144_1421451474586845,"Happy Thanksgiving to my soldier, Pvt. Burnett and to all of you serving them today when we can't.",2016-11-24T18:24:34+0000,1421451474586845_1422368087828517,10205781812016171,0
79,148755278523144_1421451474586845,Happy Thanksgiving to my soldier Grady <3 hope y'all have turkey legs ;)  he loves 'em!!!!,2016-11-24T14:38:42+0000,1421451474586845_1422204437844882,10202920079658742,0
80,148755278523144_1421451474586845,Happy Thanksgiving to my soldier James Copenhaver Delta Co and thank you all for you service!????????,2016-11-24T18:12:50+0000,1421451474586845_1422362024495790,10202947932683186,0
81,148755278523144_1421451474586845,Happy Thanksgiving to my nephew Pvt. Fields. Hooah!,2016-11-24T18:29:21+0000,1421451474586845_1422371524494840,833347023352754,0
82,148755278523144_1421451474586845,Happy Thanksgiving to my grandson Pvt. Keegan Ruckman.,2016-11-24T15:06:36+0000,1421451474586845_1422225021176157,10204694790876874,0
83,148755278523144_1421451474586845,stationed at Tango Company 1989,2016-11-24T17:43:28+0000,1421451474586845_1422343337830992,659035627539809,0
84,148755278523144_1421451474586845,Wishing all our military a very Happy Thanksgiving.  God. Bless you all. Thank you all.,2016-11-24T18:01:10+0000,1421451474586845_1422354821163177,856397324391243,0
85,148755278523144_1421451474586845,Happy Thanksgiving  PVT. HUMPHRIES!,2016-11-24T15:42:37+0000,1421451474586845_1422252117840114,825292130855964,0
86,148755278523144_1421451474586845,Happy  Thanksgiving  to my grandson PVT2 Antonio Arranz!,2016-11-24T15:47:57+0000,1421451474586845_1422255761173083,10203200850166504,0
87,148755278523144_1421451474586845,Happy Thanksgiving to my soilders Pvt 2. Paul Jones Jr. and Warren Alston !!!!,2016-11-24T16:34:16+0000,1421451474586845_1422296627835663,1602542999999895,0
88,148755278523144_1420512794680713,What if someone is picking someone up Wednesday he said he was do to b released at 12 am our around that time from ait can I still get in to get him and thanks,2016-11-22T21:01:03+0000,1420512794680713_1420517554680237,628653170594905,0
89,148755278523144_1420512794680713,,2016-11-23T04:00:16+0000,1420512794680713_1420766681321991,1325963440760654,0
90,148755278523144_1420512794680713,Happy Thanksgiving,2016-11-23T00:47:38+0000,1420512794680713_1420650744666918,10204714256472839,0
91,148755278523144_1420512794680713,Jenna Lucas,2016-11-22T21:07:17+0000,1420512794680713_1420521814679811,10152602801264596,1
92,148755278523144_1404420612956598,I would! Looks like a blast! I'll talk to jim?? thanks for the invite ??,2016-11-22T20:21:28+0000,1404420612956598_1420491628016163,10153112927078287,0
93,148755278523144_1404420612956598,Heather Fernandez,2016-11-23T02:40:57+0000,1404420612956598_1420697484662244,10204351982139183,1
94,148755278523144_1404420612956598,"Mike Bramblett, let's go to this! My treat! James R. Taylor and Jessica Taylor, would you like to join us?!",2016-11-22T18:34:48+0000,1404420612956598_1420373494694643,10205278861508434,2
95,148755278523144_1415431178522208,Is the clothing sells open this weekend,2016-11-25T00:13:37+0000,1415431178522208_1422716467793679,144453099368114,0
96,148755278523144_1415431178522208,Been there. Lived it,2016-11-18T01:02:52+0000,1415431178522208_1415532995178693,751057741649532,0
97,148755278523144_1415431178522208,Love it this is my home state,2016-11-18T21:25:48+0000,1415431178522208_1416472418418084,543263895794170,0
98,148755278523144_1404420252956634,,2016-11-15T18:21:04+0000,1404420252956634_1413397662058893,1591007097799273,0
99,148755278523144_1404420252956634,Michael Knoff what's this about?,2016-11-15T23:14:48+0000,1404420252956634_1413541972044462,10203245757251169,1
100,148755278523144_1404420252956634,Thanks  for the post big survival fan here,2016-11-17T14:00:37+0000,1404420252956634_1415079845224008,1796091130611270,0
101,148755278523144_1413167008748625,Kristen Lee!,2016-11-15T13:49:04+0000,1413167008748625_1413168285415164,10205278861508434,1
102,148755278523144_1412188218846504,"Glad to have ya'll home safe and sound, just in time for the holidays!!!",2016-11-14T17:09:53+0000,1412188218846504_1412280078837318,817256798287594,0
103,148755278523144_1412188218846504,"Welcome home to the smartest, bravest, prettiest Fernanda Alonso!!!  Missed you & love you!! ??????",2016-11-15T07:37:50+0000,1412188218846504_1412871968778129,464602260347193,1
104,148755278523144_1412188218846504,"Welcome back Mike's, great job and thank you for your sacrifices!",2016-11-14T19:57:09+0000,1412188218846504_1412405062158153,10152528858078054,0
105,148755278523144_1412188218846504,Welcome home soldiers. Thank you for your service.,2016-11-15T13:11:02+0000,1412188218846504_1413142128751113,568326453297619,1
106,148755278523144_1412188218846504,Welcome Home ?? VViviana Negr?n Rivera,2016-11-14T18:41:16+0000,1412188218846504_1412341918831134,652239228174628,1
107,148755278523144_1412188218846504,Welcome ??!!!!,2016-11-14T19:32:48+0000,1412188218846504_1412379255494067,10201280175600520,1
108,148755278523144_1412188218846504,Welcome Daysi good jab,2016-11-15T01:12:40+0000,1412188218846504_1412625298802796,638743869630421,1
109,148755278523144_1412188218846504,,2016-11-14T15:43:09+0000,1412188218846504_1412194105512582,1591007097799273,1
110,148755278523144_1412188218846504,Respect and Thank for serving!,2016-11-15T03:23:45+0000,1412188218846504_1412706958794630,690186031099596,0
111,148755278523144_1412188218846504,Welcome home!!,2016-11-14T16:30:43+0000,1412188218846504_1412251905506802,10203019592435652,1
112,148755278523144_1412188218846504,Welcome home triple one!!,2016-11-14T21:49:42+0000,1412188218846504_1412477565484236,10152537481277717,0
113,148755278523144_1412188218846504,Worlds best survival super fan !,2016-11-14T19:30:11+0000,1412188218846504_1412377705494222,1796091130611270,0
114,148755278523144_1412188218846504,Welcome home!! Thank you for your service!!,2016-11-15T10:03:55+0000,1412188218846504_1412981285433864,10203454708434038,0
115,148755278523144_1412188218846504,WELCOME HOME!  THANK YOU FOR SERVING OUR COUNTRY!  LOVE YOU!,2016-11-15T15:07:17+0000,1412188218846504_1413209122077747,825292130855964,0
116,148755278523144_1412188218846504,Welcome home!  Thank you for your time away,2016-11-15T03:24:50+0000,1412188218846504_1412707365461256,10203441648393400,0
117,148755278523144_1407534442645215,Thanks for your service  Ian Doe!,2016-11-11T01:23:27+0000,1407534442645215_1407753352623324,275797276100571,1
118,148755278523144_1388196914578968,I'm going! what a great oppertunity to show the campus to my daughter! thanks ms. Phillips!,2016-11-09T19:07:21+0000,1388196914578968_1406468912751768,10152932611674610,0
119,148755278523144_1388196914578968,Nobody will answer the phone or respond to my email.  Would really like to attend. :(,2016-11-09T18:12:59+0000,1388196914578968_1406421682756491,10152932611674610,0
120,148755278523144_1388196914578968,Don Burgess,2016-11-09T14:48:13+0000,1388196914578968_1406279799437346,10204540110368581,1
121,148755278523144_1404417299623596,Ahmed ALaa,2016-11-08T00:15:10+0000,1404417299623596_1404715922927067,670292219709184,2
122,148755278523144_1404417299623596,Great   I love,2016-11-08T02:30:22+0000,1404417299623596_1404794799585846,1796091130611270,0
123,148755278523144_1401698759895450,Michael Mills,2016-11-05T12:28:26+0000,1401698759895450_1402356599829666,10100159961484463,0
124,148755278523144_1388183874580272,Tremendous  post  very interesting,2016-11-02T12:30:18+0000,1388183874580272_1399678353430824,1796091130611270,0
125,148755278523144_1388213751243951,Seems cool,2016-11-02T01:25:50+0000,1388213751243951_1399353930129933,786967844709528,0
126,148755278523144_1388213751243951,Andrew Walker,2016-11-02T23:01:46+0000,1388213751243951_1400173506714642,10203260511578271,0
127,148755278523144_1388213751243951,Kyle Bennett,2016-11-02T01:13:59+0000,1388213751243951_1399349463463713,10202691843767344,0
128,148755278523144_1388212127910780,Tracy McCulley,2016-10-29T20:12:53+0000,1388212127910780_1396313387100654,10152786221361745,1
129,148755278523144_1388212127910780,Ali Charlotte,2016-10-29T18:55:47+0000,1388212127910780_1396257463772913,10154654976560372,1
130,148755278523144_1388235127908480,Kyle Pozorski,2016-10-27T23:32:25+0000,1388235127908480_1394503207281672,805428109504658,1
131,148755278523144_1388216311243695,it's a great idea!,2016-10-27T14:37:40+0000,1388216311243695_1394141460651180,809825275722704,0
132,148755278523144_1388222381243088,Jacob Guza....haha..,2016-10-27T00:23:47+0000,1388222381243088_1393557977376195,10205566893599409,0
133,148755278523144_1393351340730192,THANK YOU FOR UPDATES,2016-10-27T19:40:56+0000,1393351340730192_1394357993962860,10202613071141145,0
