,Post_ID,Comment,Created_Time,Comment_ID,Commenter_ID,Likes
310,408185632542621_1093567047337806,It has to  be @ least 125 degrees there if it's 118 degees here!  But it is cooler today.,2015-08-17T19:25:32+0000,1093567047337806_1093667203994457,427433587429682,0
311,408185632542621_1093567047337806,Yep that's how it looked when I end for work this morning to the prison,2015-08-18T03:18:30+0000,1093567047337806_1093830077311503,10153357741748448,0
312,408185632542621_1091433167551194,Looks like one of the Mars NASA photos.  It must be reaaly hot there.  It's same here!,2015-08-13T19:44:34+0000,1091433167551194_1091494124211765,427433587429682,0
313,408185632542621_1090410350986809,Amen,2015-08-11T22:07:38+0000,1090410350986809_1090451824315995,754095681312005,0
314,408185632542621_1090408774320300,"Come to the FREE Army band concert in Yuma on September 1st!  Tickets are available at the Yuma Arts Center, 254 Main Street, or the YPG Public Affairs Office.",2015-08-11T20:08:34+0000,1090408774320300_1090413007653210,408185632542621,0
315,408185632542621_1089805617713949,Jered Leber,2015-08-11T05:41:54+0000,1089805617713949_1090123391015505,873041159381426,0
316,408185632542621_1087792861248558,Andre recognize this vehicle?!?!?!,2015-08-06T22:54:35+0000,1087792861248558_1087795467914964,10203187211136105,0
317,408185632542621_1087792861248558,Erick,2015-08-06T23:41:56+0000,1087792861248558_1087809847913526,10205211827721385,0
318,408185632542621_1087792861248558,Saudi LAV with an auto 70mms cannon .    Seen it to day parked.next to us at work,2015-08-07T01:05:23+0000,1087792861248558_1087833221244522,1452181315109511,0
319,408185632542621_1087792861248558,Looks familiar.  ;),2015-08-07T10:29:22+0000,1087792861248558_1088009764560201,10153365289313678,2
320,408185632542621_1087792861248558,"My stepfather helped design Blackhawks.  It has been 23 years since his death.  So that means the Blackhawks are between 25 and 35 years old.  Not to taint my stepfather's image, but isn't it time for the Army to impliment more modern technology?",2015-08-09T17:24:56+0000,1087792861248558_1089286711099173,427433587429682,0
321,408185632542621_1087132271314617,Sine Pari,2015-08-06T01:04:47+0000,1087132271314617_1087294057965105,1471401076469583,1
322,408185632542621_1087132271314617,Calcitra Clunis!,2015-08-06T12:24:15+0000,1087132271314617_1087485804612597,635626056513071,0
323,408185632542621_1087132271314617,Nicely done Men! Thanks for your service so we can be free!,2015-08-06T17:27:56+0000,1087132271314617_1087629257931585,1619239261638054,0
324,408185632542621_1086552798039231,O yes..,2015-08-04T21:39:33+0000,1086552798039231_1086581338036377,754095681312005,0
325,408185632542621_1086542841373560,good,2015-08-04T23:49:13+0000,1086542841373560_1086633978031113,427433587429682,0
326,408185632542621_1085972611430583,Adam Scull,2015-08-03T16:23:47+0000,1085972611430583_1085983118096199,10203647749854620,0
327,408185632542621_1085972611430583,Shane.  Fun times...,2015-08-03T16:39:28+0000,1085972611430583_1085988594762318,10103397766809972,1
328,408185632542621_1085972611430583,Miss those days.,2015-08-03T17:44:28+0000,1085972611430583_1086031638091347,10203961554106044,0
329,408185632542621_1085972611430583,That's freakin sweet,2015-08-04T00:44:09+0000,1085972611430583_1086188378075673,919862151439369,0
330,408185632542621_1085972611430583,That's where you shoulda been stationed next ??,2015-08-04T02:38:12+0000,1085972611430583_1086221911405653,10203647749854620,0
331,408185632542621_1085972611430583,I got stuck with Texas ??,2015-08-04T04:26:03+0000,1085972611430583_1086252601402584,919862151439369,0
332,408185632542621_1085972611430583,"Yeah, maybe next time around",2015-08-04T04:53:56+0000,1085972611430583_1086259984735179,10203647749854620,0
333,408185632542621_1085972611430583,Bet you needed those 155mm's. ASAP. . I miss those days too.,2015-08-05T05:30:18+0000,1085972611430583_1086869588007552,818595974896228,0
334,408185632542621_1085972611430583,I laugh because  when I worked there 1975..maximum elevation thru the /theodolite..didn't happen that often....looks like a 105mm firing a 120 pound HE shell..IDK,2015-12-09T02:48:13+0000,1085972611430583_1149728885054955,955407971158555,0
335,408185632542621_1083402135020964,There is a nice stone marker off of Sidewinder Road & Interstate 8 that also commemorates Camp Pilot Knob and General Patton. It's just north of the railroad crossing.,2015-07-29T22:36:07+0000,1083402135020964_1083464348348076,706798742723091,1
336,408185632542621_1083402135020964,"Yes, you're right.  There were an entire string of camps that made up CAMA -- including Camps Hyder and Horn just over the north Yuma County line in Maricopa County -- a very remote portion of the state. -- Chuck",2015-07-30T13:08:59+0000,1083402135020964_1083750718319439,408185632542621,0
337,408185632542621_1083402135020964,When I was stationed there 1971-1973 we found an old camp that was recognizable by the stones which lined the company streets and the stones surrounding the bivouac areas.  There were even old campfires that had much to discover in their ashes.,2015-07-31T19:41:57+0000,1083402135020964_1084374611590383,1050604938299619,0
338,408185632542621_1083289488365562,Let's not fail to mention HOW MANY LIVES PROVING GROUNDS HAVE SAVED!!!!,2015-07-30T16:02:45+0000,1083289488365562_1083813811646463,783152718387999,1
339,408185632542621_1082997655061412,That is a C-27J. Not a C-130.,2015-07-28T22:09:04+0000,1082997655061412_1083015095059668,10202554146320809,1
340,408185632542621_1082997655061412,You're right.  The caption has been corrected! -- Chuck,2015-07-28T22:17:39+0000,1082997655061412_1083017778392733,408185632542621,0
341,408185632542621_1082997655061412,There's a few c-27j s in the boneyard at DM. Seen one going out today with US Coast Guard markings. Sad to see brand new aircraft in a boneyard.,2015-07-28T22:25:20+0000,1082997655061412_1083020128392498,10152489097256762,0
342,408185632542621_1082997655061412,"Bob, those planes will not be staying there. All going to good homes shortly. Army and USCG.",2015-07-28T22:27:06+0000,1082997655061412_1083020805059097,10202554146320809,1
343,408185632542621_1082997655061412,"Great aircraft jumped it a number of times, I like it way more than the casa 212",2015-07-29T16:09:31+0000,1082997655061412_1083318225029355,561721076154,0
344,408185632542621_1082828468411664,OBESE GRAMMA.  Advice is good...haha if I need it or not!,2015-07-29T00:39:15+0000,1082828468411664_1083071538387357,427433587429682,0
345,408185632542621_1082272595133918,What kind of music will the band be featuring on the above event?,2015-07-27T17:55:11+0000,1082272595133918_1082299931797851,427433587429682,0
346,408185632542621_1082272595133918,"I do not have a playlist but the band is preparing a special program of music.  The band concerts generally consist of a variety of music from popular tunes to instrumental arrangements of classics.  There are general a few marching tunes and vocals, too.  The band concerts are always a mix of entertaining favorites.  I will post a program of music when available. -- Chuck Wullenjohn",2015-07-28T21:37:33+0000,1082272595133918_1083002955060882,408185632542621,0
347,408185632542621_1078006115560566,THANK YOU.,2015-07-20T17:54:47+0000,1078006115560566_1078071645554013,427433587429682,0
348,408185632542621_1077960052231839,Was anyone from YPG involved in the accident?,2015-07-21T21:34:15+0000,1077960052231839_1078884618806049,691836790859565,0
349,408185632542621_1077925025568675,Hope everyone is safe and no one is hurt.,2015-07-20T12:35:44+0000,1077925025568675_1077933212234523,923523557661632,1
350,408185632542621_1077925025568675,More than likely the result of an impatient driver being rerouted to I-8 because of the I-10 bridge collapse on Sunday....,2015-07-20T23:12:23+0000,1077925025568675_1078196815541496,10152434285230877,0
351,408185632542621_1074797352548109,I have to eat a little salt after work for muscle cramps everyday. It's understandable since my muscles are so big lol   seriously every day,2015-07-14T21:07:17+0000,1074797352548109_1074960372531807,1523206827922678,0
352,408185632542621_1072146569479854,Wow,2015-07-09T19:35:32+0000,1072146569479854_1072182959476215,754095681312005,0
353,408185632542621_1071579246203253,They would have been good for humping ammo. OK - I'm sorry. I just couldn't resist.,2015-07-10T03:15:02+0000,1071579246203253_1072321579462353,10153374082714488,0
354,408185632542621_1067382693289575,"Yes happy birthday to our country,  USA",2015-07-02T14:32:30+0000,1067382693289575_1067755779918933,978861288808268,1
355,408185632542621_1067205249973986,"Beautiful photo, thanks for posting it.",2015-07-01T22:24:37+0000,1067205249973986_1067368849957626,508864655913547,0
356,408185632542621_1067205249973986,Thanks for the update! Yep that is an awesome picture! Love you,2015-07-02T00:45:36+0000,1067205249973986_1067408189953692,10203370539965777,0
357,408185632542621_1067205249973986,Red skies in the morning Shepard heed warning!,2015-07-02T02:57:27+0000,1067205249973986_1067478469946664,965559746790008,0
358,408185632542621_1066727303355114,(y),2015-06-30T23:14:31+0000,1066727303355114_1066757056685472,10152103738724163,0
359,408185632542621_1066727303355114,?,2015-07-01T01:15:45+0000,1066727303355114_1066801846680993,664731827023150,0
360,408185632542621_1065824770112034,Nice,2015-06-29T15:01:05+0000,1065824770112034_1065858013442043,754095681312005,0
361,408185632542621_1061803547180823,"You never answered the question to your first question 'What causes allergies?'. Most people can encounter exposure to these allergens without a problem. An allergic person has an abnormal reaction to these normally harmless substances. The cause for allergies is found in the immune system reacting to these harmless substances. The cause for allergies is not the substances themselves.  Here is the definition and explanation from the American Academy of Allergy, Asthma and Immunology:  http://www.aaaai.org/conditions-and-treatments/conditions-dictionary/allergy.aspx",2015-06-24T16:10:19+0000,1061803547180823_1061863270508184,879088285436690,0
362,408185632542621_1061308013897043,Hey hey check out Carl Bulow,2015-06-23T19:22:14+0000,1061308013897043_1061312153896629,10152138560048014,3
363,408185632542621_1061308013897043,LOL I saw this and thought he looked familiar. Why is there no sweat? You always come home drenched Patrick Hunt,2015-06-23T19:44:07+0000,1061308013897043_1061318160562695,10204403173376607,0
364,408185632542621_1048928645134980,I sure miss that place. And all the crazys,2015-06-08T17:23:53+0000,1048928645134980_1048989048462273,790797754315454,0
365,408185632542621_1048928645134980,I miss it to. ( trying to keep straight face),2015-06-08T23:24:32+0000,1048928645134980_1049110778450100,1613565138972363,2
366,408185632542621_1048928645134980,They r so beautiful!!! I remember a bunch a wild horses hang in out the backside of Martinez lake when I lived there.... They came out at dusk to drink water.... Miss the beauty of it all...,2015-06-08T23:32:23+0000,1048928645134980_1049113998449778,375316422636129,0
367,408185632542621_1048928645134980,Look at all the babies!!!!,2015-06-09T22:37:05+0000,1048928645134980_1049759448385233,10203896442805640,0
368,408185632542621_1045798022114709,Took a picture today of some horses standing in the shade by one of the car washes.,2015-06-03T23:49:13+0000,1045798022114709_1045987428762435,10152138560048014,0
369,408185632542621_1045798022114709,"Never saw one in 3 yrs at YPG, but one was in my yard in W.Belmar NJ a few months ago!  No rattlesnakes yet tho.",2015-06-04T06:19:42+0000,1045798022114709_1046175765410268,692135194182823,0
370,408185632542621_1045798022114709,Bryan Garcia,2015-06-05T02:47:12+0000,1045798022114709_1046792705348574,661878860589160,1
371,408185632542621_1045798022114709,When I was stationed there during 1971-1973 wild horse herds were very common.,2015-06-07T14:52:44+0000,1045798022114709_1048399078521270,1152892348136530,0
372,408185632542621_1041029949258183,Up front in the middle naturally....,2015-05-28T21:15:03+0000,1041029949258183_1041091499252028,10204128186098080,0
373,408185632542621_1041029949258183,so glad you guys are being appricated,2015-05-29T16:01:22+0000,1041029949258183_1041555155872329,789262391135015,0
374,408185632542621_1041029949258183,Just wonderful,2015-05-29T16:13:49+0000,1041029949258183_1041560072538504,10202779751758771,0
375,408185632542621_1041029949258183,I'm sorry I missed the breakfast. Wanted to be there but had to work ??,2015-05-29T17:43:33+0000,1041029949258183_1041598012534710,10206431685816865,0
376,408185632542621_1040034179357760,Bryan Garcia,2015-05-26T23:11:31+0000,1040034179357760_1040244866003358,661878860589160,1
377,408185632542621_1036537136374131,Interesting,2015-05-20T18:11:22+0000,1036537136374131_1036594819701696,1395601724078877,0
378,408185632542621_1035738553120656,T-14,2015-05-19T05:11:16+0000,1035738553120656_1035831939777984,10152407881245477,0
379,408185632542621_1035738553120656,Cool,2015-05-20T18:55:09+0000,1035738553120656_1036607646367080,10203143110234786,0
380,408185632542621_1033063963388115,Maya Munchinski also won 1st place for the Interview Q/A.  Excellent work from our youngest competitor.,2015-05-14T18:26:09+0000,1033063963388115_1033141706713674,760183780682733,1
381,408185632542621_1033063963388115,Yeah Dorian!,2015-05-15T16:52:32+0000,1033063963388115_1033687466659098,471625699642013,0
382,408185632542621_1031993020161876,Daniel Zarbock - maybe owls do have something to do with the mystery noise.,2015-05-13T00:42:33+0000,1031993020161876_1032017300159448,10202681225011380,0
383,408185632542621_1031993020161876,Black Lavish the owl made me think of you,2015-05-13T03:37:03+0000,1031993020161876_1032068083487703,964612150219837,0
384,408185632542621_1031993020161876,So beautiful!,2015-05-13T04:28:16+0000,1031993020161876_1032083716819473,10204884336414474,0
385,408185632542621_1031993020161876,Gosh that is a gorgeous owl!,2015-05-14T01:28:45+0000,1031993020161876_1032661080095070,10154009287540062,1
386,408185632542621_1031993020161876,Thanks Kya.  We like you too.  Daniel and Steve have saved many birds.,2015-05-15T15:34:14+0000,1031993020161876_1033663416661503,622149881229966,0
387,408185632542621_1029461610415017,Thank you from the Groves Family!,2015-05-07T23:58:32+0000,1029461610415017_1029484663746045,10204822216298522,0
388,408185632542621_1029461610415017,(y),2015-05-08T03:16:57+0000,1029461610415017_1029566243737887,10152103738724163,0
389,408185632542621_1029461610415017,Wish I could have made it.,2015-05-08T04:23:01+0000,1029461610415017_1029585537069291,869550649746478,1
390,408185632542621_1028704170490761,Thank you for protecting us!!!,2015-05-06T18:58:16+0000,1028704170490761_1028816440479534,10201066743189572,0
391,408185632542621_1027926403901871,Ariel Melchor,2015-05-04T23:23:19+0000,1027926403901871_1027938910567287,10155107132705314,1
392,408185632542621_1027926403901871,"Woah, Amanda Pepple!!  It was fun ?? ?? ??",2015-05-05T01:09:40+0000,1027926403901871_1027963343898177,10152103738724163,1
393,408185632542621_1027926403901871,Hope all data was collected well.  With all those cables around something looks like it could accidently get cut or stepped on,2015-05-05T02:29:12+0000,1027926403901871_1027981887229656,389663227875251,2
394,408185632542621_1027926403901871,"All went great. Had the best crew with D-money leading it.  No mishaps, thank God (y).",2015-05-05T02:44:26+0000,1027926403901871_1027986523895859,10152103738724163,1
395,408185632542621_1027926403901871,"Vernon Devane, John Delgado",2015-05-05T02:48:39+0000,1027926403901871_1027987623895749,10152103738724163,1
396,408185632542621_1027926403901871,"You did a good job on setting up the shoot, so that it would go well",2015-05-05T03:49:13+0000,1027926403901871_1028004353894076,542326039248379,1
397,408185632542621_1027926403901871,Nothing runs well if Wayne is around!,2015-05-05T04:01:40+0000,1027926403901871_1028008083893703,495183753950066,0
398,408185632542621_1025875770773601,"Congratulations Jan and welcome to the fun, retired, ""life's great"" world!",2015-04-30T14:45:22+0000,1025875770773601_1025896400771538,10204894792067540,2
399,408185632542621_1025875770773601,Congrats.  Retirement is great! Enjiy!!,2015-04-30T16:50:53+0000,1025875770773601_1025949540766224,758734044217084,0
400,408185632542621_1025875770773601,Congrats again!! It was a great display of a Purple Celebration!!,2015-04-30T17:05:05+0000,1025875770773601_1025954757432369,10204242592973188,0
401,408185632542621_1025875770773601,Congratulations on your retirement!!! Enjoy the good life.....,2015-04-30T17:30:51+0000,1025875770773601_1025964854098026,869707853065127,0
402,408185632542621_1025875770773601,I loved this...but they will also miss your sense of humor. Enjoy your new life.,2015-04-30T23:11:52+0000,1025875770773601_1026121800748998,474897712663303,0
403,408185632542621_1025875770773601,"Again Job very well done, Congrads!!!",2015-05-01T00:50:42+0000,1025875770773601_1026145907413254,10204985990717722,0
404,408185632542621_1025875770773601,Congratulations! Thank you for your service-- then and now!,2015-05-05T22:00:35+0000,1025875770773601_1028323333862178,380007438762962,1
405,408185632542621_1024943997533445,Go Mark Hendrickson! I like your NASA shirt!,2015-04-28T21:49:15+0000,1024943997533445_1024954880865690,10153006811775975,1
406,408185632542621_1024943997533445,(y),2015-04-28T22:58:02+0000,1024943997533445_1024980480863130,10152103738724163,0
407,408185632542621_1024943997533445,I was stationed at YPG as Army met '66-'68.  Great memories.,2016-05-12T12:10:56+0000,1024943997533445_1255596874468155,913017772078887,1
408,408185632542621_1024339920927186,I miss those walk/runs with my coworkers.  ??,2015-04-28T12:27:56+0000,1024339920927186_1024735877554257,758734044217084,1
409,408185632542621_1020887864605725,All for the USA !!!,2015-04-23T04:19:09+0000,1020887864605725_1021137777914067,825824057464051,0
410,408185632542621_1020887864605725,"Very interesting, Cathy.  Great to see how our troops are trained.  All the work you and your people do there is greatly appreciated, and as a proud American I value their work and dedication.  All Americans should be proud of what our military does for our citizens and country.  Aunt JoJo",2015-04-23T20:49:48+0000,1020887864605725_1021515457876299,736567473103716,1
411,408185632542621_1019679624726549,Wow!!  How neat!!!,2015-04-20T18:29:03+0000,1019679624726549_1019680248059820,10202477793842639,0
412,408185632542621_1019679624726549,The kids had a great time!,2015-04-20T18:58:54+0000,1019679624726549_1019696861391492,10205191673693153,0
413,408185632542621_1019679624726549,we heard all about it!  great experience,2015-04-20T19:06:28+0000,1019679624726549_1019701484724363,465634443575436,0
414,408185632542621_1019679624726549,"Thank you so much to everyone who volunteered. They did an amazing job, and represented YPG incredibly well!",2015-04-20T19:16:51+0000,1019679624726549_1019711318056713,10152475696795779,0
415,408185632542621_1017320054962506,"On the subject of ""Advanced Careers at YPG"", I would like to add my two cents. Because YPG helped me with my career. 
     While I was attending Kofa High, as well as Arizona Western College, I was gearing my future towards Radio Broadcasting, specifically Broadcast Engineering. I took all of the electronics courses Kofa and AWC had to offer as well as the Radio Broadcasting courses and even worked six nights a week at a local radio station. 
     Then, in 1977, my final year at AWC, I was given the opportunity of a life-time with the work-study program with YPG. The work-study program provided me with a Student/Trainee position as a technician in the Velocity & Ballistics Instrumentation group at KOFA Firing range. I got to work with electronics, pressure sensors, strain gauges, optics, Radar, and best of all I got to be around the artillery. The big guns were exciting to me. 
     The work-study program was only for that year, beginning early January and ending late December. At the conclusion of my  internship, I tried my darnedest to get a permanent position with YPG. Unfortunately, my applications were not accepted, and shortly after stint at YPG, I went back into the Radio business. 
     About a year and a half later, I was told about a job opening for an Instrumentation Technician at YPG. But this was not a job working for the U.S. Army, it was a job at the Castle Dome Helipad on the northern edge of the KOFA Firing Range, with Hughes Helicopters. 
     In Aug 1979, I was hired by Hughes Helicopters, and began working with the Instrumentation equipment that was being used to test the YAH-64, the early prototype of the AH-64 Apache Attack Helicopter. 
     In January of 2013, after 33 1/2 years, I retired and walked out of the hanger where we, myself and my co-workers, were installing and calibrating the latest instrumentation equipment in the latest version of the Apache, the AH-64E Longbow Guardian.
It was a rewarding and challenging career, and I still believe that my year working at YPG had a large part of making it possible.",2015-04-17T02:22:29+0000,1017320054962506_1017397621621416,10202593832719719,3
416,408185632542621_1017320054962506,This was a great time had by all. We were even on the channel 5 news as well. The video I believe is public on my page.,2015-04-17T20:59:31+0000,1017320054962506_1017845028243342,10153006811775975,1
417,408185632542621_1017320054962506,(y),2015-04-18T11:54:03+0000,1017320054962506_1018159518211893,10152103738724163,0
418,408185632542621_1016600111701167,I had A Rigger Shop in the second Barrack  across from the field,2015-04-15T17:45:48+0000,1016600111701167_1016680771693101,720397278028644,0
419,408185632542621_1016600111701167,"WOW, I just realized; I served at YPG ('92-'96) as a Chap Asst.  I arrived in Apr '93.  Guess that makes 22 yrs ago.  Just stayed in Yuma.  Time flies.  Great Shot, by the way :)",2015-04-16T04:37:03+0000,1016600111701167_1016933748334470,10203310124209547,0
420,408185632542621_1016600111701167,wow don't look like it did in 1986,2015-05-15T17:40:58+0000,1016600111701167_1033704326657412,10203836175277517,0
421,408185632542621_1016600111701167,Looks a lot different from when I was Provost Marshal there 1971-1973.,2015-07-31T19:33:12+0000,1016600111701167_1084371758257335,1050604938299619,0
422,408185632542621_1016600111701167,I was there in Army met '66-'68.,2016-05-12T12:16:27+0000,1016600111701167_1255598631134646,913017772078887,1
423,408185632542621_1012721485422363,(y),2015-04-09T18:03:36+0000,1012721485422363_1012848232076355,10152103738724163,1
424,408185632542621_1008094735885038,"The real ""Big Bang Theory""!",2015-04-02T21:16:58+0000,1008094735885038_1008115469216298,848281275188177,0
425,408185632542621_1008094735885038,Impressive!,2015-04-03T03:12:56+0000,1008094735885038_1008428342518344,487547684734588,0
426,408185632542621_1003773776317134,thanks for posting TB,2015-03-27T23:51:31+0000,1003773776317134_1004318046262707,10202986153351382,0
427,408185632542621_998325960195249,Nick Cofske,2015-03-17T18:48:48+0000,998325960195249_998422930185552,10203463878135741,0
428,408185632542621_994676393893539,Guy S. Blackwell Junior War.,2015-03-11T16:45:36+0000,994676393893539_994723213888857,10204091360778831,0
429,408185632542621_993925963968582,Alexandria Carns,2015-03-10T23:21:03+0000,993925963968582_994130947281417,10203585141813880,1
430,408185632542621_990947487599763,it looks like they were all ready shaved,2015-03-19T06:08:14+0000,990947487599763_999269823434196,1646293542313820,0
431,408185632542621_987188144642364,I've yet to spot them on the range. I've only seen their droppings or their hoof prints.,2015-02-26T23:44:19+0000,987188144642364_987191237975388,10202681225011380,0
432,408185632542621_987188144642364,Wow would love to see them!!! See hundreds if them up in BC Canada always loved seeing them!,2015-02-26T23:57:01+0000,987188144642364_987194934641685,10201915776636181,0
433,408185632542621_987188144642364,I use to see them around  mittery  lake,2015-02-26T23:59:46+0000,987188144642364_987195671308278,463925127081725,0
434,408185632542621_987188144642364,I remember seeing them in North Cibola years ago....,2015-02-27T13:10:27+0000,987188144642364_987442424616936,10203016299999615,0
435,408185632542621_985008028193709,Over 10 years?  Did he start when he was 12?,2015-02-23T14:59:27+0000,985008028193709_985023384858840,10103397766809972,11
436,408185632542621_985008028193709,Your gun is a big deal the last couple of weeks Patrick Hunt.,2015-02-23T15:08:21+0000,985008028193709_985027218191790,10204403173376607,1
437,408185632542621_985008028193709,That's awesome! Its been 8 years;),2015-02-23T16:26:27+0000,985008028193709_985058301522015,10203964171052730,5
438,408185632542621_985008028193709,"This is awesome, Jered! (y)",2015-02-23T16:45:53+0000,985008028193709_985065338187978,10152103738724163,0
439,408185632542621_985008028193709,Oh that face,2015-02-23T17:02:11+0000,985008028193709_985071458187366,10152660067624735,1
440,408185632542621_985008028193709,Awesome,2015-02-23T18:46:00+0000,985008028193709_985124664848712,487392848067594,1
441,408185632542621_985008028193709,Sweet! The pic does catch his excitment!  Awesome job! ??,2015-02-23T18:51:58+0000,985008028193709_985126451515200,10201906730850506,1
442,408185632542621_985008028193709,Wah-hoo!,2015-02-23T20:07:47+0000,985008028193709_985152274845951,10206159547727117,1
443,408185632542621_985008028193709,Well done!!!  You are the man Jered Ford,2015-02-25T03:32:08+0000,985008028193709_985898681437977,10200461660540203,0
444,408185632542621_982154818479030,It was a tremendous honor meeting this man. He is such an inspiration!,2015-02-20T04:04:49+0000,982154818479030_982475271780318,10205671963468314,1
