,Post_ID,Comment,Created_Time,Comment_ID,Commenter_ID,Likes
445,408185632542621_978551278839384,Had to be a wear test of some drscription,2015-02-12T21:32:00+0000,978551278839384_978568822170963,10153351394944867,1
446,408185632542621_978551278839384,Mike Dickerson,2015-02-12T22:51:50+0000,978551278839384_978590422168803,10103296435254222,0
447,408185632542621_978551278839384,What a picture??!! Lol.,2015-02-13T00:26:16+0000,978551278839384_978618175499361,10201743653073153,0
448,408185632542621_978551278839384,:),2015-02-13T00:58:21+0000,978551278839384_978627058831806,1028937530468501,1
449,408185632542621_978551278839384,Is this your gun Patrick Hunt?,2015-02-13T01:15:27+0000,978551278839384_978638102164035,10204403173376607,0
450,408185632542621_978551278839384,Yep,2015-02-13T01:16:50+0000,978551278839384_978638665497312,10152138560048014,1
451,408185632542621_978551278839384,Where can I get a job doing this? It has awesome written all over it.,2015-02-13T01:59:17+0000,978551278839384_978651828829329,861464543893529,0
452,408185632542621_978551278839384,I have great memories of YPG and its hard working and dedicated employees.  I still miss it ALL.,2015-02-13T02:51:06+0000,978551278839384_978671515494027,736723426372416,2
453,408185632542621_978551278839384,Might be testing to establish tube life and condemnation criteria.  Love to see the impact area after that!,2015-02-13T04:25:34+0000,978551278839384_978699428824569,10151967783217364,0
454,408185632542621_978551278839384,"That does look like a fun job.  Patrick Hunt, what model of howitzer is that?",2015-02-13T04:26:55+0000,978551278839384_978699875491191,10151967783217364,0
455,408185632542621_978551278839384,Heard it in the Foothills,2015-02-13T17:48:08+0000,978551278839384_979039525457226,10202580122734049,0
456,408185632542621_978551278839384,"Wow, I miss it to,  being out there ...",2015-02-14T03:05:00+0000,978551278839384_979268465434332,847864581930336,0
457,408185632542621_978551278839384,"Guy Lofton, T Brown.   My old gunner buddies ??",2015-02-14T15:14:17+0000,978551278839384_979517962076049,959230564128925,1
458,408185632542621_978551278839384,It's an M777 lightweight howitzer. Very impressive weapon.,2015-02-16T19:18:52+0000,978551278839384_980721258622386,930173716999636,0
459,408185632542621_978479158846596,Kenton Nutter,2015-02-16T22:25:49+0000,978479158846596_980793331948512,10152856927038055,1
460,408185632542621_969965306364648,and batteries too?,2015-02-02T17:27:27+0000,969965306364648_973376366023542,215576848567579,0
461,408185632542621_967361939958318,"Sounds interesting.  I didn't see this until 1/23 :-(.  Would the presentation be available online somewhere by chance?  I served in the Army & YPG ('92-'96) .  How's it goin', Mr. Wullenjohn?  GO ARMY!",2015-01-23T12:46:55+0000,967361939958318_967811763246669,10203310124209547,0
462,408185632542621_967361939958318,"The presentations went well -- sorry you missed it!  These presentations are not scheduled for the immediate future, but there are presentations by YPG Heritage Center Director Bill Heidner at the same times at each library on Friday, January 30.  The subject is ""Preparing for War in the Desert Southwest.""  It will be enlightening, interesting, and I hope you can make it.",2015-01-27T17:18:41+0000,967361939958318_969962789698233,408185632542621,0
463,408185632542621_967335709960941,That was one of my favorite jobs! I worked for 1 year (1977) as a Velocity and Ballistics Instrumentation Technician/trainee at the KOFA firing range. A great work experience! Thanks to YPG and AWC.,2015-01-22T23:39:13+0000,967335709960941_967555916605587,10202593832719719,0
464,408185632542621_967335709960941,Reminds me when I worked at Jefferson proving ground,2015-01-23T03:21:13+0000,967335709960941_967648509929661,10202055407098408,0
465,408185632542621_967335709960941,Great photo ??,2015-01-23T23:14:37+0000,967335709960941_968032199891292,829766760407299,0
466,408185632542621_967335709960941,I sure do miss being there.,2015-01-24T05:23:04+0000,967335709960941_968150126546166,997181256980076,0
467,408185632542621_966886846672494,Erick Hurtado,2015-01-21T20:03:34+0000,966886846672494_966920596669119,10205211827721385,1
468,408185632542621_966337370060775,One that truly deserved the pulitzer.,2015-01-21T01:34:17+0000,966337370060775_966561890038323,10202580122734049,0
469,408185632542621_963621586999020,"I was there , it was made by assembling two 16 inch gun tubes together as I recall.",2015-01-16T00:11:34+0000,963621586999020_963684350326077,1086412304707125,0
470,408185632542621_963621586999020,The gun. Michelle Mikel Easley,2015-01-16T01:34:59+0000,963621586999020_963708240323688,10101263436724776,0
471,408185632542621_963621586999020,Damn!!!!,2015-01-16T01:35:48+0000,963621586999020_963708363657009,10203929489413498,0
472,408185632542621_963621586999020,The legendary HARP gun,2015-01-16T03:34:16+0000,963621586999020_963741100320402,1008071645885774,0
473,408185632542621_963621586999020,They said it nicked out windows on base housing,2015-01-16T03:41:50+0000,963621586999020_963743123653533,10204470414473428,0
474,408185632542621_963621586999020,When I was there  I heard it was made to send it into orbit?,2015-01-16T03:43:20+0000,963621586999020_963743526986826,10204470414473428,0
475,408185632542621_963621586999020,Not into orbit. I read that the instrumented projectile went to 110 miles altitude.,2015-01-16T13:07:15+0000,963621586999020_963910340303478,912827475396019,0
476,408185632542621_963621586999020,I think it was 1965-66...Dad and I stepped out on the lawn  9th ave to watch it streaking above at night..What's funny is that I later worked at Kofa Firing Range YPG in 1974-1976...Drove by that cannon everyday day on the firing line out to gun position 18 on the road,2015-12-09T02:07:03+0000,963621586999020_1149713868389790,955407971158555,0
477,408185632542621_959680567393122,We served so others didn't have to!,2015-01-10T09:25:10+0000,959680567393122_960453947315784,848281275188177,0
478,408185632542621_957277190966793,Good to know  :),2015-01-06T23:58:19+0000,957277190966793_957407774287068,10203066833808045,0
479,408185632542621_957277190966793,"Im still gonna get on base sweetie they might be able to keep some people away but ,im gonga and chen chen ( vinny. ) needs me",2015-01-07T00:29:39+0000,957277190966793_957418754285970,10204690560695997,0
480,408185632542621_945869035440942,Beby Herrera,2014-12-23T16:39:58+0000,945869035440942_945907115437134,344678519038237,2
481,408185632542621_945869035440942,Wow! What an important task takes place in Yuma Proving Ground! Thank you for sharing!,2014-12-23T17:32:09+0000,945869035440942_945934312101081,479496262190866,3
482,408185632542621_945869035440942,Great job M&W,2014-12-23T17:34:31+0000,945869035440942_945935368767642,638651979522421,1
483,408185632542621_945869035440942,Love it.,2014-12-23T19:00:46+0000,945869035440942_945969368764242,872495672770332,0
484,408185632542621_945869035440942,"Hmh, that explains the booms.",2014-12-23T19:08:39+0000,945869035440942_945972875430558,10203070596631386,3
485,408185632542621_945869035440942,"Yes , the people that are testing those , are very important people and have too love there job . I am one of the",2014-12-23T21:21:00+0000,945869035440942_946043035423542,978936828805440,0
486,408185632542621_945869035440942,Sorry . I know some of the people they are doing a great job. Also be safe please . AKA GG ??????????????,2014-12-23T21:40:37+0000,945869035440942_946050315422814,978936828805440,0
487,408185632542621_945869035440942,We were wondering.   Thank You !,2014-12-24T00:51:08+0000,945869035440942_946122698748909,10154038184990217,0
488,408185632542621_945869035440942,"Good to know, have been hearing the booms for 3 days.  Thanks",2014-12-24T01:19:28+0000,945869035440942_946130692081443,373163412853148,1
489,408185632542621_945869035440942,I do complain about the seclusion of YPG but I do realize how important YPG is to our guys and helping them utilize every advantage available,2014-12-24T01:20:27+0000,945869035440942_946130915414754,10202676218294758,0
490,408185632542621_945869035440942,Well hot dang!!!!  Ok that is just plain bitchen!!!  BOOM!!!!!!,2014-12-24T02:42:21+0000,945869035440942_946159385411907,10202477793842639,0
491,408185632542621_945869035440942,Thanks Kate!  Like when the planes fly....it will give me chills knowing such an important thing is happening.,2014-12-24T03:08:21+0000,945869035440942_946169235410922,10203366528220543,0
492,408185632542621_945869035440942,"wish all those dumb asses on Yuma Chat could've seen this rather than ask every 5mins....  ""is anyone else hearing those booms""....   ugh,  annoying!",2014-12-24T12:42:56+0000,945869035440942_946405765387269,766033063409728,0
493,408185632542621_945869035440942,M119?,2015-01-07T21:11:16+0000,945869035440942_958630884164757,510577789046324,0
494,408185632542621_942844239076755,"For a smart animal they sure are dumb as well...
Standing next to hwy95 while people are doing 70mph 
I wish there was something that can be done with them
Other than killing them
There a danger to drivers !!",2014-12-18T19:49:17+0000,942844239076755_942922389068940,741729202583925,0
495,408185632542621_942844239076755,I love donkeys. Turns out they're a bunch of smart asses. ??,2014-12-19T13:36:58+0000,942844239076755_943381629023016,934449373235339,0
496,408185632542621_942204039140775,"Yep, it would be a difficult choice. Looks like fun again this year. :D
Merry Christmas!!",2014-12-17T15:39:48+0000,942204039140775_942208375807008,758734044217084,0
497,408185632542621_941175659243613,Hope they stay safe.,2014-12-15T17:30:28+0000,941175659243613_941199885907857,10202958306301133,0
498,408185632542621_934649569896222,New launch time is 5:05am tomorrow (5th Dec). 40% chance of a launch tomorrow due to weather.,2014-12-04T19:17:54+0000,934649569896222_934665379894641,10153006811775975,1
499,408185632542621_934649569896222,Conditions have improved for a 60% chance of a launch tomorrow.,2014-12-04T20:07:31+0000,934649569896222_934682186559627,10153006811775975,0
500,408185632542621_933004270060752,We will actually have a YPG meteorologist Supporting this test out in the middle of the Pacific!!!,2014-12-01T20:23:26+0000,933004270060752_933127153381797,10153006811775975,1
501,408185632542621_929581083736404,Thank you guys so much! Words cannot express the gratitude we have towards you. Many blessings and have a happy thanksgiving,2014-11-26T16:22:47+0000,929581083736404_929590733735439,634950459917332,0
502,408185632542621_929581083736404,Good job #post19,2014-11-27T02:51:42+0000,929581083736404_929832480377931,10152781269096760,0
503,408185632542621_926154337412412,Courtney Fisher Sellers?,2014-11-20T15:14:29+0000,926154337412412_926156807412165,10202917013040493,0
504,408185632542621_926154337412412,Awwwww John Fisher. Thank you Heather Sweet for Sharing. Annie Fisher,2014-11-20T15:17:02+0000,926154337412412_926157980745381,10153399714629167,1
505,408185632542621_926154337412412,"Proud of my grandson ,love you John Fisher",2014-11-20T16:59:08+0000,926154337412412_926203670740812,195046027332578,0
506,408185632542621_926154337412412,Way to go John Fisher.,2014-11-20T17:12:37+0000,926154337412412_926208287407017,10200929796166213,0
507,408185632542621_926154337412412,Big John Fisher!,2014-11-20T18:49:12+0000,926154337412412_926241967403649,10204635845194390,0
508,408185632542621_918428931518286,(y),2014-11-06T14:29:02+0000,918428931518286_918448158183030,10152103738724163,0
509,408185632542621_918428931518286,I remember when Marines tested and evaluated the Light Armored Vehicle aboard YPG. Great times and memories aboard YPG along with all the wonderful staff. Special thanks to Yolie Canales and Mireya Rodriguez for all the support and help they provided our Marines of LAT-TD during our tour of duty at YPG. Semper Fi !!!,2014-11-06T19:06:56+0000,918428931518286_918558094838703,10200798563925075,2
510,408185632542621_918428931518286,"Thanks, O.J. for your compliments. It was a pleasure supporting you all during you all were on board!!! Yolie",2014-11-06T20:14:13+0000,918428931518286_918583398169506,408185632542621,1
511,408185632542621_918428931518286,Thank you for doing the testing and for placing such a high value on doing so.  We need you!,2014-11-21T17:02:55+0000,918428931518286_926743430686836,508864655913547,1
512,408185632542621_917340374960475,(y),2014-11-04T14:54:26+0000,917340374960475_917407854953727,10152103738724163,0
513,408185632542621_914441928583653,Look at M & W!!!!!!!,2014-10-30T21:51:32+0000,914441928583653_914456091915570,471625699642013,1
514,408185632542621_914441928583653,"Kurt Christ, what did you dress up as? An aerostat??",2014-10-30T22:14:27+0000,914441928583653_914464575248055,678752238868947,1
515,408185632542621_914441928583653,So much fun!! ??,2014-10-31T01:55:11+0000,914441928583653_914604931900686,10204717072872537,0
516,408185632542621_912484485446064,Donald Paul Davis,2014-10-27T16:36:13+0000,912484485446064_912487518779094,10205211827721385,2
517,408185632542621_912484485446064,Jesse Adams,2014-10-27T16:50:04+0000,912484485446064_912495072111672,10155107132705314,1
518,408185632542621_912484485446064,"In 1977, I was enrolled at AWC and participated in a Work/Study program at YPG. I was employed full-time (40 hours per week) for one year as a Velocity & Ballistics Instrumentation Technician at Kofa Firing Range.
That valuable experience at Yuma Proving Grounds led to my employment 2 1/2 years later, as a Flight Test Instrumentation Technician with Hughes Helicopters at Castle Dome Helipad. 
I stuck with that position in Instrumentation on the Apache Advanced Attack Helicopter program through 2 changes of companies and retired after 33 1/2 years.
Thanks to YPG & AWC for providing me with the skills for a successful career.",2014-10-27T20:42:43+0000,912484485446064_912593408768505,10202593832719719,6
519,408185632542621_912484485446064,"The engineer is Donald Paul Davis, my son of course.",2014-10-28T01:04:22+0000,912484485446064_912694535425059,343848262461495,1
520,408185632542621_908656909162155,Where were these events held ?,2014-10-20T15:03:54+0000,908656909162155_908676712493508,634950459917332,0
521,408185632542621_908656909162155,Ashlee:  They were held at various locations at YPG. -- Chuck,2014-10-20T15:08:59+0000,908656909162155_908678695826643,408185632542621,0
522,408185632542621_908656909162155,Do you invite the community or is it only for certain individuals?,2014-10-20T16:17:04+0000,908656909162155_908713452489834,10204211749628108,1
523,408185632542621_908656909162155,The Hispanic Month activities were primarily held for YPG employees.  The facilities would have been too small if we had invited the community ...,2014-10-20T22:53:31+0000,908656909162155_908879965806516,408185632542621,2
524,408185632542621_906355326058980,I wouldn't miss it.  They are awesome. Can't wait to hear them again.,2014-10-16T17:03:36+0000,906355326058980_906369772724202,10206497303926184,3
525,408185632542621_906355326058980,"Diana Villa
Kay Turner Nunez",2014-10-16T17:37:27+0000,906355326058980_906381546056358,10203463878135741,2
526,408185632542621_906050362756143,Where do we register?,2014-10-16T01:00:24+0000,906050362756143_906081319419714,255582494638070,0
527,408185632542621_906050362756143,Is there a map of the route?,2014-10-16T01:55:14+0000,906050362756143_906096499418196,10205230048621168,0
528,408185632542621_906050362756143,"Come on Airborne, draw a line around Cox Field and repeat 19 times!",2014-10-16T04:16:45+0000,906050362756143_906135786080934,10203385146890206,0
529,408185632542621_905248369503009,Way cool,2014-10-15T02:07:42+0000,905248369503009_905557759472070,10205644986069911,0
530,408185632542621_900690876625425,My dad was here on the original testing at castle dome. Pretty proud of him the Apache is a beast and has saved many lives,2014-10-07T21:23:23+0000,900690876625425_900806546613858,965559746790008,3
531,408185632542621_900690876625425,...and here we still are brother lol,2014-10-08T13:55:38+0000,900690876625425_901206536573859,10152781269096760,0
532,408185632542621_900690876625425,Two mike mikes from the old hangars,2014-10-08T14:09:53+0000,900690876625425_901217466572766,965559746790008,1
533,408185632542621_900690876625425,Just down the road a bit.,2014-10-08T16:35:48+0000,900690876625425_901305459897300,10202580122734049,0
534,408185632542621_896675483693631,Beautiful.,2014-10-02T13:56:30+0000,896675483693631_897190150308831,10206497303926184,0
535,408185632542621_890347220993124,Yes we do (y) :-),2014-09-18T23:55:18+0000,890347220993124_890379257656587,10152103738724163,0
536,408185632542621_887000574661122,:-(,2014-09-12T00:12:23+0000,887000574661122_887010717993441,10202681225011380,0
537,408185632542621_887000574661122,Thanks for the post and concern over the horses and burros.,2014-09-12T00:18:38+0000,887000574661122_887012357993277,508864655913547,0
538,408185632542621_887000574661122,Juliet Dominguez!!! Our burritos!!! :(,2014-09-12T00:42:05+0000,887000574661122_887019344659245,10203173410870765,2
539,408185632542621_887000574661122,"Now, I gotta locate those mile markers :o)",2014-09-12T01:02:34+0000,887000574661122_887025674658612,10204242592973188,1
540,408185632542621_887000574661122,Oh no :( Jennifer Davis this is terrible!,2014-09-12T01:29:50+0000,887000574661122_887033254657854,677962771406,0
541,408185632542621_887000574661122,"I used to love seeing these beautiful creatures during my family's stay at YPG, 1966-73. We were always careful driving whenever we saw them anywhere near the road. As a horse lover since my toddler days, I was always thrilled to see them...",2014-09-12T01:55:26+0000,887000574661122_887040184657161,794077353938399,0
542,408185632542621_887000574661122,"Had to be careful when pulling into the driveway at night, the horses would sleep in the front yard of our duplex.",2014-09-12T02:12:24+0000,887000574661122_887047914656388,1013490305332498,1
543,408185632542621_887000574661122,How sad,2014-09-12T17:08:55+0000,887000574661122_887323404628839,690048191056386,0
544,408185632542621_887000574661122,Thanks for sharing. I'm sure lots of people didn't know or have forgotten.,2014-09-13T23:45:57+0000,887000574661122_887924464568733,10153218477164199,0
545,408185632542621_880947301933116,"Pastor Gladys Henderson-Williams, check this out??",2014-09-02T16:43:37+0000,880947301933116_881008515260328,10204242592973188,0
546,408185632542621_880947301933116,OMG I HAVE to get this picture with the write up.  OMG OMG.,2014-09-02T16:56:41+0000,880947301933116_881015175259662,10207171125294201,0
547,408185632542621_880947301933116,LOL! Knew you would like this!,2014-09-03T06:09:39+0000,880947301933116_881341205227059,10204242592973188,0
548,408185632542621_878569982170848,Hueys!,2014-08-28T19:03:31+0000,878569982170848_878620508832462,10152647919849283,0
549,408185632542621_874363635924816,Sean Easley this is cool.,2014-08-21T21:20:33+0000,874363635924816_874546545906525,10101263436724776,1
550,408185632542621_874363635924816,Nice,2014-08-21T21:21:14+0000,874363635924816_874547202573126,10204781241562441,0
551,408185632542621_874363635924816,"I was working at YPG at this time, and remember all the excitement about President Bush's jump there.",2014-08-22T05:49:56+0000,874363635924816_874708079223705,10204054431860786,0
552,408185632542621_873249676036212,One of the many wonders YPG has to offer,2014-08-19T17:46:34+0000,873249676036212_873265366034643,908854385796407,0
553,408185632542621_873249676036212,Apc or small ww1/2 tank's ,2014-08-19T17:52:07+0000,873249676036212_873268166034363,1812038749078680,0
554,408185632542621_873249676036212,Could be the remnants of an old dwelling. Stone cabin looks a lot like that.  Was it a range in the past? Was there a water source near by at some point? Markings or identifiable artifacts near by? Lots of questions need to be answered.,2014-08-19T17:57:25+0000,873249676036212_873270452700801,965559746790008,0
555,408185632542621_873249676036212,There was training out towards Kofa during WWll.,2014-08-19T18:46:34+0000,873249676036212_873303079364205,10203413902301475,0
556,408185632542621_873249676036212,Someone with a lot of time on their hands,2014-08-19T18:48:05+0000,873249676036212_873303662697480,1028937530468501,0
557,408185632542621_873249676036212,Looks like some kind of shelter.,2014-08-19T20:31:01+0000,873249676036212_873365816024598,10152025685546921,0
558,408185632542621_873249676036212,Delores Gauna,2014-08-20T03:32:00+0000,873249676036212_873593896001790,670226296412778,0
559,408185632542621_873249676036212,Some of Patton's History,2014-08-20T04:31:24+0000,873249676036212_873628515998328,881407411899256,0
560,408185632542621_873249676036212,It was Patton history practice look it up,2014-08-20T21:39:22+0000,873249676036212_874017819292731,463925127081725,0
561,408185632542621_873249676036212,Was it a shelter from sun?,2014-08-21T20:08:28+0000,873249676036212_874522762575570,10203018951541863,0
562,408185632542621_866335940060919,coolness,2014-08-08T04:12:14+0000,866335940060919_866651950029318,215576848567579,0
563,408185632542621_864707666890413,Great story,2014-08-04T15:01:22+0000,864707666890413_864716360222877,706408422747871,0
564,408185632542621_862728547088325,I will miss you old buddy!,2014-07-31T23:44:50+0000,862728547088325_862762797084900,848281275188177,0
565,408185632542621_862728547088325,"Thank you Jeff.. Was cool work'n with you during the time I was there at the ""Helpdesk"".. Good luck in retirement..",2014-08-01T18:17:11+0000,862728547088325_863135390380974,10201538646138356,0
566,408185632542621_861971747164005,Pretty cool John,2014-07-31T01:57:54+0000,861971747164005_862295477131632,10202881866271733,0
567,408185632542621_861971747164005,Iain Baird,2014-08-03T14:32:56+0000,861971747164005_864164426944737,10152491644300222,1
568,408185632542621_861971747164005,The drop test model looks like a big hershey kiss LoL,2014-08-03T22:00:34+0000,861971747164005_864343563593490,974196552597588,0
569,408185632542621_861971747164005,Iain--a very EXPENSIVE Hershey's Kiss... ;),2014-10-07T06:45:01+0000,861971747164005_900405156653997,663954380321124,0
570,408185632542621_860892040605309,A Place In The Sun :D,2014-07-29T03:42:48+0000,860892040605309_861228660571647,10204054431860786,0
571,408185632542621_858652407495939,Yes indeed,2014-07-24T21:38:18+0000,858652407495939_858773330817180,727224370676502,1
572,408185632542621_857232324304614,I have only seen those on Army installations; Fort Lee and Fort Pickett. What are they??  Matt Remember?,2014-07-21T23:21:26+0000,857232324304614_857272070967306,10103193349249982,0
573,408185632542621_857232324304614,Imagine the crunch when stepping in that thing!,2014-07-22T01:48:29+0000,857232324304614_857319610962552,10210454213454175,0
574,408185632542621_857232324304614,"I am from Belize, We call these Hercules Beetles. Recognize by the mandibles and center horn.. They are leaf cutters and ground scroungers. You should see the Rhino beetles, the Army Ants or the 8 foot tall Termite mounds in the jungle. Or maybe the big black Belizean Tarantulas.",2014-07-22T05:54:05+0000,857232324304614_857398534287993,848281275188177,1
575,408185632542621_857232324304614,My students in Japan kept those beetles as pets!,2014-07-22T20:13:54+0000,857232324304614_857699234257923,395427043811442,1
576,408185632542621_857232324304614,Taste NOT like Chicken,2014-07-23T21:22:25+0000,857232324304614_858213254206521,10201630311944410,1
577,408185632542621_849210538440126,"Yes it is very True, I spend a few years there as a Parachute Riger",2014-07-07T15:13:39+0000,849210538440126_849238998437280,720397278028644,0
578,408185632542621_849210538440126,1985-86. Airborne Test.,2014-07-07T16:52:43+0000,849210538440126_849289898432190,855047857841778,0
579,408185632542621_849210538440126,"Tom, I will jump any rig that you sign off on; love you man!",2014-07-07T17:15:33+0000,849210538440126_849301135097733,10205304654401960,0
580,408185632542621_849210538440126,"Awesome!!  You guys are the ""Backbone"" of ATF!!!",2014-07-07T20:09:19+0000,849210538440126_849372971757216,10203385146890206,0
581,408185632542621_849210538440126,Awesome! Mark I believe in want you are doing. I will take a shot of jumping with you one time........ It could be my last.  Ha ha,2014-07-08T01:53:44+0000,849210538440126_849509335076913,707313482717170,0
